Start Time,End Time,Sentence,Corrected Sentence,Translation,Emotion,Intensity
"00:00:00,000","00:00:06,000","No, tía, no, no, ¿por qué haces eso?","No, tía, no, no, ¿por qué haces eso?","No, aunt, no, no, why are you doing that?",confusion,moderate
"00:00:06,000","00:00:12,000","Nunca he pensado en ser infiel, hasta ahora.","Nunca he pensado en ser infiel, hasta ahora.","I have never thought about being unfaithful, until now.",realization,intense
"00:00:12,000","00:00:14,000","Es que no lo entiendo, tía.","Es que no lo entiendo, tía.","I don't understand it, Aunt.",confusion,moderate
"00:00:16,000","00:00:17,000",Es que no lo reconozco.,Es que no lo reconozco.,I do not recognize it.,confusion,mild
"00:00:17,000","00:00:19,000","Normal, normal.","Normal, normal.","Normal, normal.",neutral,neutral
"00:00:19,000","00:00:20,000","El geno es mi novio, tía.","El geno es mi novio, tía.","The Geno is my boyfriend, Aunt.",neutral,neutral
"00:00:20,000","00:00:24,000","Ay, ay, ay, ay, ay, ay, ay, ay, ay, ay, ay.","Ay, ay, ay, ay, ay, ay, ay, ay, ay, ay, ay.",Error 500 (Server Error)!!1500.That’s an error.There was an error. Please try again later.That’s all we know.,annoyance,mild
"00:00:24,000","00:00:27,000","Yo creo que no es una trola, tía, que le gustas.","Yo creo que no es una trola, tía, que le gustas.","I think it's not a trolley, aunt, like you.",confusion,mild
"00:00:28,000","00:00:30,000",Se van a liar.,Se van a liar.,If you go to the liar.,disapproval,moderate
"00:00:44,000","00:00:47,000",Te has dado cuenta que la quieres más de lo que tú piensas.,Te has dado cuenta que la quieres más de lo que tú piensas.,You have realized that you love her more than you think.,realization,intense
"00:00:47,000","00:00:51,000",Y que no puedes perderla y empezar tu vida sin ella.,Y que no puedes perderla y empezar tu vida sin ella.,And you can't lose her and start your life without her.,fear,intense
"00:00:53,000","00:00:55,000","¿Dónde es la pareja más bonita, eh?","¿Dónde es la pareja más bonita, eh?","Where is the most beautiful couple, huh?",curiosity,mild
"00:00:56,000","00:00:57,000",¿La nuestra o no?,¿La nuestra o no?,Ours or not?,curiosity,mild
"00:01:00,000","00:01:02,000","Dime qué pasa, no he dicho nada.","Dime qué pasa, no he dicho nada.","Tell me what happens, I haven't said anything.",curiosity,moderate
"00:01:02,000","00:01:04,000","Nico, Nico, no podéis hablar.","Nico, Nico, no podéis hablar.","Nico, Nico, you can't talk.",disapproval,moderate
"00:01:08,000","00:01:11,000","Creo que es el momento perfecto, ya te lo digo yo.","Creo que es el momento perfecto, ya te lo digo yo.","I think it's the perfect moment, I already tell you.",optimism,moderate
"00:01:25,000","00:01:49,000","No, fue un polvo, es una toma de contacto.","No, fue un polvo, es una toma de contacto.","No, it was a dust, it is a contact.",confusion,mild
"00:01:49,000","00:01:51,000",Yo no quiero que me vean ahí mirándome el polvo de mi vida.,Yo no quiero que me vean ahí mirándome el polvo de mi vida.,I do not want to see me there looking at my dust of my life.,embarrassment,moderate
"00:01:56,000","00:01:58,000",¿Cuándo fue la última vez que os visteis?,¿Cuándo fue la última vez que os visteis?,When was the last time you saw yourself?,curiosity,mild
"00:01:58,000","00:01:59,000",Octubre.,Octubre.,October.,neutral,neutral
"00:01:59,000","00:02:00,000",¿Y qué pasó entre vosotros?,¿Y qué pasó entre vosotros?,And what happened among you?,curiosity,moderate
"00:02:00,000","00:02:02,000",Me encontré con Álvaro en una discoteca.,Me encontré con Álvaro en una discoteca.,I met Álvaro in a disco.,neutral,neutral
"00:02:02,000","00:02:03,000",Junto a él pasamos una noche juntos.,Junto a él pasamos una noche juntos.,Next to him we spent a night together.,neutral,neutral
"00:02:03,000","00:02:04,000",David sabe lo que hay.,David sabe lo que hay.,David knows what there is.,neutral,neutral
"00:02:04,000","00:02:07,000","Nosotros en ese momento no estábamos como pareja,","Nosotros en ese momento no estábamos como pareja,","We were not as a couple at that time,",neutral,neutral
"00:02:07,000","00:02:08,000",nos lo contamos y punto.,nos lo contamos y punto.,We tell ourselves and period.,neutral,neutral
"00:02:11,000","00:02:14,000","A mí lo que me duele es que mi novio lo va a ver, tío.","A mí lo que me duele es que mi novio lo va a ver, tío.","What hurts me is that my boyfriend will see him, uncle.",fear,intense
"00:02:14,000","00:02:16,000",¿Cómo me da ganas de que tú estés aquí?,¿Cómo me da ganas de que tú estés aquí?,How do you want you to be here?,confusion,mild
"00:02:16,000","00:02:17,000",Me duele.,Me duele.,It hurts me.,sadness,intense
"00:02:17,000","00:02:20,000","Pruebas esta conexión con una persona que,","Pruebas esta conexión con una persona que,","Tests this connection with a person who,",curiosity,mild
"00:02:20,000","00:02:22,000",te juro por Dios que yo tampoco.,te juro por Dios que yo tampoco.,I swear to God that either.,disapproval,moderate
"00:02:22,000","00:02:24,000","Me gusta mucho, cada día más.","Me gusta mucho, cada día más.","I really like it, every day.",desire,moderate
"00:02:26,000","00:02:27,000",¿Te estás dejando llevar?,¿Te estás dejando llevar?,Are you getting carried away?,curiosity,moderate
"00:02:27,000","00:02:29,000","Me estoy dejando llevar por lo que siento,","Me estoy dejando llevar por lo que siento,","I'm getting carried away by what I feel,",realization,moderate
"00:02:29,000","00:02:32,000",y siento que no le tengo que poner juegos a mi novia ni de coña.,y siento que no le tengo que poner juegos a mi novia ni de coña.,And I feel that I don't have to put my girlfriend or pussy games.,disapproval,intense
"00:02:32,000","00:02:33,000",Me gusta mucho Moni.,Me gusta mucho Moni.,I really like Moni.,desire,moderate
"00:02:33,000","00:02:39,000","Nunca he pensado en ser infiel, hasta ahora.","Nunca he pensado en ser infiel, hasta ahora.","I have never thought about being unfaithful, until now.",realization,intense
"00:02:39,000","00:02:43,000",Yo a veces me enfado porque no entretengo al 100%.,Yo a veces me enfado porque no entretengo al 100%.,Sometimes I get angry because I don't entertain 100%.,annoyance,moderate
"00:02:45,000","00:02:47,000","Chicos, bienvenidos a la hoguera.","Chicos, bienvenidos a la hoguera.","Boys, welcome to the bonfire.",neutral,neutral
"00:02:47,000","00:02:50,000",Álvaro fue un punto de inflexión en mi relación.,Álvaro fue un punto de inflexión en mi relación.,Álvaro was a turning point in my relationship.,realization,intense
"00:02:50,000","00:02:53,000","No me preocupa absolutamente nada porque María se ríe de él,","No me preocupa absolutamente nada porque María se ríe de él,","I am absolutely worried about anything because Maria laughs at him,",nervousness,intense
"00:02:53,000","00:02:55,000","y él hace caso, pues sería surrealista.","y él hace caso, pues sería surrealista.","And he listens, he would be surreal.",confusion,mild
"00:02:56,000","00:02:58,000","Pero qué pollas, tío.","Pero qué pollas, tío.","But what cock, uncle.",annoyance,moderate
"00:02:58,000","00:03:00,000","No me gusta que lleguen a la cama,","No me gusta que lleguen a la cama,","I don't like them get to bed,",disapproval,intense
"00:03:00,000","00:03:03,000",porque debajo de las sábanas la noche es muy traicionera.,porque debajo de las sábanas la noche es muy traicionera.,Because under the sheets the night is very treacherous.,fear,intense
"00:03:03,000","00:03:05,000",No creo que quieras hacer un borrón y ya está.,No creo que quieras hacer un borrón y ya está.,I don't think you want to make a blur and that's it.,disapproval,moderate
"00:03:05,000","00:03:06,000",Sí.,Sí.,Yeah.,neutral,neutral
"00:03:06,000","00:03:07,000",¿Sí?,¿Sí?,Yeah?,curiosity,mild
"00:03:07,000","00:03:08,000",Yo soy así.,Yo soy así.,I am like that.,neutral,neutral
"00:03:08,000","00:03:09,000",Te saco de mi vida para siempre.,Te saco de mi vida para siempre.,I take you out of my life forever.,anger,intense
"00:03:09,000","00:03:11,000","Pero estoy yendo a la pinza, no sé qué coño ha visto,","Pero estoy yendo a la pinza, no sé qué coño ha visto,","But I'm going to the clamp, I don't know what the hell he has seen,",confusion,moderate
"00:03:11,000","00:03:12,000","porque no ha visto nada,","porque no ha visto nada,","Because he has not seen anything,",annoyance,mild
"00:03:12,000","00:03:14,000",y está hablando de unas formas de mí que no voy a permitir,y está hablando de unas formas de mí que no voy a permitir,And he is talking about some forms that I will not allow,anger,moderate
"00:03:14,000","00:03:15,000",y no tengo ganas de estar aquí.,y no tengo ganas de estar aquí.,And I don't feel like being here.,disappointment,mild
"00:03:16,000","00:03:19,000",¿Es solo Napoli el que busca a Ana?,¿Es solo Napoli el que busca a Ana?,Is it only Napoli who is looking for Ana?,curiosity,mild
"00:03:19,000","00:03:21,000","Sí, yo veo que es él.","Sí, yo veo que es él.","Yes, I see that it is.",realization,neutral
"00:03:21,000","00:03:22,000",¿Seguro?,¿Seguro?,"""SAFE?",confusion,mild
"00:03:24,000","00:03:26,000",Me cago en mi puta madre.,Me cago en mi puta madre.,I shit in my fucking mother.,anger,intense
"00:03:26,000","00:03:28,000","Me cago en mi puta madre, tío.","Me cago en mi puta madre, tío.","I shit in my mother fucking, uncle.",anger,intense
"00:03:28,000","00:03:31,000",Los dos habéis mantenido relaciones sexuales,Los dos habéis mantenido relaciones sexuales,You have both had sex,surprise,moderate
"00:03:31,000","00:03:32,000",en la isla de las tentaciones.,en la isla de las tentaciones.,on the island of temptations.,neutral,neutral
"00:03:32,000","00:03:33,000","Sí, correcto.","Sí, correcto.","Yes, correct.",neutral,neutral
"00:03:33,000","00:03:35,000",¿Entonces por qué estás tan enfadado?,¿Entonces por qué estás tan enfadado?,So why are you so angry?,curiosity,mild
"00:03:35,000","00:03:37,000","Porque yo lo he hecho, porque ella se ha liado con él","Porque yo lo he hecho, porque ella se ha liado con él","Because I have done it, because she has struck him",remorse,moderate
"00:03:37,000","00:03:38,000",desde el primer día.,desde el primer día.,From the first day.,realization,neutral
"00:03:38,000","00:03:40,000","Te vas a reír de mí, me río yo de ti.","Te vas a reír de mí, me río yo de ti.","You're going to laugh at me, I laugh at you.",,
"00:03:40,000","00:03:43,000",Este es el collar del Beto.,Este es el collar del Beto.,This is Beto's necklace.,neutral,neutral
"00:03:43,000","00:03:46,000","Hemos decidido vetar a Álvaro,","Hemos decidido vetar a Álvaro,","We have decided to veto Álvaro,",disapproval,mild
"00:03:46,000","00:03:49,000","porque como ya han tenido algo antes,","porque como ya han tenido algo antes,","because as they have had something before,",neutral,neutral
"00:03:49,000","00:03:50,000",quizás eso es más peligroso.,quizás eso es más peligroso.,Maybe that's more dangerous.,fear,mild
"00:03:51,000","00:03:53,000","Chicas, bienvenidas a la hoguera.","Chicas, bienvenidas a la hoguera.","Girls, welcome to the bonfire.",neutral,neutral
"00:03:55,000","00:03:57,000","¡Qué asco, hijo, qué asco!","¡Qué asco, hijo, qué asco!","What a disgust, son, how disgust!",disgust,intense
"00:03:57,000","00:03:58,000",¡Madre mía!,¡Madre mía!,My mother!,surprise,moderate
"00:04:00,000","00:04:01,000",¡Me cago en mi rata!,¡Me cago en mi rata!,I shit on my rat!,anger,intense
"00:04:01,000","00:04:02,000",¡Que era mi novio!,¡Que era mi novio!,That was my boyfriend!,surprise,intense
"00:04:02,000","00:04:03,000","¿La habéis visto, mi novio?","¿La habéis visto, mi novio?","Have you seen her, my boyfriend?",confusion,moderate
"00:04:03,000","00:04:04,000",Sí.,Sí.,Yeah.,neutral,neutral
"00:04:04,000","00:04:05,000","¿Qué va, tío?","¿Qué va, tío?","What's going, uncle?",confusion,mild
"00:04:05,000","00:04:06,000",¿Qué va?,¿Qué va?,What's going?,confusion,mild
"00:04:06,000","00:04:07,000","¡Déjame, déjame, déjame!","¡Déjame, déjame, déjame!","Let me, leave me, leave me!",anger,intense
"00:04:12,000","00:04:13,000","Páratela, tía.","Páratela, tía.","Pararatela, aunt.",annoyance,mild
"00:04:13,000","00:04:14,000","Páratela, tía.","Páratela, tía.","Pararatela, aunt.",annoyance,mild
"00:04:26,000","00:04:28,000","¿Qué guarrería es esta, tío?","¿Qué guarrería es esta, tío?","What dirty is this, uncle?",disgust,moderate
"00:04:32,000","00:04:34,000","Que no puedo con esto, tío, que no puedo con esto.","Que no puedo con esto, tío, que no puedo con esto.","I can't with this, uncle, I can't with this.",,
"00:04:35,000","00:04:37,000",¿De qué los he visto dándose un beso y ya?,¿De qué los he visto dándose un beso y ya?,What have I seen giving them a kiss and already?,confusion,moderate
"00:04:39,000","00:04:41,000","Marieta, por favor, me gustaría que volvieras a la hoguera.","Marieta, por favor, me gustaría que volvieras a la hoguera.","Marieta, please, I would like you to return to the bonfire.",caring,mild
"00:04:44,000","00:04:45,000",¡Ah!,¡Ah!,¡Ah!,surprise,mild
"00:04:56,000","00:04:58,000","Es que se me duermen las putas manos, macho.","Es que se me duermen las putas manos, macho.","It is that the whores hands, male.",disgust,moderate
"00:04:59,000","00:05:00,000",Que me mares de verdad.,Que me mares de verdad.,That really sees me.,confusion,mild
"00:05:01,000","00:05:02,000","Relájate, amor.","Relájate, amor.","Relax, love.",caring,mild
"00:05:03,000","00:05:05,000","Marieta, por favor, atiéndeme.","Marieta, por favor, atiéndeme.","Marieta, please, take care of me.",caring,moderate
"00:05:07,000","00:05:09,000",Tienes que ser paciente.,Tienes que ser paciente.,You have to be patient.,caring,mild
"00:05:10,000","00:05:12,000",Todavía no has visto imágenes de Álex.,Todavía no has visto imágenes de Álex.,You haven't seen Álex images yet.,neutral,neutral
"00:05:13,000","00:05:14,000",Es el turno de María.,Es el turno de María.,It is Maria's turn.,neutral,neutral
"00:05:15,000","00:05:16,000",Tendrás tiempo de verlas.,Tendrás tiempo de verlas.,You will have time to see them.,neutral,neutral
"00:05:18,000","00:05:20,000","Trata de estar tranquila, por favor.","Trata de estar tranquila, por favor.","Try to be calm, please.",caring,mild
"00:05:21,000","00:05:22,000","Lo siento, de verdad, María, lo siento.","Lo siento, de verdad, María, lo siento.","I'm really sorry, Maria, I'm sorry.",remorse,moderate
"00:05:23,000","00:05:24,000","Lo siento, mi Álex.","Lo siento, mi Álex.","Sorry, my Álex.",remorse,moderate
"00:05:25,000","00:05:26,000",Lo siento.,Lo siento.,I'm sorry.,remorse,mild
"00:05:28,000","00:05:29,000",No sé estar.,No sé estar.,I don't know how to be.,confusion,moderate
"00:05:30,000","00:05:31,000",Lo quiero mucho.,Lo quiero mucho.,I love him very much.,love,intense
"00:05:33,000","00:05:34,000","Lo siento por esto, que no...","Lo siento por esto, que no...","I'm sorry for this, no ...",remorse,mild
"00:05:41,000","00:05:42,000","María, cuéntame, por favor,","María, cuéntame, por favor,","Maria, tell me, please,",curiosity,mild
"00:05:43,000","00:05:45,000",¿qué es lo que te han parecido estas imágenes?,¿qué es lo que te han parecido estas imágenes?,What have these images like?,curiosity,moderate
"00:05:47,000","00:05:48,000",Es que me he quedado ya...,Es que me he quedado ya...,I have already stayed ...,neutral,neutral
"00:05:49,000","00:05:51,000",descolocada por lo que hemos visto por detrás.,descolocada por lo que hemos visto por detrás.,Decolored by what we have seen from behind.,confusion,moderate
"00:05:53,000","00:05:54,000",Pero...,Pero...,But...,neutral,neutral
"00:05:55,000","00:05:56,000",¿Cómo ves a David?,¿Cómo ves a David?,How do you see David?,curiosity,mild
"00:05:57,000","00:05:58,000","Siendo David, se está pasando muy bien.","Siendo David, se está pasando muy bien.","Being David, he is having a great time.",amusement,mild
"00:05:59,000","00:06:01,000","Le encanta la isla de la asentación, yo creo.","Le encanta la isla de la asentación, yo creo.","He loves the island of settlement, I believe.",optimism,mild
"00:06:02,000","00:06:04,000",¿Te preocupa la conexión entre David y Zahira?,¿Te preocupa la conexión entre David y Zahira?,Are you worried about the connection between David and Zahira?,curiosity,moderate
"00:06:05,000","00:06:07,000","Me preocupa, Sandra, que cuando llegue aquí,","Me preocupa, Sandra, que cuando llegue aquí,","I worry, Sandra, that when I get here,",nervousness,moderate
"00:06:08,000","00:06:09,000",yo no pueda perdonarle,yo no pueda perdonarle,I can't forgive him,disappointment,intense
"00:06:10,000","00:06:11,000",y no me pueda sacar las imágenes de la cabeza.,y no me pueda sacar las imágenes de la cabeza.,And I can't get the images out of my head.,,
"00:06:11,000","00:06:12,000","Por muy poco que, según él,","Por muy poco que, según él,","No matter how little that, according to him,",annoyance,mild
"00:06:13,000","00:06:14,000","porque eso sí, después él dirá...","porque eso sí, después él dirá...","Because yes, then he will say ...",annoyance,mild
"00:06:15,000","00:06:16,000","No, si no he hecho nada, si no sé qué,","No, si no he hecho nada, si no sé qué,","No, if I haven't done anything, if I don't know what,",confusion,moderate
"00:06:17,000","00:06:18,000",que le conozco ya.,que le conozco ya.,I know him now.,realization,moderate
"00:06:19,000","00:06:21,000",Y me está jodiendo muchísimo la actitud que tiene.,Y me está jodiendo muchísimo la actitud que tiene.,And the attitude he has is fucking a lot.,anger,intense
"00:06:22,000","00:06:23,000",María.,María.,María.,neutral,neutral
"00:06:25,000","00:06:26,000",Hay más imágenes para ti.,Hay más imágenes para ti.,There are more images for you.,neutral,neutral
"00:06:29,000","00:06:30,000",Madre mía.,Madre mía.,My mother.,surprise,mild
"00:06:32,000","00:06:33,000",Con el niño que pierde el tiempo.,Con el niño que pierde el tiempo.,With the child who wasting time.,disapproval,mild
"00:06:34,000","00:06:36,000","No, no me pidas perdón, Jordi, no me pidas perdón.","No, no me pidas perdón, Jordi, no me pidas perdón.","No, don't ask me for forgiveness, Jordi, don't ask me for forgiveness.",anger,intense
"00:06:37,000","00:06:38,000","No me pidas perdón por esto, nunca más.","No me pidas perdón por esto, nunca más.","Do not ask me forgiveness for this, never again.",anger,intense
"00:06:39,000","00:06:40,000","Nunca, nunca.","Nunca, nunca.","Never, never.",anger,intense
"00:06:42,000","00:06:43,000",¡Anda!,¡Anda!,¡You!,anger,intense
"00:06:50,000","00:06:51,000","Está llorando, llorando.","Está llorando, llorando.","He is crying, crying.",sadness,intense
"00:06:52,000","00:06:53,000","¡Uy, qué mal se lo pasa!","¡Uy, qué mal se lo pasa!","Oh, what's wrong to have it!",confusion,moderate
"00:06:56,000","00:06:57,000",¿Hola?,¿Hola?,Hello?,neutral,neutral
"00:06:58,000","00:06:59,000",¿Hola?,¿Hola?,Hello?,neutral,neutral
"00:07:01,000","00:07:02,000",Dame cosquillitas así.,Dame cosquillitas así.,Give me tickling like that.,amusement,mild
"00:07:03,000","00:07:04,000",¿Hola?,¿Hola?,Hello?,neutral,neutral
"00:07:05,000","00:07:06,000",¿Hola?,¿Hola?,Hello?,neutral,neutral
"00:07:07,000","00:07:08,000",¿Hola?,¿Hola?,Hello?,neutral,neutral
"00:07:09,000","00:07:10,000",¿Hola?,¿Hola?,Hello?,neutral,neutral
"00:07:11,000","00:07:12,000","Dame cosquillitas, dígelo.","Dame cosquillitas, dígelo.","Give me tickles, tell me.",amusement,mild
"00:07:13,000","00:07:14,000",Tú no estás enamorado en tu vida.,Tú no estás enamorado en tu vida.,You are not in love in your life.,disapproval,mild
"00:07:16,000","00:07:17,000","Ni tú, ni tú.","Ni tú, ni tú.","In pour, loose.",confusion,mild
"00:07:19,000","00:07:20,000",¿Tú sí?,¿Tú sí?,You yes?,curiosity,mild
"00:07:21,000","00:07:22,000",No.,No.,No.,neutral,neutral
"00:07:23,000","00:07:24,000",¿No?,¿No?,¿No?,curiosity,mild
"00:07:34,000","00:07:35,000",¿Hola?,¿Hola?,Hello?,neutral,neutral
"00:07:42,000","00:07:44,000","Qué retrasados son, tío, es que...","Qué retrasados son, tío, es que...","How delayed they are, uncle, is that ...",annoyance,moderate
"00:07:46,000","00:07:47,000","Vaya personaje, tío.","Vaya personaje, tío.","What a character, uncle.",disapproval,mild
"00:07:48,000","00:07:49,000",Madre mía.,Madre mía.,My mother.,surprise,mild
"00:07:51,000","00:07:52,000",Que se la tire ya.,Que se la tire ya.,Let him throw it out now.,annoyance,moderate
"00:07:53,000","00:07:55,000","Si es que se la ha tirado ya casi, ¿qué le falta?","Si es que se la ha tirado ya casi, ¿qué le falta?","If you have thrown it almost, what do you lack?",curiosity,mild
"00:07:56,000","00:07:57,000","¿Qué le falta, Sandra?","¿Qué le falta, Sandra?","What is missing, Sandra?",curiosity,mild
"00:07:58,000","00:07:59,000","Y después dice,","Y después dice,","And then he says,",neutral,neutral
"00:08:00,000","00:08:01,000",¿has estado una vez enamorada en tu vida?,¿has estado una vez enamorada en tu vida?,Have you been in love with your life?,curiosity,mild
"00:08:02,000","00:08:03,000","Y le dice él, no.","Y le dice él, no.","And he tells him, no.",disappointment,mild
"00:08:04,000","00:08:05,000","Entonces, ¿qué haces aquí?","Entonces, ¿qué haces aquí?",So what are you doing here?,confusion,moderate
"00:08:06,000","00:08:07,000",Mentiroso.,Mentiroso.,Liar.,anger,intense
"00:08:07,000","00:08:08,000",No quiero llorar por él más.,No quiero llorar por él más.,I don't want to cry for him more.,sadness,moderate
"00:08:09,000","00:08:10,000",Mentiroso de mierda.,Mentiroso de mierda.,Shit liar.,anger,intense
"00:08:12,000","00:08:14,000","Si no está enamorado, ¿qué coño hace aquí?","Si no está enamorado, ¿qué coño hace aquí?","If you are not in love, what the hell is here?",confusion,moderate
"00:08:15,000","00:08:16,000",¿Y a mí por qué me dice que sí?,¿Y a mí por qué me dice que sí?,And why tells me yes?,confusion,moderate
"00:08:17,000","00:08:18,000",¿Para qué me miente?,¿Para qué me miente?,What do you lie for?,annoyance,moderate
"00:08:19,000","00:08:21,000","Me está dando mucho asco, mucha pena y mucho todo.","Me está dando mucho asco, mucha pena y mucho todo.","It is giving me a lot of disgust, a lot of sorrow and a lot.",disgust,intense
"00:08:22,000","00:08:23,000",Todo junto.,Todo junto.,Everything together.,neutral,neutral
"00:08:24,000","00:08:26,000",Pero esa no es la persona a la que yo me enamoré.,Pero esa no es la persona a la que yo me enamoré.,But that is not the person I fell in love with.,disappointment,intense
"00:08:31,000","00:08:32,000","No, tía.","No, tía.","No, aunt.",disapproval,mild
"00:08:33,000","00:08:34,000",¿Qué haces?,¿Qué haces?,What are you doing?,confusion,moderate
"00:08:34,000","00:08:35,000",El tonto.,El tonto.,The fool.,disapproval,mild
"00:08:36,000","00:08:37,000","El tonto es el que hace, el tonto.","El tonto es el que hace, el tonto.","The fool is the one who does, the fool.",disapproval,moderate
"00:08:38,000","00:08:39,000",¿Y por qué me lo hace a mí?,¿Y por qué me lo hace a mí?,And why does it do it to me?,confusion,moderate
"00:08:40,000","00:08:42,000",Tiene la puta oportunidad de demostrarte y no hace un...,Tiene la puta oportunidad de demostrarte y no hace un...,He has the fucking chance to show you and does not do a ...,annoyance,intense
"00:08:43,000","00:08:44,000","Me va a cambiar en su puta vida, tío.","Me va a cambiar en su puta vida, tío.","He will change me in his fucking life, uncle.",anger,intense
"00:08:45,000","00:08:46,000",En su puta vida va a cambiar este tío.,En su puta vida va a cambiar este tío.,In his fucking life this uncle will change.,anger,intense
"00:08:48,000","00:08:50,000",Que no tenía que haber estado con un chico como él.,Que no tenía que haber estado con un chico como él.,That he didn't have to have been with a boy like him.,disapproval,moderate
"00:08:54,000","00:08:55,000","Voy de tonto en tonto, chaval.","Voy de tonto en tonto, chaval.","I'm dumb in silly, kid.",neutral,neutral
"00:08:56,000","00:08:57,000",Es que me encanta.,Es que me encanta.,I love it.,love,intense
"00:08:58,000","00:08:59,000","¿Por qué estás así, María?","¿Por qué estás así, María?","Why are you like this, Maria?",confusion,mild
"00:09:01,000","00:09:02,000",Quiero que no escoche nada.,Quiero que no escoche nada.,I want nothing to scarce.,desire,moderate
"00:09:03,000","00:09:05,000",Creo que no es consciente de lo que está haciendo,Creo que no es consciente de lo que está haciendo,I think he is not aware of what he is doing,confusion,mild
"00:09:06,000","00:09:08,000",y cuando sea consciente se va a dar un puto golpe de realidad,y cuando sea consciente se va a dar un puto golpe de realidad,"And when he is aware, he will take a fucking blow of reality",anger,intense
"00:09:09,000","00:09:10,000",que no se lo va a creer ni él.,que no se lo va a creer ni él.,That he will not believe it or him.,,
"00:09:11,000","00:09:13,000",Y yo lo que no voy a hacer es comerme esto,Y yo lo que no voy a hacer es comerme esto,And what I'm not going to do is eat this,optimism,intense
"00:09:14,000","00:09:15,000","y encima salir de aquí con él, ya te lo digo yo.","y encima salir de aquí con él, ya te lo digo yo.","And I get out of here with him, I already tell you.",optimism,intense
