Start Time,End Time,Sentence,Corrected Sentence,Translation,Emotion,Intensity
"00:07:51,000","00:08:00,000","And that's certainly our house, but then we have two other ones. Your second oldest daughter's Gianna, right? Yeah. Oh, so she really is like Anna. You gave her the name. Yeah, how about that, huh?","And that's certainly our house, but then we have two other ones. Your second oldest daughter's Gianna, right? Yeah. Oh, so she really is like Anna. You gave her the name. Yeah, how about that, huh?","And that's certainly our house, but then we have two other ones. Your second oldest daughter's Gianna, right? Yeah. Oh, so she really is like Anna. You gave her the name. Yeah, how about that, huh?",amusement,mild
"00:08:00,000","00:08:21,000","She was, and correct me if I have anything this wrong, but you had a game, and it was a playoff game against the Suns. Yeah. You tied the game, went into overtime, and then you scored, like, six seconds left. Then you raced to the delivery room, and later that evening, like early in the morning, your daughter was born.","She was, and correct me if I have anything this wrong, but you had a game, and it was a playoff game against the Suns. Yeah. You tied the game, went into overtime, and then you scored, like, six seconds left. Then you raced to the delivery room, and later that evening, like early in the morning, your daughter was born.","She was, and correct me if I have anything this wrong, but you had a game, and it was a playoff game against the Suns. Yeah. You tied the game, went into overtime, and then you scored, like, six seconds left. Then you raced to the delivery room, and later that evening, like early in the morning, your daughter was born.",excitement,moderate
"00:08:22,000","00:08:37,000","That sounds about right. OK. It was either that night or, like, the day after. I can't remember exactly. Did you know your wife was in labor while you were playing the game? No, like, it didn't happen during the game. It happened after. I see. So there's no thought, like, maybe I'll miss this one and head home.","That sounds about right. OK. It was either that night or, like, the day after. I can't remember exactly. Did you know your wife was in labor while you were playing the game? No, like, it didn't happen during the game. It happened after. I see. So there's no thought, like, maybe I'll miss this one and head home.","That sounds about right. OK. It was either that night or, like, the day after. I can't remember exactly. Did you know your wife was in labor while you were playing the game? No, like, it didn't happen during the game. It happened after. I see. So there's no thought, like, maybe I'll miss this one and head home.",curiosity,mild
"00:08:38,000","00:08:54,000","Instead of sending the game to overtime. Maybe overtime's not a good idea in the long run. Yeah. Yeah. Yeah. No, unfortunately, that wasn't the situation. You would have played 10 overtimes if it came down to it, would you not? No. No.","Instead of sending the game to overtime. Maybe overtime's not a good idea in the long run. Yeah. Yeah. Yeah. No, unfortunately, that wasn't the situation. You would have played 10 overtimes if it came down to it, would you not? No. No.","Instead of sending the game to overtime. Maybe overtime's not a good idea in the long run. Yeah. Yeah. Yeah. No, unfortunately, that wasn't the situation. You would have played 10 overtimes if it came down to it, would you not? No. No.",amusement,mild
"00:08:54,000","00:09:04,000","Nope. You're no dummy. Hey, mama mentality upside my head.","Nope. You're no dummy. Hey, mama mentality upside my head.","Nope. You're no dummy. Hey, mama mentality upside my head.",amusement,mild
"00:09:24,000","00:09:44,000","Right. And Shaq took, did he take offense to that? Yeah, a little bit. Yeah, a little bit. But you know, but here's the thing, though, like, it was really a compliment. Like, people missed the whole first half of that, in which I said he was the most dominant player I've ever seen, and I felt like he could have been the greatest of all time.","Right. And Shaq took, did he take offense to that? Yeah, a little bit. Yeah, a little bit. But you know, but here's the thing, though, like, it was really a compliment. Like, people missed the whole first half of that, in which I said he was the most dominant player I've ever seen, and I felt like he could have been the greatest of all time.","Right. And Shaq took, did he take offense to that? Yeah, a little bit. Yeah, a little bit. But you know, but here's the thing, though, like, it was really a compliment. Like, people missed the whole first half of that, in which I said he was the most dominant player I've ever seen, and I felt like he could have been the greatest of all time.",admiration,moderate
"00:09:44,000","00:09:59,000","Mm hmm. So people kind of missed that part of it. Yeah. Caught on to the lazy part. Yeah, right. That was like, no, it's kind of said that tongue in cheek. Like, we weren't going to win 12 rings, nor were we going to play that long together. But it's, but it's all good, man. I love it.","Mm hmm. So people kind of missed that part of it. Yeah. Caught on to the lazy part. Yeah, right. That was like, no, it's kind of said that tongue in cheek. Like, we weren't going to win 12 rings, nor were we going to play that long together. But it's, but it's all good, man. I love it.","Mm hmm. So people kind of missed that part of it. Yeah. Caught on to the lazy part. Yeah, right. That was like, no, it's kind of said that tongue in cheek. Like, we weren't going to win 12 rings, nor were we going to play that long together. But it's, but it's all good, man. I love it.",amusement,mild
"00:10:00,000","00:10:01,000","Now, what happens after that?","Now, what happens after that?","Now, what happens after that?",curiosity,mild
"00:10:01,000","00:10:03,000","Do you go, oh, boy, I better call him?","Do you go, oh, boy, I better call him?","Do you go, oh, boy, I better call him?",curiosity,mild
"00:10:03,000","00:10:04,000",Or does he call you?,Or does he call you?,Or does he call you?,curiosity,mild
"00:10:04,000","00:10:05,000",How does it work?,How does it work?,How does it work?,curiosity,mild
"00:10:05,000","00:10:07,000","No, I reach out to him.","No, I reach out to him.","No, I reach out to him.",neutral,neutral
"00:10:07,000","00:10:08,000",You reach out to him.,You reach out to him.,You reach out to him.,neutral,neutral
"00:10:08,000","00:10:10,000",He's more sensitive than I am.,He's more sensitive than I am.,He's more sensitive than I am.,neutral,neutral
"00:10:10,000","00:10:11,000",Did you text him?,Did you text him?,Did you text him?,curiosity,mild
"00:10:11,000","00:10:12,000",I did. I did.,I did. I did.,I did. I did.,neutral,neutral
"00:10:12,000","00:10:14,000",And what did you say in the text?,And what did you say in the text?,And what did you say in the text?,curiosity,mild
"00:10:14,000","00:10:16,000","Like, hey, ha, ha, ha, ha.","Like, hey, ha, ha, ha, ha.","Like, hey, ha, ha, ha, ha.",amusement,mild
"00:10:16,000","00:10:17,000",No.,No.,No.,neutral,neutral
"00:10:17,000","00:10:21,000","It's like, hey, you know.","It's like, hey, you know.","It's like, hey, you know.",neutral,neutral
"00:10:21,000","00:10:26,000","I said, listen, no hard feelings.","I said, listen, no hard feelings.","I said, listen, no hard feelings.",neutral,neutral
"00:10:26,000","00:10:28,000","You know, it's easier for you to say no hard feelings.","You know, it's easier for you to say no hard feelings.","You know, it's easier for you to say no hard feelings.",neutral,neutral
"00:10:28,000","00:10:30,000",You're the one who insulted him.,You're the one who insulted him.,You're the one who insulted him.,neutral,neutral
"00:10:30,000","00:10:32,000","Well, did I, though?","Well, did I, though?","Well, did I, though?",curiosity,mild
"00:10:32,000","00:10:34,000",I don't know.,I don't know.,I don't know.,confusion,mild
"00:10:34,000","00:10:36,000",But you know what you should have texted?,But you know what you should have texted?,But you know what you should have texted?,curiosity,mild
"00:10:36,000","00:10:38,000",You up?,You up?,You up?,amusement,mild
"00:10:38,000","00:10:40,000","Say, you know, I'm going to work out right now.","Say, you know, I'm going to work out right now.","Say, you know, I'm going to work out right now.",neutral,neutral
"00:10:40,000","00:10:43,000",I know you like to sleep.,I know you like to sleep.,I know you like to sleep.,neutral,neutral
"00:10:43,000","00:10:44,000","But what I did say, though, is I said,","But what I did say, though, is I said,","But what I did say, though, is I said,",neutral,neutral
"00:10:44,000","00:10:46,000","you know, I'll be tuning in to his son","you know, I'll be tuning in to his son","you know, I'll be tuning in to his son",neutral,neutral
"00:10:46,000","00:10:48,000",playing at UCLA this year.,playing at UCLA this year.,playing at UCLA this year.,neutral,neutral
"00:10:48,000","00:10:51,000",You better shoot the damn ball 30 times.,You better shoot the damn ball 30 times.,You better shoot the damn ball 30 times.,annoyance,moderate
"00:10:51,000","00:10:53,000",I better not see him pass once.,I better not see him pass once.,I better not see him pass once.,annoyance,moderate
"00:10:53,000","00:10:56,000","Yeah, and he posted photographs of himself","Yeah, and he posted photographs of himself","Yeah, and he posted photographs of himself",neutral,neutral
"00:10:56,000","00:10:57,000",like dunking on 12 guys.,like dunking on 12 guys.,like dunking on 12 guys.,admiration,moderate
"00:10:58,000","00:11:00,000","You know, he's like, does this look lazy?","You know, he's like, does this look lazy?","You know, he's like, does this look lazy?",amusement,mild
"00:11:00,000","00:11:01,000",Yeah.,Yeah.,Yeah.,neutral,neutral
"00:11:01,000","00:11:02,000",It looked dominant.,It looked dominant.,It looked dominant.,admiration,moderate
"00:11:02,000","00:11:03,000",Things are good.,Things are good.,Things are good.,optimism,mild
"00:11:03,000","00:11:05,000",Things are OK between you again.,Things are OK between you again.,Things are OK between you again.,relief,mild
"00:11:05,000","00:11:07,000",Do you guys ever hang out together?,Do you guys ever hang out together?,Do you guys ever hang out together?,curiosity,mild
"00:11:07,000","00:11:08,000",I don't have time.,I don't have time.,I don't have time.,neutral,neutral
"00:11:08,000","00:11:09,000",What about LeBron?,What about LeBron?,What about LeBron?,curiosity,mild
"00:11:09,000","00:11:09,000",Neither does he.,Neither does he.,Neither does he.,neutral,neutral
"00:11:09,000","00:11:10,000",Taco Tuesday.,Taco Tuesday.,Taco Tuesday.,amusement,mild
"00:11:10,000","00:11:12,000",Have you been to Taco Tuesday?,Have you been to Taco Tuesday?,Have you been to Taco Tuesday?,curiosity,mild
"00:11:12,000","00:11:13,000",I have not.,I have not.,I have not.,neutral,neutral
"00:11:13,000","00:11:16,000","No, well, I've been living in LA for like 20 years.","No, well, I've been living in LA for like 20 years.","No, well, I've been living in LA for like 20 years.",neutral,neutral
"00:11:16,000","00:11:17,000",Right.,Right.,Right.,neutral,neutral
"00:11:17,000","00:11:18,000","I'm married to a Latina, so.","I'm married to a Latina, so.","I'm married to a Latina, so.",neutral,neutral
"00:11:18,000","00:11:19,000","You've been to your own Taco Tuesday,","You've been to your own Taco Tuesday,","You've been to your own Taco Tuesday,",neutral,neutral
"00:11:19,000","00:11:22,000",but to LeBron's Taco Tuesday that he,but to LeBron's Taco Tuesday that he,but to LeBron's Taco Tuesday that he,curiosity,mild
"00:11:22,000","00:11:24,000",loses his mind over every week.,loses his mind over every week.,loses his mind over every week.,amusement,moderate
"00:11:24,000","00:11:27,000","Every week, it's like a holiday has happened.","Every week, it's like a holiday has happened.","Every week, it's like a holiday has happened.",amusement,moderate
"00:11:27,000","00:11:29,000","Man, listen, everybody has their thing, bro.","Man, listen, everybody has their thing, bro.","Man, listen, everybody has their thing, bro.",neutral,neutral
"00:11:29,000","00:11:30,000","Like, you know, that's just.","Like, you know, that's just.","Like, you know, that's just.",neutral,neutral
"00:11:30,000","00:11:31,000","No, I'm fine with Taco Tuesday.","No, I'm fine with Taco Tuesday.","No, I'm fine with Taco Tuesday.",neutral,neutral
"00:11:31,000","00:11:32,000",That's going to get him going.,That's going to get him going.,That's going to get him going.,amusement,mild
"00:11:32,000","00:11:33,000",It gets him going.,It gets him going.,It gets him going.,amusement,mild
"00:11:33,000","00:11:34,000",It's awesome.,It's awesome.,It's awesome.,excitement,mild
"00:11:34,000","00:11:37,000",Do you take any role in encouraging guys,Do you take any role in encouraging guys,Do you take any role in encouraging guys,curiosity,mild
"00:11:37,000","00:11:41,000","like, oh, LeBron, you know, Lakers free agents","like, oh, LeBron, you know, Lakers free agents","like, oh, LeBron, you know, Lakers free agents",curiosity,mild
"00:11:41,000","00:11:44,000","to come to Los Angeles, other than maybe a tweet","to come to Los Angeles, other than maybe a tweet","to come to Los Angeles, other than maybe a tweet",curiosity,mild
"00:11:44,000","00:11:45,000",or something like that?,or something like that?,or something like that?,curiosity,mild
"00:11:45,000","00:11:46,000","No, no, no, I stay away from it.","No, no, no, I stay away from it.","No, no, no, I stay away from it.",neutral,neutral
"00:11:46,000","00:11:49,000","You know, I'm real close with Rob, obviously.","You know, I'm real close with Rob, obviously.","You know, I'm real close with Rob, obviously.",neutral,neutral
"00:11:49,000","00:11:50,000","Uh-huh, Rob Planka, yeah.","Uh-huh, Rob Planka, yeah.","Uh-huh, Rob Plaka, yea.",neutral,neutral
"00:11:50,000","00:11:53,000",So we'll talk often just as a sounding board for him.,So we'll talk often just as a sounding board for him.,So we'll talk often just as a sounding board for him.,neutral,neutral
"00:11:53,000","00:11:56,000","Would you be allowed to do that, or would Rob get fined","Would you be allowed to do that, or would Rob get fined","Would you be allowed to do that, or would Rob get fined",curiosity,mild
"00:11:56,000","00:11:57,000",if you were to do something like that?,if you were to do something like that?,if you were to do something like that?,curiosity,mild
"00:11:57,000","00:11:58,000","No, I can do that.","No, I can do that.","No, I can do that.",neutral,neutral
"00:11:58,000","00:11:59,000",You could do it.,You could do it.,You could do it.,neutral,neutral
"00:11:59,000","00:12:01,000","So you could be his surrogate, and you could","So you could be his surrogate, and you could","So you could be his surrogate, and you could",curiosity,mild
"00:12:01,000","00:12:03,000",actually reach out to.,actually reach out to.,actually reach out to.,curiosity,mild
"00:12:03,000","00:12:05,000","Hey, I could, but I won't.","Hey, I could, but I won't.","Hey, I could, but I won't.",neutral,neutral
"00:12:05,000","00:12:06,000",You won't.,You won't.,You won't.,curiosity,mild
"00:12:06,000","00:12:07,000",No.,No.,No.,neutral,neutral
"00:12:07,000","00:12:09,000",Why won't you?,Why won't you?,Why won't you?,curiosity,mild
"00:12:09,000","00:12:10,000","Well, I know.","Well, I know.","Well, I know.",neutral,neutral
"00:12:10,000","00:12:12,000","I stay away from that stuff, man.","I stay away from that stuff, man.","I stay away from that stuff, man.",neutral,neutral
"00:12:12,000","00:12:14,000","Like, Rob is more than capable of handling","Like, Rob is more than capable of handling","Like, Rob is more than capable of handling",approval,mild
"00:12:14,000","00:12:17,000",the job and all the pressure that comes along with that.,the job and all the pressure that comes along with that.,the job and all the pressure that comes along with that.,neutral,neutral
"00:12:17,000","00:12:20,000","You know, I'm quick to tell him, listen, man, you're my guy,","You know, I'm quick to tell him, listen, man, you're my guy,","You know, I'm quick to tell him, listen, man, you're my guy,",caring,moderate
"00:12:20,000","00:12:22,000",but you didn't get on the court and score 40 points for me,but you didn't get on the court and score 40 points for me,but you didn't get on the court and score 40 points for me,annoyance,mild
"00:12:22,000","00:12:25,000","either, so like, I'm not going to do your job for you.","either, so like, I'm not going to do your job for you.","either, so like, I'm not going to do your job for you.",annoyance,moderate
"00:12:25,000","00:12:30,000","Did he say, I would have if I could do that?","Did he say, I would have if I could do that?","Did he say, I would have if I could do that?",curiosity,mild
"00:12:30,000","00:12:32,000","No, man, like, we have a great relationship.","No, man, like, we have a great relationship.","No, man, like, we have a great relationship.",caring,moderate
"00:12:32,000","00:12:35,000","So we'll talk and stuff and, you know, just as friends,","So we'll talk and stuff and, you know, just as friends,","So we'll talk and stuff and, you know, just as friends,",neutral,neutral
"00:12:35,000","00:12:36,000",but nothing serious.,but nothing serious.,but nothing serious.,neutral,neutral
"00:12:36,000","00:12:38,000",Were you surprised that Kawhi Leonard chose the Clippers,Were you surprised that Kawhi Leonard chose the Clippers,Were you surprised that Kawhi Leonard chose the Clippers,curiosity,mild
"00:12:38,000","00:12:41,000",over the Lakers?,over the Lakers?,over the Lakers?,curiosity,mild
"00:12:41,000","00:12:42,000",Sure.,Sure.,Sure.,neutral,neutral
"00:12:42,000","00:12:43,000","You were, yeah.","You were, yeah.","You were, yeah.",neutral,neutral
"00:12:43,000","00:12:45,000","You thought he was going to go to the Lakers, yeah.","You thought he was going to go to the Lakers, yeah.","You thought he was going to go to the Lakers, yeah.",curiosity,mild
"00:12:45,000","00:12:46,000",Sure.,Sure.,Sure.,neutral,neutral
"00:12:46,000","00:12:47,000",Yeah.,Yeah.,Yeah.,neutral,neutral
"00:12:47,000","00:12:50,000","Who will go farther in the playoffs, the Lakers","Who will go farther in the playoffs, the Lakers","Who will go farther in the playoffs, the Lakers",curiosity,mild
"00:12:50,000","00:12:51,000",or the Clippers this season?,or the Clippers this season?,or the Clippers this season?,curiosity,mild
"00:12:51,000","00:12:55,000","Uh, it depends.","Uh, it depends.","Uh, it depends.",neutral,neutral
"00:12:55,000","00:12:58,000","And I say that not to be kind of cheeky about it,","And I say that not to be kind of cheeky about it,","And I say that not to be kind of cheeky about it,",neutral,neutral
"00:12:58,000","00:13:01,000","but like, injuries has played such a huge part.","but like, injuries has played such a huge part.","but like, injuries has played such a huge part.",realization,moderate
"00:13:01,000","00:13:03,000",Let's say both teams are beautifully,Let's say both teams are beautifully,Let's say both teams are beautifully,optimism,mild
"00:13:03,000","00:13:04,000",healthy from here on out.,healthy from here on out.,healthy from here on out.,optimism,mild
"00:13:04,000","00:13:05,000",A lot of ifs.,A lot of ifs.,A lot of ifs.,neutral,neutral
"00:13:05,000","00:13:06,000","Yeah, a lot of ifs.","Yeah, a lot of ifs.","Yeah, a lot of ifs.",neutral,neutral
"00:13:06,000","00:13:07,000","Yeah, a lot of ifs.","Yeah, a lot of ifs.","Yeah, a lot of ifs.",neutral,neutral
"00:13:07,000","00:13:10,000","You know, the cousins got hurt, but let's say the, yeah.","You know, the cousins got hurt, but let's say the, yeah.","You know, the cousins got hurt, but let's say the, yeah.",neutral,neutral
"00:13:10,000","00:13:12,000","And what is, is Houston healthy as well?","And what is, is Houston healthy as well?","And what is, is Houston healthy as well?",curiosity,mild
"00:13:12,000","00:13:14,000",Golden State healthy as well?,Golden State healthy as well?,Golden State healthy as well?,curiosity,mild
"00:13:14,000","00:13:15,000","Like, we're just doing a whole everybody's","Like, we're just doing a whole everybody's","Like, we're just doing a whole everybody's",neutral,neutral
"00:13:15,000","00:13:16,000",healthy type of thing.,healthy type of thing.,healthy type of thing.,neutral,neutral
"00:13:16,000","00:13:18,000","That LA rivalry, who goes farther?","That LA rivalry, who goes farther?","That LA rivalry, who goes farther?",curiosity,mild
"00:13:18,000","00:13:19,000","Well, I can't say who's going to go farther,","Well, I can't say who's going to go farther,","Well, I can't say who's going to go farther,",neutral,neutral
"00:13:19,000","00:13:21,000",because what if they're playing an injured Houston Rockets,because what if they're playing an injured Houston Rockets,because what if they're playing an injured Houston Rockets,curiosity,mild
"00:13:21,000","00:13:24,000",team and James can't play?,team and James can't play?,team and James can't play?,curiosity,mild
"00:13:24,000","00:13:25,000","Or what if they're playing, you know,","Or what if they're playing, you know,","Or what if they're playing, you know,",curiosity,mild
"00:13:25,000","00:13:27,000",an injured Golden State team?,an injured Golden State team?,an injured Golden State team?,curiosity,mild
"00:13:27,000","00:13:29,000",Can't you just play along with my game?,Can't you just play along with my game?,Can't you just play along with my game?,annoyance,mild
"00:13:29,000","00:13:30,000",No.,No.,No.,neutral,neutral
"00:13:30,000","00:13:31,000","No, I cannot.","No, I cannot.","No, I cannot.",neutral,neutral
"00:13:31,000","00:13:32,000",I cannot. I cannot.,I cannot. I cannot.,I cannot. I cannot.,neutral,neutral
"00:13:32,000","00:13:34,000","There's too many variables, my man.","There's too many variables, my man.","There's too many variables, my man.",realization,moderate
"00:13:34,000","00:13:36,000","Like, I got to kind of think through this thing","Like, I got to kind of think through this thing","Like, I got to kind of think through this thing",neutral,neutral
"00:13:36,000","00:13:36,000",to give you a.,to give you a.,to give you a.,neutral,neutral
"00:13:36,000","00:13:38,000","Oh, thinking is overrated, Kobe.","Oh, thinking is overrated, Kobe.","Oh, thinking is overrated, Kobe.",amusement,mild
"00:13:38,000","00:13:41,000",You know that.,You know that.,You know that.,neutral,neutral
"00:13:41,000","00:13:43,000","We had a lot of fun, and we've got much more","We had a lot of fun, and we've got much more","We had a lot of fun, and we've got much more",amusement,mild
"00:13:43,000","00:13:44,000",with Kobe to share.,with Kobe to share.,with Kobe to share.,neutral,neutral
"00:13:44,000","00:13:46,000",And if you would like to remember,And if you would like to remember,And if you would like to remember,neutral,neutral
"00:13:46,000","00:13:49,000","Kobe in a philanthropic way, please make a donation","Kobe in a philanthropic way, please make a donation","Kobe in a philanthropic way, please make a donation",caring,moderate
"00:13:49,000","00:13:53,000","to kvbff.org, the Kobe and Vanessa Bryant Family","to kvbff.org, the Kobe and Vanessa Bryant Family","to kvbff.org, the Kobe and Vanessa Bryant Family",neutral,neutral
"00:13:53,000","00:13:54,000",Foundation.,Foundation.,Foundation.,neutral,neutral
"00:13:54,000","00:13:58,000",Help them help kids here in Los Angeles and all over the world.,Help them help kids here in Los Angeles and all over the world.,Help them help kids here in Los Angeles and all over the world.,caring,moderate
"00:13:58,000","00:14:01,000","When we return, we will see Kobe and his Lakers teammates","When we return, we will see Kobe and his Lakers teammates","When we return, we will see Kobe and his Lakers teammates",neutral,neutral
"00:14:01,000","00:14:08,000",just after they won his fourth NBA title back in 2009.,just after they won his fourth NBA title back in 2009.,just after they won his fourth NBA title back in 2009.,pride,moderate
"00:14:08,000","00:14:09,000",Play center?,Play center?,Play center?,curiosity,mild
"00:14:09,000","00:14:10,000","No, guard.","No, guard.","No, guard.",neutral,neutral
"00:14:10,000","00:14:10,000",You play guard?,You play guard?,You play guard?,curiosity,mild
"00:14:10,000","00:14:11,000",Yes.,Yes.,Yes.,neutral,neutral
"00:14:11,000","00:14:11,000",That's surprising.,That's surprising.,That's surprising.,surprise,mild
"00:14:11,000","00:14:13,000",I think a man of your size would play center.,I think a man of your size would play center.,I think a man of your size would play center.,curiosity,mild
"00:14:13,000","00:14:14,000","Well, I play only with Mexican guys.","Well, I play only with Mexican guys.","Well, I play only with Mexican guys.",neutral,neutral
"00:14:14,000","00:14:17,000","Oh, OK.","Oh, OK.","Oh, OK.",neutral,neutral
"00:14:18,000","00:14:19,000",So you can win the championship.,So you can win the championship.,So you can win the championship.,optimism,mild
"00:14:19,000","00:14:22,000",I'm going to give you a high five Mexican.,I'm going to give you a high five Mexican.,I'm going to give you a high five Mexican.,amusement,mild
"00:14:22,000","00:14:23,000",OK.,OK.,OK.,neutral,neutral
"00:14:23,000","00:14:23,000",All right.,All right.,All right.,neutral,neutral
"00:14:23,000","00:14:24,000",Thank you.,Thank you.,Thank you.,gratitude,mild
"00:14:24,000","00:14:25,000","Thank you, Kobe Bryant.","Thank you, Kobe Bryant.","Thank you, Kobe Bryant.",gratitude,mild
"00:14:25,000","00:14:25,000",Good luck.,Good luck.,Good luck.,optimism,mild
