Start Time,End Time,Sentence,Corrected Sentence,Translation,Emotion,Intensity
"01:31:58,000","01:32:00,000",momento en todo lo nuestro pero,momento en todo lo nuestro pero,moment in everything ours but,neutral,neutral
"01:32:00,000","01:32:01,000",me hubiera encantado que lo,me hubiera encantado que lo,I would have loved that,desire,mild
"01:32:01,000","01:32:02,000",hubiera hecho sin ver eso.,hubiera hecho sin ver eso.,I would have done without seeing that.,disappointment,mild
"01:32:04,000","01:32:07,000",Chicos chicas ya conocéis la,Chicos chicas ya conocéis la,Girl guys you already know the,neutral,neutral
"01:32:07,000","01:32:08,000",decisión de quién ha sido la,decisión de quién ha sido la,decision of who has been the,neutral,neutral
"01:32:08,000","01:32:10,000",soltera vetada pero ahora chicas,soltera vetada pero ahora chicas,Single vetoed but now girls,neutral,neutral
"01:32:10,000","01:32:11,000",os pido por favor que me dejéis,os pido por favor que me dejéis,I ask you please leave me,annoyance,mild
"01:32:11,000","01:32:12,000",a solas con los chicos.,a solas con los chicos.,alone with the boys.,neutral,neutral
"01:32:19,000","01:32:21,000",Chicos necesito hablar a solas,Chicos necesito hablar a solas,Boys I need to speak alone,neutral,neutral
"01:32:21,000","01:32:24,000",con vosotros porque os veo muy,con vosotros porque os veo muy,With you because I see you very,neutral,neutral
"01:32:24,000","01:32:26,000",bajos y algunos de vosotros no,bajos y algunos de vosotros no,Low and some of you do not,neutral,neutral
"01:32:26,000","01:32:27,000",estáis nada bien.,estáis nada bien.,You are well well.,neutral,neutral
"01:32:28,000","01:32:30,000",Eso está a punto de cambiar.,Eso está a punto de cambiar.,That is about to change.,optimism,mild
"01:32:32,000","01:32:34,000",Chicos uno de vosotros va a,Chicos uno de vosotros va a,Guys one of you is going to,neutral,neutral
"01:32:34,000","01:32:35,000",poder ver hoy.,poder ver hoy.,Being able to see today.,neutral,neutral
"01:32:36,000","01:32:38,000",A su novia durante tres,A su novia durante tres,To his girlfriend for three,neutral,neutral
"01:32:39,000","01:32:40,000",minutos.,minutos.,minutes.,neutral,neutral
"01:32:44,000","01:32:46,000",Será frente al espejo no podréis,Será frente al espejo no podréis,It will be in front of the mirror you will not be able to,neutral,neutral
"01:32:46,000","01:32:48,000","hablar, pero podréis expresar a","hablar, pero podréis expresar a","talk, but you can express",neutral,neutral
"01:32:48,000","01:32:50,000",través de vuestro mirada todo lo,través de vuestro mirada todo lo,Through your gaze everything,neutral,neutral
"01:32:50,000","01:32:53,000","que sentís, pero como siempre","que sentís, pero como siempre","What do you feel, but as always",neutral,neutral
"01:32:53,000","01:32:54,000",tenéis que poneros de acuerdo.,tenéis que poneros de acuerdo.,You have to agree.,neutral,neutral
"01:32:54,000","01:32:55,000",Os doy un minuto para que,Os doy un minuto para que,I give you a minute for,neutral,neutral
"01:32:55,000","01:32:58,000",decidáis quién de vosotros va a,decidáis quién de vosotros va a,You decide who of you is going to,neutral,neutral
"01:32:58,000","01:32:59,000",poder ver a su chica.,poder ver a su chica.,Being able to see his girl.,neutral,neutral
"01:32:59,000","01:33:00,000",Adelante.,Adelante.,Forward.,neutral,neutral
"01:33:01,000","01:33:02,000","Chicos, yo querría.","Chicos, yo querría.","Boys, I would like.",neutral,neutral
"01:33:04,000","01:33:07,000",Hay un descompensado ahí que yo,Hay un descompensado ahí que yo,There is a decompensated there that I,confusion,mild
"01:33:07,000","01:33:08,000",si me dan a mí lo agradezco.,si me dan a mí lo agradezco.,If they give me I appreciate it.,gratitude,mild
"01:33:11,000","01:33:12,000",Aunque voy nervioso.,Aunque voy nervioso.,Although I am nervous.,nervousness,mild
"01:33:14,000","01:33:15,000",Cómo justifica eso.,Cómo justifica eso.,How to justify that.,confusion,mild
"01:33:15,000","01:33:16,000",Claro que no podemos hablar.,Claro que no podemos hablar.,Of course we cannot speak.,neutral,neutral
"01:33:16,000","01:33:19,000","Ya, pero lo vas a entender son","Ya, pero lo vas a entender son","Already, but you will understand are",neutral,neutral
"01:33:19,000","01:33:20,000",tres minutos.,tres minutos.,three minutes.,neutral,neutral
"01:33:21,000","01:33:22,000",Piénsate lo que.,Piénsate lo que.,Think what.,neutral,neutral
"01:33:23,000","01:33:25,000","Chicos, el tiempo ha terminado.","Chicos, el tiempo ha terminado.","Boys, time is over.",neutral,neutral
"01:33:26,000","01:33:29,000",Adri quién crees que debe ver a,Adri quién crees que debe ver a,Adri who you think should see,curiosity,mild
"01:33:29,000","01:33:29,000",su novia?,su novia?,Your girlfriend?,neutral,neutral
"01:33:30,000","01:33:31,000","Pues muy a mi pesar, porque a mí","Pues muy a mi pesar, porque a mí","Well, much to me, because me",neutral,neutral
"01:33:31,000","01:33:35,000","me gustaría ver a Mariona, pero","me gustaría ver a Mariona, pero","I would like to see Mariona, but",desire,mild
"01:33:36,000","01:33:37,000",Nico lleva más tiempo en la,Nico lleva más tiempo en la,Nico takes longer in the,neutral,neutral
"01:33:37,000","01:33:38,000",experiencia y su relación está,experiencia y su relación está,Experience and your relationship is,neutral,neutral
"01:33:38,000","01:33:39,000",más descompensada.,más descompensada.,more decompensated.,neutral,neutral
"01:33:39,000","01:33:41,000",Ahora mismo se lo dejo todo a,Ahora mismo se lo dejo todo a,Right now I leave everything to,neutral,neutral
"01:33:41,000","01:33:41,000",él.,él.,he.,neutral,neutral
"01:33:42,000","01:33:42,000",Alex.,Alex.,Alex.,neutral,neutral
"01:33:43,000","01:33:44,000",Yo opino igual que Adri.,Yo opino igual que Adri.,I think like Adri.,neutral,neutral
"01:33:44,000","01:33:46,000",Creo que Nico se merece estar,Creo que Nico se merece estar,I think Nico deserves to be,approval,mild
"01:33:46,000","01:33:47,000",con ella adelante y que le dé,con ella adelante y que le dé,With her forward and give her,approval,mild
"01:33:48,000","01:33:48,000",explicaciones.,explicaciones.,Explanations.,neutral,neutral
"01:33:48,000","01:33:49,000","Qué ocurre, Adri?","Qué ocurre, Adri?","What happens, Adri?",curiosity,mild
"01:33:50,000","01:33:50,000",Qué te pasa?,Qué te pasa?,What's the matter?,curiosity,mild
"01:33:51,000","01:33:52,000",Siento que le he fallado.,Siento que le he fallado.,I feel that I have failed.,disappointment,moderate
"01:33:53,000","01:33:55,000","Y me gustaría ser el afortunado,","Y me gustaría ser el afortunado,","And I would like to be the lucky one,",desire,moderate
"01:33:55,000","01:33:58,000",pero entiendo que que solo puede,pero entiendo que que solo puede,But I understand that it can only,realization,mild
"01:33:58,000","01:34:02,000","ser una persona y bueno, es una","ser una persona y bueno, es una","Being a person and well, is a",neutral,neutral
"01:34:02,000","01:34:03,000",muestra de amistad.,muestra de amistad.,Friendship show.,neutral,neutral
"01:34:05,000","01:34:06,000",David.,David.,David.,neutral,neutral
"01:34:07,000","01:34:08,000",Pues yo la verdad que moriría por,Pues yo la verdad que moriría por,"Well, I really would die for",desire,intense
"01:34:08,000","01:34:10,000","verla yo, pero sí que es verdad","verla yo, pero sí que es verdad","Seeing it, but it's true",desire,moderate
"01:34:10,000","01:34:11,000",que creo que Nico es el que más,que creo que Nico es el que más,that I think Nico is the one that most,realization,mild
"01:34:11,000","01:34:12,000",lo necesita.,lo necesita.,He needs it.,caring,moderate
"01:34:12,000","01:34:13,000",Creo que su novia está diciendo,Creo que su novia está diciendo,I think his girlfriend is saying,confusion,mild
"01:34:14,000","01:34:14,000",cosas que no tienen sentido.,cosas que no tienen sentido.,Things that make no sense.,confusion,moderate
"01:34:14,000","01:34:16,000",Él se está portando súper bien y,Él se está portando súper bien y,He is getting well super good and,approval,moderate
"01:34:16,000","01:34:17,000",ella se está metiendo con él.,ella se está metiendo con él.,She is getting into him.,annoyance,mild
"01:34:17,000","01:34:18,000",Ahí va para Nico.,Ahí va para Nico.,There it goes for Nico.,neutral,neutral
"01:34:19,000","01:34:19,000",Borja.,Borja.,Borja.,neutral,neutral
"01:34:20,000","01:34:21,000",Yo igual me encantaría ver a Ana,Yo igual me encantaría ver a Ana,I would love to see Ana,desire,moderate
"01:34:21,000","01:34:23,000","decirle que siga así, por favor,","decirle que siga así, por favor,","Tell him to continue like this, please,",approval,mild
"01:34:23,000","01:34:25,000","que nos iremos juntos, pero creo","que nos iremos juntos, pero creo","that we will go together, but I think",optimism,mild
"01:34:25,000","01:34:26,000",que no soy el que más lo,que no soy el que más lo,I am not the one who,realization,mild
"01:34:26,000","01:34:27,000",necesita.,necesita.,needs.,neutral,neutral
"01:34:27,000","01:34:29,000",Nico se está portando como un,Nico se está portando como un,Nico is being wearing as a,neutral,neutral
"01:34:29,000","01:34:31,000","señor y, sin embargo, su novia","señor y, sin embargo, su novia",Lord and yet his girlfriend,disapproval,moderate
"01:34:31,000","01:34:32,000",no tiene ni pinica de hacer lo,no tiene ni pinica de hacer lo,You don't have to do what,disapproval,mild
"01:34:32,000","01:34:34,000","que está haciendo, así que para","que está haciendo, así que para","What is you doing, so for",disapproval,mild
"01:34:34,000","01:34:34,000",Nico.,Nico.,Nico.,neutral,neutral
"01:34:36,000","01:34:38,000","Nico, tus compañeros han tomado","Nico, tus compañeros han tomado","Nico, your colleagues have taken",neutral,neutral
"01:34:38,000","01:34:40,000",una decisión y ya es una,una decisión y ya es una,a decision and it is already a,neutral,neutral
"01:34:40,000","01:34:40,000",realidad.,realidad.,reality.,neutral,neutral
"01:34:40,000","01:34:42,000","Nico, vas a ver a Ruth.","Nico, vas a ver a Ruth.","Nico, you're going to see Ruth.",neutral,neutral
"01:34:42,000","01:34:43,000","Sí, pero me da miedo.","Sí, pero me da miedo.","Yes, but I'm afraid.",fear,moderate
"01:34:43,000","01:34:44,000",¿Por qué?,¿Por qué?,Because?,curiosity,mild
"01:34:44,000","01:34:48,000",Porque no conozco a esa Ruth y me,Porque no conozco a esa Ruth y me,Because I don't know that ruth and me,confusion,moderate
"01:34:48,000","01:34:49,000",da miedo no poder expresar o que,da miedo no poder expresar o que,scary not to be able to express or that,fear,moderate
"01:34:49,000","01:34:50,000",ella pueda expresar el por qué,ella pueda expresar el por qué,she can express why,confusion,mild
"01:34:50,000","01:34:51,000",está actuando de esa forma.,está actuando de esa forma.,He is acting that way.,confusion,mild
"01:34:52,000","01:34:53,000",Decíais que teníais una,Decíais que teníais una,You said you had a,neutral,neutral
"01:34:53,000","01:34:54,000",complicidad tremenda.,complicidad tremenda.,Tremendous complicity.,admiration,moderate
"01:34:55,000","01:34:57,000",Y también decía que conocía a mi,Y también decía que conocía a mi,And also said that I knew me,realization,mild
"01:34:57,000","01:34:58,000",pareja y me estoy dando cuenta,pareja y me estoy dando cuenta,couple and I'm realizing,realization,moderate
"01:34:58,000","01:34:59,000",que no.,que no.,no.,disappointment,mild
"01:35:01,000","01:35:03,000",¿Crees que puedes ver esa,¿Crees que puedes ver esa,Do you think you can see that,curiosity,mild
"01:35:03,000","01:35:04,000",mirada que deseas en Ruth?,mirada que deseas en Ruth?,look what do you want in ruth?,curiosity,mild
"01:35:04,000","01:35:06,000","Que no lo sé, no lo sé porque","Que no lo sé, no lo sé porque","I don't know, I don't know why",confusion,moderate
"01:35:06,000","01:35:07,000",venía aquí con una confianza,venía aquí con una confianza,I came here with a confidence,pride,moderate
"01:35:07,000","01:35:09,000",increíble y me he encontrado con,increíble y me he encontrado con,incredible and I have encountered,surprise,moderate
"01:35:09,000","01:35:11,000",algo que me ha partido en dos.,algo que me ha partido en dos.,Something that has left me in two.,confusion,moderate
"01:35:11,000","01:35:12,000","Entonces, es que no lo sé.","Entonces, es que no lo sé.","So, I don't know.",confusion,mild
"01:35:14,000","01:35:15,000",No lo sé.,No lo sé.,Don't know.,confusion,mild
"01:35:18,000","01:35:21,000","Nico, aprovecha esos tres","Nico, aprovecha esos tres","Nico, take advantage of those three",neutral,neutral
"01:35:21,000","01:35:23,000","minutos, quédate con los","minutos, quédate con los","minutes, stay with the",neutral,neutral
"01:35:23,000","01:35:26,000",detalles porque son los,detalles porque son los,details because they are the,approval,mild
"01:35:26,000","01:35:27,000","importantes, ¿vale?","importantes, ¿vale?","Important, okay?",approval,mild
"01:35:28,000","01:35:28,000",Sí.,Sí.,Yeah.,neutral,neutral
"01:35:29,000","01:35:30,000",Te dejo que te prepares.,Te dejo que te prepares.,I let you prepare.,caring,mild
"01:35:30,000","01:35:30,000","Gracias, Andrea.","Gracias, Andrea.","Thanks, Andrea.",gratitude,mild
"01:35:30,000","01:35:32,000","Nos vemos en el espejo, Nico.","Nos vemos en el espejo, Nico.","See you in the mirror, Nico.",neutral,neutral
"01:35:39,000","01:35:41,000",Estate tranquilo y diga lo que,Estate tranquilo y diga lo que,Be calm and say what,neutral,neutral
"01:35:41,000","01:35:42,000","piensas, y sea lo que sea lo que","piensas, y sea lo que sea lo que","You think, and whatever",neutral,neutral
"01:35:42,000","01:35:46,000","te diga, ya tendrás respuesta","te diga, ya tendrás respuesta","Tell you, you'll have an answer",neutral,neutral
"01:35:46,000","01:35:46,000",tú sola.,tú sola.,You alone.,neutral,neutral
"01:35:49,000","01:35:50,000",Aunque no te hable vas a ver,Aunque no te hable vas a ver,Even if you don't talk about seeing,neutral,neutral
"01:35:51,000","01:35:51,000",cómo está.,cómo está.,how are you doing.,curiosity,mild
"01:35:51,000","01:35:52,000",Suelo con verla y a saber si,Suelo con verla y a saber si,I usually see it and know if,realization,mild
"01:35:52,000","01:35:53,000","está repente o no, tío.","está repente o no, tío.","It is sudden or not, uncle.",curiosity,mild
"01:35:57,000","01:35:58,000",También dale a entender que tú,También dale a entender que tú,Also imply that you,neutral,neutral
"01:35:58,000","01:35:59,000",tampoco quieres una persona,tampoco quieres una persona,You don't want a person either,disapproval,mild
"01:35:59,000","01:36:00,000","que opine así de ti, ¿sabes?","que opine así de ti, ¿sabes?","Let yourself think about you, you know?",caring,mild
"01:36:00,000","01:36:02,000","O sea, no vayas ahí con el rabo","O sea, no vayas ahí con el rabo","I mean, don't go there with the tail",neutral,neutral
"01:36:02,000","01:36:03,000",detrás de las piernas porque tú,detrás de las piernas porque tú,behind the legs because you,neutral,neutral
"01:36:03,000","01:36:04,000","no has hecho nada, o sea, tú","no has hecho nada, o sea, tú","You have not done anything, that is, you",neutral,neutral
"01:36:04,000","01:36:06,000","tienes que ir ahí enfadado, o","tienes que ir ahí enfadado, o","You have to go there angry, or",neutral,neutral
"01:36:06,000","01:36:07,000","sea, la enfadada no es ella,","sea, la enfadada no es ella,","Be, the angry is not her,",realization,mild
"01:36:07,000","01:36:07,000",eres tú.,eres tú.,it's you.,realization,mild
"01:36:08,000","01:36:08,000","Ánimo, guapo.","Ánimo, guapo.","Coup, handsome.",neutral,neutral
"01:36:10,000","01:36:11,000","Estoy bastante nervioso, tengo","Estoy bastante nervioso, tengo","I am quite nervous, I have",nervousness,moderate
"01:36:12,000","01:36:13,000","miedo, por otra parte ilusión y","miedo, por otra parte ilusión y","fear, on the other hand illusion and",fear,moderate
"01:36:13,000","01:36:15,000","ganas de verla, pero no me","ganas de verla, pero no me","I want to see her, but I don't",desire,moderate
"01:36:15,000","01:36:17,000",quiero ilusionar con lo que,quiero ilusionar con lo que,I want to excite what,desire,moderate
"01:36:17,000","01:36:18,000","realmente deseo, encontrarme por","realmente deseo, encontrarme por",I really want to find me for,desire,moderate
"01:36:18,000","01:36:19,000",miedo a esperarme algo y,miedo a esperarme algo y,fear of waiting for me and,fear,moderate
"01:36:19,000","01:36:20,000",encontrarme todo lo contrario.,encontrarme todo lo contrario.,Find me the opposite.,fear,moderate
"01:36:20,000","01:36:22,000","Quiero verte, verte, verte, que","Quiero verte, verte, verte, que","I want to see you, see you, see you, what",desire,intense
"01:36:22,000","01:36:24,000",se acabe ya.,se acabe ya.,It is over.,relief,mild
"01:36:27,000","01:36:28,000",Tantas chancas en el mundo.,Tantas chancas en el mundo.,So many chancas in the world.,confusion,mild
"01:36:33,000","01:36:34,000",Por donde llena.,Por donde llena.,Where it fills.,confusion,mild
"01:36:36,000","01:36:37,000","Comienzas, querida.","Comienzas, querida.","You start, dear.",neutral,neutral
"01:36:37,000","01:36:38,000","Hola, ¿qué tal?","Hola, ¿qué tal?",Hi how are things?,curiosity,mild
"01:36:39,000","01:36:39,000",Hostia.,Hostia.,Guests.,neutral,neutral
"01:36:39,000","01:36:41,000",Siento interrumpir.,Siento interrumpir.,I am sorry to interrupt.,embarrassment,mild
"01:36:41,000","01:36:42,000","Hola, Sandra.","Hola, Sandra.","Hello, Sandra.",neutral,neutral
"01:36:42,000","01:36:42,000","¿Qué pasa, Sandra?","¿Qué pasa, Sandra?","What happens, Sandra?",curiosity,mild
"01:36:43,000","01:36:43,000",Sandra.,Sandra.,Sandra.,neutral,neutral
"01:36:44,000","01:36:45,000",¿Qué tal?,¿Qué tal?,How are you?,curiosity,mild
"01:36:45,000","01:36:46,000",Hola.,Hola.,Hello.,neutral,neutral
"01:36:46,000","01:36:46,000",¿Cómo estáis?,¿Cómo estáis?,How are you?,curiosity,mild
"01:36:47,000","01:36:47,000",Muy bien.,Muy bien.,Very good.,neutral,neutral
"01:36:47,000","01:36:48,000",Todos al sofá.,Todos al sofá.,All to the couch.,neutral,neutral
"01:36:50,000","01:36:51,000","Por favor, ¿podéis avisar a","Por favor, ¿podéis avisar a","Please, can you notify",neutral,neutral
"01:36:51,000","01:36:52,000",Ana?,Ana?,Cane?,curiosity,mild
"01:36:52,000","01:36:53,000",Ana.,Ana.,Well.,neutral,neutral
"01:36:55,000","01:36:55,000",Ha llegado Sandra.,Ha llegado Sandra.,Sandra has arrived.,neutral,neutral
"01:36:56,000","01:36:57,000",En serio.,En serio.,Oh really.,surprise,mild
"01:36:57,000","01:36:57,000",Sí.,Sí.,Yeah.,neutral,neutral
"01:36:58,000","01:36:59,000",Marieta.,Marieta.,Marieta,neutral,neutral
"01:36:59,000","01:37:00,000","Sergio, Marieta.","Sergio, Marieta.","Sergio, Marieta.",neutral,neutral
"01:37:00,000","01:37:01,000","Sergio, vino Sandra.","Sergio, vino Sandra.","Sergio, Sandra wine.",neutral,neutral
"01:37:02,000","01:37:04,000","Cuando ha entrado Sandra, me ha","Cuando ha entrado Sandra, me ha","When Sandra has entered, he has",neutral,neutral
"01:37:04,000","01:37:05,000","pillado con Napoli, que habíamos","pillado con Napoli, que habíamos","caught with Napoli, we had",neutral,neutral
"01:37:05,000","01:37:07,000",dado una cabezadita de siesta y,dado una cabezadita de siesta y,given a nap head and,neutral,neutral
"01:37:07,000","01:37:08,000",la verdad que no me lo esperaba.,la verdad que no me lo esperaba.,The truth is that I did not expect it.,surprise,mild
"01:37:11,000","01:37:14,000","Chicos, chicas, estoy aquí","Chicos, chicas, estoy aquí","Guys, girls, I'm here",excitement,mild
"01:37:14,000","01:37:15,000",porque quiero mostraros algo.,porque quiero mostraros algo.,Because I want to show you something.,curiosity,mild
"01:37:17,000","01:37:19,000","Este, como sabéis, es el","Este, como sabéis, es el","This, as you know, is the",neutral,neutral
"01:37:19,000","01:37:21,000",collar del Beto y tiene el poder,collar del Beto y tiene el poder,Beto necklace and has the power,neutral,neutral
"01:37:21,000","01:37:23,000",de vetar a uno de los solteros,de vetar a uno de los solteros,to veto one of the single,neutral,neutral
"01:37:23,000","01:37:24,000",durante 24 horas.,durante 24 horas.,for 24 hours.,neutral,neutral
"01:37:25,000","01:37:26,000",El portador del collar deberá,El portador del collar deberá,The collar carrier must,neutral,neutral
"01:37:26,000","01:37:27,000",abandonar inmediatamente,abandonar inmediatamente,leave immediately,neutral,neutral
"01:37:27,000","01:37:28,000",Villamontaña.,Villamontaña.,Villamontaña.,neutral,neutral
"01:37:30,000","01:37:31,000","Chicas, ¿quién creéis que es el","Chicas, ¿quién creéis que es el","Girls, who do you think is the",curiosity,mild
"01:37:31,000","01:37:33,000",soltero vetado por vuestros,soltero vetado por vuestros,single vetoed by your,neutral,neutral
"01:37:33,000","01:37:33,000",chicos?,chicos?,guys?,curiosity,mild
"01:37:33,000","01:37:34,000",Ana.,Ana.,Well.,neutral,neutral
"01:37:34,000","01:37:36,000",Yo creo que puede ser Napoli,Yo creo que puede ser Napoli,I think it can be Napoli,curiosity,mild
"01:37:37,000","01:37:40,000",porque al final estamos mucho,porque al final estamos mucho,Because in the end we are a lot,neutral,neutral
"01:37:40,000","01:37:41,000",tiempo juntos.,tiempo juntos.,Time together.,neutral,neutral
"01:37:41,000","01:37:42,000",Puede ser que le haya sentado,Puede ser que le haya sentado,It may be that it has sat,neutral,neutral
"01:37:42,000","01:37:45,000","mal, que tenga dudas y yo creo","mal, que tenga dudas y yo creo","bad, have doubts and I think",confusion,mild
"01:37:45,000","01:37:46,000",que puede ser él.,que puede ser él.,That can be him.,curiosity,mild
"01:37:47,000","01:37:48,000",Mariona.,Mariona.,Mariona.,neutral,neutral
"01:37:49,000","01:37:50,000",Pienso que el vetado puede ser,Pienso que el vetado puede ser,I think the vetoed can be,curiosity,mild
"01:37:50,000","01:37:53,000",Julen porque creo que lo que está,Julen porque creo que lo que está,Julen because I think what is,neutral,neutral
"01:37:53,000","01:37:55,000",viendo Adri de mis imágenes no le,viendo Adri de mis imágenes no le,Seeing Adri from my images,neutral,neutral
"01:37:55,000","01:37:56,000",está gustando.,está gustando.,He is liking.,neutral,neutral
"01:37:57,000","01:37:57,000",Ella ha vetado a Julen.,Ella ha vetado a Julen.,She has vetoed Julen.,neutral,neutral
"01:37:59,000","01:38:00,000","Chicos, chicas, ha llegado el","Chicos, chicas, ha llegado el","Guys, girls, the",neutral,neutral
"01:38:00,000","01:38:03,000",momento de conocer el nombre del,momento de conocer el nombre del,moment to know the name of the,neutral,neutral
"01:38:03,000","01:38:04,000",soltero vetado.,soltero vetado.,Single vetoed.,neutral,neutral
"01:38:08,000","01:38:10,000",El soltero vetado es...,El soltero vetado es...,The bachelor vetoed is ...,neutral,neutral
"01:38:16,000","01:38:17,000",Álvaro.,Álvaro.,Álvaro.,surprise,moderate
"01:38:17,000","01:38:17,000","Álvaro, Álvaro, Álvaro, Álvaro.","Álvaro, Álvaro, Álvaro, Álvaro.","Alvaro, Álvaro, Álvaro, Álvaro.",surprise,moderate
"01:38:18,000","01:38:19,000",¿En serio?,¿En serio?,Oh really?,surprise,mild
"01:38:19,000","01:38:20,000","No me lo esperaba, ¿eh?","No me lo esperaba, ¿eh?","I didn't expect it, huh?",surprise,mild
"01:38:25,000","01:38:27,000",¿Dices que no te lo esperabas?,¿Dices que no te lo esperabas?,Do you say you weren't waiting for you?,confusion,mild
"01:38:27,000","01:38:27,000",No.,No.,No.,neutral,neutral
"01:38:29,000","01:38:30,000",Me duele verla mal.,Me duele verla mal.,It hurts to see her badly.,sadness,moderate
"01:38:32,000","01:38:34,000",Tiene miedo todo el rato.,Tiene miedo todo el rato.,He is afraid all the time.,fear,moderate
"01:38:35,000","01:38:36,000","María, ¿qué ocurre?","María, ¿qué ocurre?","Maria, what happens?",curiosity,mild
"01:38:38,000","01:38:39,000",No quiero que David esté mal.,No quiero que David esté mal.,I don't want David to be wrong.,,
"01:38:40,000","01:38:42,000","No sé qué está viendo, tío, pero","No sé qué está viendo, tío, pero","I don't know what he's seeing, uncle, but",confusion,moderate
"01:38:42,000","01:38:43,000",es que no hay nada.,es que no hay nada.,There is nothing.,neutral,neutral
"01:38:44,000","01:38:45,000","No lo entiendo, Sandra, de","No lo entiendo, Sandra, de","I don't understand, Sandra,",confusion,mild
"01:38:45,000","01:38:46,000",verdad.,verdad.,TRUE.,neutral,neutral
"01:38:47,000","01:38:48,000",No te lo esperabas.,No te lo esperabas.,You didn't expect it.,surprise,mild
"01:38:51,000","01:38:54,000","Pues Álvaro, siento decirte que","Pues Álvaro, siento decirte que","Well Álvaro, I'm sorry to tell you that",nervousness,mild
"01:38:54,000","01:38:57,000",eres el soltero vetado y tienes,eres el soltero vetado y tienes,You are the single vetoed and you have,disapproval,moderate
"01:38:57,000","01:38:58,000",que abandonar ahora mismo,que abandonar ahora mismo,What to leave right now,fear,moderate
"01:38:58,000","01:38:59,000",Villamontaña.,Villamontaña.,Villamontaña.,neutral,neutral
"01:38:59,000","01:39:00,000",De acuerdo.,De acuerdo.,OK.,neutral,neutral
"01:39:00,000","01:39:01,000","Puedes marcharte, Álvaro.","Puedes marcharte, Álvaro.","You can leave, Álvaro.",neutral,neutral
"01:39:03,000","01:39:03,000","Hasta luego, chicos.","Hasta luego, chicos.","See you later, guys.",neutral,neutral
