Start Time,End Time,Sentence,Corrected Sentence,Translation,Emotion,Intensity
"00:30:58,000","00:31:02,000","Je bent al heel lang actief, weet je dat?","Je bent al heel lang actief, weet je dat?","You have been active for a long time, do you know that?",curiosity,moderate
"00:31:02,000","00:31:04,000","Ja, ik poste al een tijdje.","Ja, ik poste al een tijdje.","Yes, I've been posting for a while.",neutral,neutral
"00:31:04,000","00:31:05,000",Hoe lang al?,Hoe lang al?,How long?,curiosity,mild
"00:31:06,000","00:31:09,000",Hoe lang zit je nog op zo'n 2 jaar?,Hoe lang zit je nog op zo'n 2 jaar?,How long are you still in about 2 years?,curiosity,mild
"00:31:10,000","00:31:11,000","Ja, al 2 jaar.","Ja, al 2 jaar.","Yes, already 2 years.",neutral,neutral
"00:31:12,000","00:31:14,000",Iets minder langer dan dat.,Iets minder langer dan dat.,A little less longer than that.,neutral,neutral
"00:31:14,000","00:31:18,000",Ik ga een beetje lopen.,Ik ga een beetje lopen.,I'm going to walk a bit.,neutral,neutral
"00:31:18,000","00:31:21,000",Je hebt ook een hotelkamer geboekt.,Je hebt ook een hotelkamer geboekt.,You have also booked a hotel room.,curiosity,moderate
"00:31:21,000","00:31:23,000",Toch?,Toch?,Still?,curiosity,mild
"00:31:24,000","00:31:25,000","Ja, dat is werk.","Ja, dat is werk.","Yes, that's work.",neutral,neutral
"00:31:26,000","00:31:30,000",Je wilde dit meisje meenemen naar het hotel.,Je wilde dit meisje meenemen naar het hotel.,You wanted to take this girl to the hotel.,disapproval,intense
"00:31:30,000","00:31:31,000",Mag ik vragen?,Mag ik vragen?,May I ask?,curiosity,mild
"00:31:31,000","00:31:37,000","Ik heb nog een vraag voor je, ik zag 2 kinderzitjes in je auto.","Ik heb nog een vraag voor je, ik zag 2 kinderzitjes in je auto.","I have another question for you, I saw 2 child seats in your car.",curiosity,moderate
"00:31:37,000","00:31:38,000",Heb je kinderen?,Heb je kinderen?,Do you have children?,curiosity,mild
"00:31:39,000","00:31:41,000",Hoe oud zijn die kinderen?,Hoe oud zijn die kinderen?,How old are those children?,curiosity,mild
"00:31:41,000","00:31:45,000",Kleuters.,Kleuters.,Toddlers.,neutral,neutral
"00:31:46,000","00:31:49,000",Snap je dat ik er niks van begrijp?,Snap je dat ik er niks van begrijp?,Do you understand that I don't understand anything about it?,confusion,moderate
"00:31:49,000","00:31:51,000","Nee, ik ook niet.","Nee, ik ook niet.","No, not me either.",confusion,mild
"00:31:52,000","00:31:55,000",Wil jij jezelf aangeven bij de politie?,Wil jij jezelf aangeven bij de politie?,Do you want to indicate yourself to the police?,curiosity,moderate
"00:31:55,000","00:31:57,000",Dat wil ik niet.,Dat wil ik niet.,I don't want that.,disapproval,mild
"00:31:57,000","00:31:59,000",Waarom niet?,Waarom niet?,Why not?,curiosity,mild
"00:31:59,000","00:32:01,000",Omdat ik nog niks gedaan heb.,Omdat ik nog niks gedaan heb.,Because I haven't done anything yet.,neutral,neutral
"00:32:01,000","00:32:04,000","Ja, het is wensbaar, maar ik heb niks gedaan.","Ja, het is wensbaar, maar ik heb niks gedaan.","Yes, it is desirable, but I didn't do anything.",desire,mild
"00:32:05,000","00:32:08,000","Je hebt voorbereidende handelingen gepleegd, toch?","Je hebt voorbereidende handelingen gepleegd, toch?","You have committed preparatory actions, right?",disapproval,intense
"00:32:08,000","00:32:13,000","Je komt hier, zoveel meer bewijs dat we dit niet nodig hebben.","Je komt hier, zoveel meer bewijs dat we dit niet nodig hebben.","You come here, so much more evidence that we don't need this.",disapproval,intense
"00:32:13,000","00:32:14,000",Je bent hier.,Je bent hier.,You are here.,neutral,neutral
"00:32:14,000","00:32:19,000","Je komt hier, je zegt wie je bent, je bevestigt wie je bent, we hebben","Je komt hier, je zegt wie je bent, je bevestigt wie je bent, we hebben","You come here, you say who you are, you confirm who you are, we have",neutral,neutral
"00:32:19,000","00:32:21,000",alles.,alles.,everything.,neutral,neutral
"00:32:21,000","00:32:24,000",Je hebt een dossier.,Je hebt een dossier.,You have a file.,neutral,neutral
"00:32:25,000","00:32:28,000",Dit ben jij.,Dit ben jij.,This is you.,neutral,neutral
"00:32:28,000","00:32:29,000",Mijn gunst.,Mijn gunst.,My favor.,neutral,neutral
"00:32:29,000","00:32:31,000",Hoeveel?,Hoeveel?,How many?,curiosity,mild
"00:32:31,000","00:32:36,000",Ik denk dat je jezelf bij de politie moet melden.,Ik denk dat je jezelf bij de politie moet melden.,I think you should report yourself to the police.,disapproval,intense
"00:32:36,000","00:32:38,000",Dat sowieso.,Dat sowieso.,That anyway.,neutral,neutral
"00:32:39,000","00:32:42,000",Ga jij je bij de politie melden?,Ga jij je bij de politie melden?,Are you going to report to the police?,curiosity,mild
"00:32:43,000","00:32:45,000",Nee.,Nee.,Nee.,neutral,neutral
"00:32:45,000","00:32:48,000",Ik geloof niet dat je uit jezelf hulp gaat halen.,Ik geloof niet dat je uit jezelf hulp gaat halen.,I don't believe you're going to get help from yourself.,disapproval,moderate
"00:32:49,000","00:32:51,000",Jij gaat niet uit jezelf hulp zoeken.,Jij gaat niet uit jezelf hulp zoeken.,You are not going to seek help from yourself.,disapproval,moderate
"00:32:52,000","00:32:57,000","Als je dit 2 jaar lang volhoudt, dan kun je je niet verplaatsen in zo'n","Als je dit 2 jaar lang volhoudt, dan kun je je niet verplaatsen in zo'n","If you keep this up for 2 years, you cannot move in such",disappointment,moderate
"00:32:57,000","00:32:59,000",meisje.,meisje.,girl.,neutral,neutral
"00:33:00,000","00:33:06,000","Misschien niet, maar ik denk dat je jezelf niet uit jezelf gaat halen.","Misschien niet, maar ik denk dat je jezelf niet uit jezelf gaat halen.","Maybe not, but I think you're not going to get yourself out of yourself.",disapproval,moderate
"00:33:06,000","00:33:12,000","Je ziet eruit alsof je geld zat hebt, ga naar een prostituee, betaal ervoor.","Je ziet eruit alsof je geld zat hebt, ga naar een prostituee, betaal ervoor.","You look like you've had money, go to a prostitute, pay for it.",disgust,intense
"00:33:12,000","00:33:16,000","Of jij meldt jezelf bij de politie, of wij doen het.","Of jij meldt jezelf bij de politie, of wij doen het.","Or you report yourself to the police, or we do it.",annoyance,intense
"00:33:16,000","00:33:19,000",Wat moet ik tegen ze zeggen?,Wat moet ik tegen ze zeggen?,What should I say to them?,confusion,mild
"00:33:19,000","00:33:23,000","Dat je hulp nodig hebt, omdat je hebt afgesproken met een 15-jarige","Dat je hulp nodig hebt, omdat je hebt afgesproken met een 15-jarige",That you need help because you have agreed with a 15-year-old,disapproval,intense
"00:33:24,000","00:33:25,000",dat je dat niet wilde.,dat je dat niet wilde.,That you didn't want that.,remorse,moderate
"00:33:26,000","00:33:27,000",Dat kan ik wel doen.,Dat kan ik wel doen.,I can do that.,realization,mild
"00:33:28,000","00:33:29,000",Wat moet je doen?,Wat moet je doen?,What should you do?,confusion,mild
"00:33:29,000","00:33:34,000","Dat je hulp nodig hebt, omdat je afgesproken hebt met een 15-jarige","Dat je hulp nodig hebt, omdat je afgesproken hebt met een 15-jarige",That you need help because you have agreed with a 15-year-old,disapproval,intense
"00:33:34,000","00:33:36,000",dat je dat niet wilde.,dat je dat niet wilde.,That you didn't want that.,remorse,moderate
"00:33:36,000","00:33:38,000",Wat moet je doen?,Wat moet je doen?,What should you do?,confusion,mild
"00:33:38,000","00:33:40,000",Vind je het goed als ik de politie bel?,Vind je het goed als ik de politie bel?,Do you like it when I call the police?,curiosity,mild
"00:33:40,000","00:33:42,000",Nee.,Nee.,Nee.,neutral,neutral
"00:33:42,000","00:33:43,000",Waarom niet?,Waarom niet?,Why not?,curiosity,mild
"00:33:43,000","00:33:47,000",Het zorgt mij er mogelijkheid om er zelf heen te gaan.,Het zorgt mij er mogelijkheid om er zelf heen te gaan.,It makes me the opportunity to go there yourself.,realization,mild
"00:33:47,000","00:33:49,000",Waarom niet?,Waarom niet?,Why not?,curiosity,mild
"00:33:49,000","00:33:52,000",Omdat er veel voor mij op het spel staat.,Omdat er veel voor mij op het spel staat.,Because a lot is at stake for me.,fear,moderate
"00:33:52,000","00:33:54,000",Ga jij naar de politie toe?,Ga jij naar de politie toe?,Are you going to the police?,curiosity,mild
"00:33:54,000","00:33:59,000","Wij weten waar ik de auto in rijd, daar hoef je je niet voor te laten.","Wij weten waar ik de auto in rijd, daar hoef je je niet voor te laten.","We know where I drive the car, you don't have to let yourself be for that.",neutral,neutral
"00:34:00,000","00:34:02,000",Ga naar de politie toe.,Ga naar de politie toe.,Go to the police.,fear,moderate
"00:34:02,000","00:34:03,000",Ga dat doen.,Ga dat doen.,Go do that.,neutral,neutral
"00:34:06,000","00:34:08,000",Moet ik achter je aanrijden?,Moet ik achter je aanrijden?,Do I have to drive behind you?,curiosity,mild
"00:34:08,000","00:34:11,000",Moet ik je naar een politiebureau brengen?,Moet ik je naar een politiebureau brengen?,Do I have to take you to a police station?,curiosity,mild
"00:34:12,000","00:34:15,000",Ik wil wel zeker weten dat je het doet.,Ik wil wel zeker weten dat je het doet.,I want to be sure that you are doing it.,curiosity,mild
"00:34:18,000","00:34:19,000",Ja?,Ja?,And?,curiosity,mild
"00:34:20,000","00:34:22,000","Kom, ik ga naar de politie.","Kom, ik ga naar de politie.","Come, I'm going to the police.",optimism,moderate
"00:34:22,000","00:34:24,000",Ik rij achter jou aan.,Ik rij achter jou aan.,I drive after you.,neutral,neutral
"00:34:24,000","00:34:28,000","Jongens, het is nu mooi geweest, ga maar achter in de auto.","Jongens, het is nu mooi geweest, ga maar achter in de auto.","Guys, it has been nice now, just go in the back of the car.",annoyance,moderate
"00:34:28,000","00:34:31,000",Ik rij achter je aan.,Ik rij achter je aan.,I drive after you.,neutral,neutral
"00:34:32,000","00:34:34,000","Ga maar zitten, jongens.","Ga maar zitten, jongens.","Sit down, guys.",neutral,neutral
"00:34:41,000","00:34:46,000","Een bizarre situatie, hij kwam opdagen, bekende, en rijdt nu achter","Een bizarre situatie, hij kwam opdagen, bekende, en rijdt nu achter","A bizarre situation, he showed up, familiar, and now drives behind",surprise,moderate
"00:34:46,000","00:34:50,000",me aan richting het politiebureau.,me aan richting het politiebureau.,me towards the police station.,neutral,neutral
"00:34:50,000","00:34:54,000",Ik houd wel in de gaten of hij echt met me mee rijdt.,Ik houd wel in de gaten of hij echt met me mee rijdt.,I keep an eye on whether he really drives me.,curiosity,mild
"00:34:54,000","00:34:57,000",En dat doet hij ook.,En dat doet hij ook.,And he does that too.,neutral,neutral
"00:35:02,000","00:35:04,000",***,***,,,
"00:35:14,000","00:35:16,000",Goedemiddag.,Goedemiddag.,Good afternoon.,neutral,neutral
"00:35:16,000","00:35:18,000",Hoi.,Hoi.,Hoi.,neutral,neutral
"00:35:18,000","00:35:19,000",Wat is het moeilijke?,Wat is het moeilijke?,What is the difficult?,confusion,mild
"00:35:20,000","00:35:22,000",Ik kom mezelf aanrijden.,Ik kom mezelf aanrijden.,I am coming to drive myself.,,
"00:35:22,000","00:35:23,000",Vertel.,Vertel.,Tell.,neutral,neutral
"00:35:23,000","00:35:27,000",Intentie om af te spreken met een minderjarige maat.,Intentie om af te spreken met een minderjarige maat.,Intention to meet up with a minor size.,disapproval,intense
"00:35:27,000","00:35:31,000",Intentie om af te spreken met een minderjarige maat.,Intentie om af te spreken met een minderjarige maat.,Intention to meet up with a minor size.,neutral,neutral
"00:35:32,000","00:35:34,000",Dat ligt vast in elkaar?,Dat ligt vast in elkaar?,That is probably put together?,confusion,mild
"00:35:34,000","00:35:36,000",Zeker.,Zeker.,Certainly.,neutral,neutral
"00:35:36,000","00:35:40,000",Meneer is al 2 jaar actief op een ProAnna-site.,Meneer is al 2 jaar actief op een ProAnna-site.,Mr. has been active on a Proanna site for 2 years.,disapproval,moderate
"00:35:40,000","00:35:44,000",Nu dacht meneer af te spreken met een 15-jarig meisje.,Nu dacht meneer af te spreken met een 15-jarig meisje.,Now sir thought he would meet up with a 15-year-old girl.,disgust,intense
"00:35:44,000","00:35:48,000","Hij wilde een seksslavin van haar maken, seks met haar, leer pijpen,","Hij wilde een seksslavin van haar maken, seks met haar, leer pijpen,","He wanted to make a sex slave of her, sex with her, learn to blow,",disgust,overwhelming
"00:35:49,000","00:35:51,000","heeft een hotelkamer geboekt, etc.","heeft een hotelkamer geboekt, etc.","has booked a hotel room, etc.",disgust,intense
"00:35:51,000","00:35:56,000","We hebben een dik boek aan chats, we hebben verborgen camera-materiaal","We hebben een dik boek aan chats, we hebben verborgen camera-materiaal","We have a thick book of chats, we have hidden camera material",optimism,moderate
"00:35:56,000","00:35:58,000",zojuist opgehaald met het bewijs.,zojuist opgehaald met het bewijs.,Just picked up with the proof.,neutral,neutral
"00:35:58,000","00:36:03,000","Ik heb hem zelf aangegeven, want hij komt hier niet omdat ik hem","Ik heb hem zelf aangegeven, want hij komt hier niet omdat ik hem","I indicated it myself, because he doesn't come here because I have him",pride,mild
"00:36:03,000","00:36:07,000","hier breng, maar omdat hij zichzelf hier brengt en hij hulp nodig","hier breng, maar omdat hij zichzelf hier brengt en hij hulp nodig","Bring here, but because he brings himself here and he needs help",caring,moderate
"00:36:07,000","00:36:09,000",denkt te hebben.,denkt te hebben.,thinks you have.,neutral,neutral
"00:36:09,000","00:36:13,000",Als de politie al onze informatie heeft zit mijn taak er voor nu op.,Als de politie al onze informatie heeft zit mijn taak er voor nu op.,"If the police have all our information, my task is now on it.",optimism,moderate
"00:36:14,000","00:36:16,000",Wij hebben de komende dagen nog opgetakt.,Wij hebben de komende dagen nog opgetakt.,We have raised in the coming days.,neutral,neutral
"00:36:17,000","00:36:19,000","Hoe raar het ook klinkt, dank je wel.","Hoe raar het ook klinkt, dank je wel.","No matter how weird it sounds, thank you.",gratitude,mild
"00:36:19,000","00:36:21,000",Graag gedaan.,Graag gedaan.,Don't mention it.,neutral,neutral
"00:36:21,000","00:36:24,000",Hij heeft zich binnen zelf aangegeven bij de politie.,Hij heeft zich binnen zelf aangegeven bij de politie.,He has registered with the police within himself.,realization,moderate
"00:36:24,000","00:36:28,000","Hij zegt, ik heb hulp nodig en dat hoop ik hier te krijgen.","Hij zegt, ik heb hulp nodig en dat hoop ik hier te krijgen.","He says, I need help and I hope to get that here.",,
"00:36:28,000","00:36:31,000",Bedankt dat ik hem heb ontmaskerd.,Bedankt dat ik hem heb ontmaskerd.,Thank you for unmasking him.,gratitude,moderate
"00:36:31,000","00:36:34,000",Een heel bijzonder verhaal met een bijzonder afloop.,Een heel bijzonder verhaal met een bijzonder afloop.,A very special story with a special outcome.,admiration,mild
"00:36:35,000","00:36:39,000",De recherche is inmiddels bezig met uitgebreid onderzoek naar de,De recherche is inmiddels bezig met uitgebreid onderzoek naar de,The criminal investigation department is now working on extensive research into the,neutral,neutral
"00:36:39,000","00:36:41,000",praktijken van deze band de men.,praktijken van deze band de men.,Practices of this band the Men.,disapproval,moderate
"00:36:41,000","00:36:45,000","Hij was jaren actief, maar is dus eindelijk gepakt.","Hij was jaren actief, maar is dus eindelijk gepakt.","He was active for years, but was finally caught.",relief,moderate
"00:36:45,000","00:36:49,000",Maar de pro-anasites met de afvalcoaches blijven een groot,Maar de pro-anasites met de afvalcoaches blijven een groot,But the pro-anasites with the waste coaches remain a large,disapproval,moderate
"00:36:49,000","00:36:50,000",probleem.,probleem.,problem.,neutral,neutral
"00:36:50,000","00:36:55,000","Hoe kan het dat deze mannen, deze afvalcoaches, zo vrij spel hebben?","Hoe kan het dat deze mannen, deze afvalcoaches, zo vrij spel hebben?","How is it possible that these men, these waste coaches, have so free play?",confusion,moderate
"00:36:55,000","00:36:58,000",Wij waren onderzoek aan het doen.,Wij waren onderzoek aan het doen.,We were doing research.,neutral,neutral
"00:36:58,000","00:37:00,000",Dat onderzoek kwam in 2020 uit.,Dat onderzoek kwam in 2020 uit.,That research was released in 2020.,neutral,neutral
"00:37:00,000","00:37:05,000",Maar het jaar ervoor waren we al zo geschrokken van de heftigheid van,Maar het jaar ervoor waren we al zo geschrokken van de heftigheid van,But the year before we were already so shocked by the intensity of,surprise,intense
"00:37:05,000","00:37:09,000","dit misbruik, dat we toen al naar buiten zijn gegaan via de media.","dit misbruik, dat we toen al naar buiten zijn gegaan via de media.","This abuse, which we already went outside through the media.",disgust,intense
"00:37:09,000","00:37:13,000",Daar hebben we ook politieke aandacht voor gevraagd.,Daar hebben we ook politieke aandacht voor gevraagd.,We also asked political attention for that.,optimism,moderate
"00:37:13,000","00:37:17,000","Minister Grapperhaus zei destijds, ik ga me hier persoonlijk voor","Minister Grapperhaus zei destijds, ik ga me hier persoonlijk voor","Minister Grapperhaus said at the time, I'm going for this personally",optimism,moderate
"00:37:17,000","00:37:20,000",inzetten dat het niet meer gebeurt.,inzetten dat het niet meer gebeurt.,use that it no longer happens.,optimism,moderate
"00:37:20,000","00:37:24,000","Maar inmiddels, drie jaar later, moet ik constateren dat er nog","Maar inmiddels, drie jaar later, moet ik constateren dat er nog","But now, three years later, I have to conclude that there is still",disappointment,moderate
"00:37:24,000","00:37:26,000",meer problemen zijn.,meer problemen zijn.,Be more problems.,annoyance,mild
"00:37:26,000","00:37:30,000",Toen we de logprofielen hebben opengezet om te kijken hoe het er,Toen we de logprofielen hebben opengezet om te kijken hoe het er,When we opened the log profiles to see how things are going,curiosity,mild
"00:37:30,000","00:37:34,000","voor staat, zagen we precies dezelfde usernames, dezelfde","voor staat, zagen we precies dezelfde usernames, dezelfde","stands for, we saw exactly the same usernames, the same",annoyance,moderate
"00:37:35,000","00:37:36,000",pro-anacoaches terugkomen.,pro-anacoaches terugkomen.,pro-anacoaches come back.,annoyance,moderate
"00:37:37,000","00:37:41,000","Dat doe je alleen maar als je denkt, ik word toch niet gepakt.","Dat doe je alleen maar als je denkt, ik word toch niet gepakt.","You only do that if you think, I will not be caught anyway.",disapproval,moderate
"00:37:41,000","00:37:45,000","Ik ga naar Politiek Den Haag, want dit moet opnieuw op de agenda en","Ik ga naar Politiek Den Haag, want dit moet opnieuw op de agenda en","I'm going to politics The Hague, because this has to be on the agenda and",optimism,moderate
"00:37:46,000","00:37:47,000",verdient een echte aanpak.,verdient een echte aanpak.,deserves a real approach.,optimism,moderate
"00:37:47,000","00:37:49,000",U bent Tweede Kamerlid.,U bent Tweede Kamerlid.,You are a member of parliament.,neutral,neutral
"00:37:49,000","00:37:52,000",Gaat u dit op de agenda zetten hier in Den Haag?,Gaat u dit op de agenda zetten hier in Den Haag?,Are you going to put this on the agenda here in The Hague?,curiosity,mild
"00:37:52,000","00:37:57,000",We hebben het de afgelopen jaren al meerdere keren aangekaart.,We hebben het de afgelopen jaren al meerdere keren aangekaart.,We have raised it several times in recent years.,optimism,moderate
"00:37:57,000","00:37:59,000",Door middel van debatten en moties.,Door middel van debatten en moties.,Through debates and motions.,neutral,neutral
"00:37:59,000","00:38:01,000",Maar dat heeft het niet opgeleverd.,Maar dat heeft het niet opgeleverd.,But that did not yield it.,disappointment,moderate
"00:38:02,000","00:38:03,000",Klopt.,Klopt.,Beats.,neutral,neutral
"00:38:03,000","00:38:04,000",Gaat u dit opnieuw doen?,Gaat u dit opnieuw doen?,Are you going to do this again?,curiosity,mild
"00:38:05,000","00:38:07,000","Ja, dit gaan we zeker opnieuw doen.","Ja, dit gaan we zeker opnieuw doen.","Yes, we will definitely do this again.",optimism,moderate
"00:38:07,000","00:38:11,000",Deze uitzending is een mooie gelegenheid om duidelijk te maken,Deze uitzending is een mooie gelegenheid om duidelijk te maken,This broadcast is a great opportunity to make clear,optimism,moderate
"00:38:11,000","00:38:16,000",hoe erg het is dat er niets is gedaan de afgelopen tijd en dat,hoe erg het is dat er niets is gedaan de afgelopen tijd en dat,how bad it is that nothing has been done lately and that,annoyance,moderate
"00:38:16,000","00:38:19,000",kwetsbare jonge kinderen het slachtoffer worden.,kwetsbare jonge kinderen het slachtoffer worden.,Vulnerable young children fall victim to the victim.,sadness,intense
"00:38:19,000","00:38:20,000",Wat moet er gebeuren?,Wat moet er gebeuren?,What should happen?,curiosity,mild
"00:38:20,000","00:38:24,000",We moeten zorgen dat die suits uit de lucht gaat.,We moeten zorgen dat die suits uit de lucht gaat.,We must ensure that those suits get out of the air.,optimism,moderate
"00:38:24,000","00:38:28,000","Dat is best heftig, want we hebben ook vrijheid van meningsuiting.","Dat is best heftig, want we hebben ook vrijheid van meningsuiting.","That is quite intense, because we also have freedom of expression.",realization,moderate
"00:38:28,000","00:38:33,000","Maar dit soort suits, als die leiden tot dodelijke slachtoffers, dan","Maar dit soort suits, als die leiden tot dodelijke slachtoffers, dan","But this kind of suits, if they lead to fatalities, then",fear,intense
"00:38:33,000","00:38:35,000",moeten ze uit de lucht.,moeten ze uit de lucht.,They have to get out of the sky.,optimism,moderate
"00:38:35,000","00:38:39,000","Dit soort daders moeten opgespoord worden, moeten aangepakt worden.","Dit soort daders moeten opgespoord worden, moeten aangepakt worden.",These types of perpetrators must be detected must be tackled.,optimism,intense
"00:38:40,000","00:38:44,000","Zet logprofielen in, spreek de providers aan en zorg ervoor dat","Zet logprofielen in, spreek de providers aan en zorg ervoor dat","Uses log profiles, address the providers and make sure",optimism,moderate
"00:38:44,000","00:38:46,000",ze weten dat er wordt meegekeken.,ze weten dat er wordt meegekeken.,They know that they are watched.,optimism,moderate
"00:38:46,000","00:38:49,000","Als dat gebeurt, kunnen we dit stoppen.","Als dat gebeurt, kunnen we dit stoppen.","If that happens, we can stop this.",optimism,moderate
"00:38:49,000","00:38:53,000",We gaan ze vertellen dat dit een groot probleem is en zorgen dat,We gaan ze vertellen dat dit een groot probleem is en zorgen dat,We are going to tell them that this is a big problem and make sure that,optimism,moderate
"00:38:53,000","00:38:55,000",dit een keer stopt.,dit een keer stopt.,This stops once.,optimism,moderate
"00:38:55,000","00:38:59,000","We gaan de debatten volgen in Den Haag, heel veel sterkte.","We gaan de debatten volgen in Den Haag, heel veel sterkte.","We are going to follow the debates in The Hague, a lot of strength.",neutral,neutral
"00:38:59,000","00:39:03,000","Goed dat jullie er bovenop zitten, want soms is het nodig om hier in","Goed dat jullie er bovenop zitten, want soms is het nodig om hier in","Good that you are on top of it, because sometimes it is necessary to get in here",approval,moderate
"00:39:03,000","00:39:08,000","Den Haag voorbeelden te zien, om te zien hoe erg het is en te zien","Den Haag voorbeelden te zien, om te zien hoe erg het is en te zien","The Hague to see examples, to see how bad it is and to see",curiosity,moderate
"00:39:08,000","00:39:10,000",dat dit echte mensenlevens zijn.,dat dit echte mensenlevens zijn.,That these are real human lives.,realization,moderate
"00:39:10,000","00:39:15,000","Zodra er ontwikkelingen zijn in de dossiers van deze coach en meester,","Zodra er ontwikkelingen zijn in de dossiers van deze coach en meester,","As soon as there are developments in the files of this coach and master,",neutral,neutral
"00:39:15,000","00:39:19,000","of nieuws vanuit Politiek Den Haag, meld ik dat via mijn Instagram","of nieuws vanuit Politiek Den Haag, meld ik dat via mijn Instagram","or news from Politiek The Hague, I report that via my Instagram",neutral,neutral
"00:39:20,000","00:39:21,000",account alberto.stegeman.,account alberto.stegeman.,Account Alberto.stegeman.,neutral,neutral
"00:39:22,000","00:39:26,000",Mocht u na aanleiding van deze uitzending behoefte voelen te,Mocht u na aanleiding van deze uitzending behoefte voelen te,Should you feel needed after this broadcast,caring,moderate
"00:39:26,000","00:39:29,000","praten over zelfmoordgedachten, dat kan anoniem.","praten over zelfmoordgedachten, dat kan anoniem.","Talking about suicide thoughts, that can be anonymous.",caring,moderate
"00:39:29,000","00:39:35,000",Chat via 113.nl of bel gratis 0800-0113.,Chat via 113.nl of bel gratis 0800-0113.,Chat via 113.nl or call 0800-0113 for free.,caring,moderate
"00:39:35,000","00:39:39,000","Tot zover deze uitzending, maar volgende week zijn wij terug.","Tot zover deze uitzending, maar volgende week zijn wij terug.","So much for this broadcast, but we will be back next week.",neutral,neutral
"00:39:40,000","00:39:41,000","Zelfde tijd, zelfde zender.","Zelfde tijd, zelfde zender.","Same time, same channel.",neutral,neutral
