Start Time,End Time,Sentence,Corrected Sentence,Translation,Emotion,Intensity
"00:14:56,000","00:14:58,000",Uiteraard houdt mijn collega...,Uiteraard houdt mijn collega...,Of course my colleague keeps ...,neutral,neutral
"00:14:58,000","00:15:00,000",wel haar kleren aan.,wel haar kleren aan.,Her clothes on.,relief,mild
"00:15:00,000","00:15:02,000",Deze Ben de Men wil totale controle...,Deze Ben de Men wil totale controle...,This one is the Men wants total control ...,disgust,intense
"00:15:02,000","00:15:04,000",over het 15-jarige zieke meisje.,over het 15-jarige zieke meisje.,About the 15-year-old sick girl.,sadness,intense
"00:15:04,000","00:15:06,000",Hij zegt haar voortgang...,Hij zegt haar voortgang...,He says her progress ...,neutral,neutral
"00:15:06,000","00:15:08,000",te willen controleren.,te willen controleren.,want to check.,neutral,neutral
"00:15:08,000","00:15:10,000",Het is weerzinwekkend.,Het is weerzinwekkend.,It is disgusting.,disgust,intense
"00:15:10,000","00:15:12,000",Maar hij zegt dat het meisje kan afvallen...,Maar hij zegt dat het meisje kan afvallen...,But he says the girl can lose weight ...,disgust,intense
"00:15:12,000","00:15:14,000",als hem orale seks geeft.,als hem orale seks geeft.,If he gives oral sex.,disgust,overwhelming
"00:15:14,000","00:15:16,000",En hij wil haar ontmaagden.,En hij wil haar ontmaagden.,And he wants to deflower her.,disgust,overwhelming
"00:15:16,000","00:15:18,000",En dit alles...,En dit alles...,And all this ...,neutral,neutral
"00:15:18,000","00:15:20,000",terwijl hij weet dat het een 15-jarig meisje is...,terwijl hij weet dat het een 15-jarig meisje is...,While he knows it is a 15-year-old girl ...,disgust,intense
"00:15:20,000","00:15:22,000",met een eetstoornis.,met een eetstoornis.,With an eating disorder.,sadness,intense
"00:15:22,000","00:15:24,000",Dat het streven heeft...,Dat het streven heeft...,That the aim has ...,neutral,neutral
"00:15:24,000","00:15:26,000",om slechts 40 kilo te wegen.,om slechts 40 kilo te wegen.,To weigh only 40 kilos.,neutral,neutral
"00:15:26,000","00:15:28,000",Hilde Houweling ontwikkelde...,Hilde Houweling ontwikkelde...,Hilde Houweling developed ...,neutral,neutral
"00:15:28,000","00:15:30,000",rond haar 15e jaar...,rond haar 15e jaar...,Around the age of 15 ...,neutral,neutral
"00:15:30,000","00:15:32,000",een zware eetstoornis.,een zware eetstoornis.,A heavy eating disorder.,sadness,intense
"00:15:32,000","00:15:34,000",Die zei na een levensbedreigende strijd...,Die zei na een levensbedreigende strijd...,He said after a life -threatening battle ...,admiration,moderate
"00:15:34,000","00:15:36,000",uiteindelijk overwon.,uiteindelijk overwon.,Finally overcame.,relief,intense
"00:15:36,000","00:15:38,000",Ze schreef er een boek over.,Ze schreef er een boek over.,She wrote a book about it.,pride,moderate
"00:15:38,000","00:15:40,000",En werkt inmiddels...,En werkt inmiddels...,And now works ...,neutral,neutral
"00:15:40,000","00:15:42,000",bij een behandelcentrum voor eetstoornissen.,bij een behandelcentrum voor eetstoornissen.,At a treatment center for eating disorders.,neutral,neutral
"00:15:42,000","00:15:44,000",Jij bent een ex-anorexia-patiënt.,Jij bent een ex-anorexia-patiënt.,You are an ex-Anorexia patient.,neutral,neutral
"00:15:44,000","00:15:46,000",Hoe ben jij patiënt geworden?,Hoe ben jij patiënt geworden?,How did you become a patient?,curiosity,mild
"00:15:46,000","00:15:48,000",Ik heb te maken gehad...,Ik heb te maken gehad...,I have had to deal with ...,sadness,mild
"00:15:48,000","00:15:50,000",met een hockeytrainer...,met een hockeytrainer...,With a hockey trainer ...,neutral,neutral
"00:15:50,000","00:15:52,000",die misbruik van mij heeft gemaakt.,die misbruik van mij heeft gemaakt.,that abused mine.,anger,intense
"00:15:52,000","00:15:54,000",En dat is uiteindelijk een beetje de druppel geweest...,En dat is uiteindelijk een beetje de druppel geweest...,And that was a bit of the drop in the end ...,realization,moderate
"00:15:54,000","00:15:56,000",om anorexia te ontwikkelen.,om anorexia te ontwikkelen.,To develop anorexia.,sadness,moderate
"00:15:56,000","00:15:58,000",Ik ben een aantal keer opgenomen geweest.,Ik ben een aantal keer opgenomen geweest.,I have been admitted a number of times.,sadness,mild
"00:15:58,000","00:16:00,000",Ik heb daarin ook...,Ik heb daarin ook...,I have that too ...,neutral,neutral
"00:16:00,000","00:16:02,000",een lage wiskunde gehad.,een lage wiskunde gehad.,Had a low math.,neutral,neutral
"00:16:02,000","00:16:04,000",Ik heb daarin ook een laag gewicht bereikt...,Ik heb daarin ook een laag gewicht bereikt...,I also reached a low weight ...,sadness,moderate
"00:16:04,000","00:16:06,000",waarin het echt wel de vraag was...,waarin het echt wel de vraag was...,In which it was really the question ...,confusion,mild
"00:16:06,000","00:16:08,000",in hoeverre ga ik dit lang volhouden.,in hoeverre ga ik dit lang volhouden.,To what extent will I keep this up for a long time.,fear,moderate
"00:16:08,000","00:16:10,000",Hoeveel kilo woog jij?,Hoeveel kilo woog jij?,How many kilos did you weigh?,curiosity,mild
"00:16:10,000","00:16:12,000",Op mijn laagste gewicht woog ik...,Op mijn laagste gewicht woog ik...,At my lowest weight I weighed ...,sadness,moderate
"00:16:12,000","00:16:14,000","ik denk rond de 32, 33 kilo.","ik denk rond de 32, 33 kilo.","I think around 32, 33 kilos.",sadness,moderate
"00:16:16,000","00:16:18,000",Zo.,Zo.,Like this.,neutral,neutral
"00:16:18,000","00:16:20,000",Nu doen wij onderzoek...,Nu doen wij onderzoek...,Now we are doing research ...,neutral,neutral
"00:16:20,000","00:16:22,000",naar afvalcoaches...,naar afvalcoaches...,To waste coaches ...,disapproval,moderate
"00:16:22,000","00:16:24,000",die op die ProAnna-sites actief zijn.,die op die ProAnna-sites actief zijn.,who are active on those proannas.,disapproval,moderate
"00:16:24,000","00:16:26,000",Ben jij ooit op die sites geweest?,Ben jij ooit op die sites geweest?,Have you ever been to those sites?,curiosity,mild
"00:16:26,000","00:16:28,000","Ja, ik heb er wel eens op gekeken.","Ja, ik heb er wel eens op gekeken.","Yes, I have looked at it sometimes.",neutral,neutral
"00:16:28,000","00:16:30,000",En dat was ook omdat ik...,En dat was ook omdat ik...,And that was also because I ...,neutral,neutral
"00:16:30,000","00:16:32,000",niemand in mijn omgeving kende...,niemand in mijn omgeving kende...,Nobody in my area knew ...,sadness,mild
"00:16:32,000","00:16:34,000",die een eetstoornis had.,die een eetstoornis had.,who had an eating disorder.,neutral,neutral
"00:16:34,000","00:16:36,000","Dus het voelde ergens ook, hoe ziekelijk ook...","Dus het voelde ergens ook, hoe ziekelijk ook...","So it also felt somewhere, no matter how sickly ...",confusion,moderate
"00:16:36,000","00:16:38,000",als een soort lotgenotencontact.,als een soort lotgenotencontact.,As a kind of fellow sufferer contact.,caring,mild
"00:16:38,000","00:16:40,000","Die mensen, die jongens en meisjes...","Die mensen, die jongens en meisjes...","Those people, those boys and girls ...",neutral,neutral
"00:16:40,000","00:16:42,000",die vaak op die sites gaan...,die vaak op die sites gaan...,The often on the sites go ...,neutral,neutral
"00:16:42,000","00:16:44,000",die hebben nog totaal geen ziektebezef.,die hebben nog totaal geen ziektebezef.,They have no disease at all.,disapproval,moderate
"00:16:44,000","00:16:46,000",Die zitten ook in de ontkenningsfase...,Die zitten ook in de ontkenningsfase...,They are also in the denial phase ...,realization,moderate
"00:16:46,000","00:16:48,000","en die hebben nog het idee, zoals ik ook op het begin had...","en die hebben nog het idee, zoals ik ook op het begin had...","And they still have the idea, as I also had at the beginning ...",realization,moderate
"00:16:48,000","00:16:50,000",dat ze heel goed bezig zijn.,dat ze heel goed bezig zijn.,That they are doing very well.,approval,mild
"00:16:50,000","00:16:52,000",En dat ze er hulp bij willen en dat ze het goed doen.,En dat ze er hulp bij willen en dat ze het goed doen.,And that they want help with it and that they are doing well.,optimism,mild
"00:16:52,000","00:16:54,000",En dat krijgen ze natuurlijk ook te horen...,En dat krijgen ze natuurlijk ook te horen...,And of course they also hear that ...,neutral,neutral
"00:16:54,000","00:16:56,000",van dat soort coaches.,van dat soort coaches.,From that kind of coaches.,disapproval,moderate
"00:16:56,000","00:16:58,000",Dat ze goed bezig zijn en dat ze er beter van worden.,Dat ze goed bezig zijn en dat ze er beter van worden.,That they are doing well and that they benefit from it.,optimism,mild
"00:16:58,000","00:17:00,000",En dat natuurlijk het tegenovergestelde is.,En dat natuurlijk het tegenovergestelde is.,And that of course is the opposite.,realization,moderate
"00:17:00,000","00:17:02,000",Deze ben-de-man wil elke dag...,Deze ben-de-man wil elke dag...,This Ben-de-Man wants every day ...,disgust,intense
"00:17:02,000","00:17:04,000",van de 15-jarige Nora weten...,van de 15-jarige Nora weten...,Know from 15-year-old Nora ...,neutral,neutral
"00:17:04,000","00:17:06,000",wat ze eet en hoeveel ze sport.,wat ze eet en hoeveel ze sport.,What she eats and how much she sport.,disgust,intense
"00:17:06,000","00:17:08,000",Ook wil hij een zogenaamde...,Ook wil hij een zogenaamde...,He also wants a so -called ...,disgust,intense
"00:17:08,000","00:17:10,000",intake-sessie met haar doen.,intake-sessie met haar doen.,Do intake session with her.,disgust,intense
"00:17:10,000","00:17:12,000",Om haar te leren om seks met hem te hebben.,Om haar te leren om seks met hem te hebben.,To teach her to have sex with him.,disgust,overwhelming
"00:17:12,000","00:17:14,000",Hij heeft daarvoor zelfs een hotelkamer geboekt.,Hij heeft daarvoor zelfs een hotelkamer geboekt.,He even booked a hotel room for that.,disgust,overwhelming
"00:17:14,000","00:17:16,000",Het is de hoogste tijd...,Het is de hoogste tijd...,It's high time ...,fear,intense
"00:17:16,000","00:17:18,000",deze man te stoppen.,deze man te stoppen.,to stop this man.,anger,intense
"00:17:18,000","00:17:20,000",Het is tijd voor de confrontatie...,Het is tijd voor de confrontatie...,It's time for the confrontation ...,optimism,intense
"00:17:20,000","00:17:22,000",met deze ben-de-man.,met deze ben-de-man.,With this Ben-de-Man.,anger,intense
"00:17:22,000","00:17:24,000",Deze zogenaamde coach.,Deze zogenaamde coach.,This so -called coach.,disapproval,moderate
"00:17:28,000","00:17:30,000",We weten helemaal niks van deze man.,We weten helemaal niks van deze man.,We don't know anything about this man.,curiosity,mild
"00:17:30,000","00:17:32,000","Geen naam, geen kenteken, geen auto.","Geen naam, geen kenteken, geen auto.","No name, no license plate, no car.",confusion,mild
"00:17:32,000","00:17:34,000",Geen gezicht. Helemaal niets.,Geen gezicht. Helemaal niets.,No face. Nothing at all.,confusion,moderate
"00:17:34,000","00:17:36,000",We hebben alleen de chats.,We hebben alleen de chats.,We only have the chats.,neutral,neutral
"00:17:36,000","00:17:38,000",En die liegen er niet om.,En die liegen er niet om.,And they don't lie.,realization,moderate
"00:17:38,000","00:17:40,000",Hij geeft aan dat hij met dit 15-jarige meisje...,Hij geeft aan dat hij met dit 15-jarige meisje...,He indicates that with this 15-year-old girl ...,disgust,moderate
"00:17:40,000","00:17:42,000",seks wil.,seks wil.,Sex will.,disgust,intense
"00:17:42,000","00:17:44,000","Hij wil haar leren pijpen, om het zomaar te noemen.","Hij wil haar leren pijpen, om het zomaar te noemen.","He wants to teach her to blow, to name it.",disgust,intense
"00:17:44,000","00:17:46,000",Maar tegelijkertijd...,Maar tegelijkertijd...,But at the same time ...,neutral,neutral
"00:17:46,000","00:17:48,000",weet hij ook dat dit meisje...,weet hij ook dat dit meisje...,He also knows that this girl ...,caring,mild
"00:17:48,000","00:17:50,000",knetsbaar is.,knetsbaar is.,knetsbaar is.,caring,moderate
"00:17:50,000","00:17:52,000",55 kilo.,55 kilo.,55 kilo.,neutral,neutral
"00:17:52,000","00:17:54,000","Ze zegt, ik wil nog 15 kilo krijgen.","Ze zegt, ik wil nog 15 kilo krijgen.","She says, I want to get 15 more kilos.",desire,mild
"00:17:54,000","00:17:56,000",En hij zegt...,En hij zegt...,And he says ...,neutral,neutral
"00:17:56,000","00:17:58,000",ik wil nog 15 kilo kwijt.,ik wil nog 15 kilo kwijt.,I want to lose 15 more kilos.,desire,mild
"00:17:58,000","00:18:00,000",Het is een meisje met zeer ernstige...,Het is een meisje met zeer ernstige...,It's a girl with very serious ...,sadness,moderate
"00:18:00,000","00:18:02,000",problemen.,problemen.,Problems.,sadness,moderate
"00:18:02,000","00:18:04,000",Een anorexia-patiënt.,Een anorexia-patiënt.,An anorexia patient.,sadness,moderate
"00:18:04,000","00:18:06,000",En hij wil daar misbruik van maken.,En hij wil daar misbruik van maken.,And he wants to abuse it.,anger,intense
"00:18:06,000","00:18:08,000","Hij zegt haar, we zullen coachen.","Hij zegt haar, we zullen coachen.","He tells her, we will coach.",optimism,mild
"00:18:08,000","00:18:10,000",Maar ondertussen gebruikt hij...,Maar ondertussen gebruikt hij...,But in the meantime he uses ...,neutral,neutral
"00:18:10,000","00:18:12,000",die zogenaamde coaching...,die zogenaamde coaching...,That so -called coaching ...,disapproval,moderate
"00:18:12,000","00:18:14,000",om haar in bed te krijgen.,om haar in bed te krijgen.,To get her to bed.,disgust,intense
"00:18:16,000","00:18:18,000",Hoog tijd voor een pittige confrontatie.,Hoog tijd voor een pittige confrontatie.,High time for a spicy confrontation.,optimism,moderate
"00:18:20,000","00:18:22,000","Die coaches die daar zijn, die zijn vaak...","Die coaches die daar zijn, die zijn vaak...",Those coaches who are there are often ...,disapproval,moderate
"00:18:22,000","00:18:24,000","heel dwingend, heel dominant.","heel dwingend, heel dominant.","Very compelling, very dominant.",disapproval,moderate
"00:18:24,000","00:18:26,000",En die bepalen...,En die bepalen...,And they determine ...,disapproval,moderate
"00:18:26,000","00:18:28,000","wat je wel, maar vooral...","wat je wel, maar vooral...","What you, but especially ...",neutral,neutral
"00:18:28,000","00:18:30,000",wat je niet moet eten.,wat je niet moet eten.,What you shouldn't eat.,disapproval,moderate
"00:18:32,000","00:18:34,000",Waarom rennen die dames...,Waarom rennen die dames...,Why do those ladies run ...,curiosity,mild
"00:18:34,000","00:18:36,000",dan niet weg?,dan niet weg?,Then not gone?,confusion,mild
"00:18:36,000","00:18:38,000","Omdat ze, denk ik, gevangen zitten...","Omdat ze, denk ik, gevangen zitten...","Because, I think, they are trapped ...",sadness,moderate
"00:18:38,000","00:18:40,000",in zichzelf en in de eetstoornis.,in zichzelf en in de eetstoornis.,In itself and in the eating disorder.,sadness,moderate
"00:18:40,000","00:18:42,000",Het is vreselijk om te zien.,Het is vreselijk om te zien.,It is terrible to see.,sadness,intense
"00:18:42,000","00:18:44,000",En die coaches hebben...,En die coaches hebben...,And those coaches have ...,disapproval,moderate
"00:18:44,000","00:18:46,000","de persoon in hun macht, mensen met een eetstoornis.","de persoon in hun macht, mensen met een eetstoornis.","The person in their power, people with an eating disorder.",anger,moderate
"00:18:46,000","00:18:48,000",Maar eigenlijk heeft die eetstoornis hun in de macht.,Maar eigenlijk heeft die eetstoornis hun in de macht.,But actually that eating disorder has them in power.,realization,moderate
"00:18:48,000","00:18:50,000","Want wat die coaches doen, ze versterken...","Want wat die coaches doen, ze versterken...","Because what those coaches do, they strengthen ...",disapproval,moderate
"00:18:50,000","00:18:52,000",die eetstoornis.,die eetstoornis.,That eating disorder.,sadness,moderate
"00:18:52,000","00:18:54,000",En dat wordt op een gegeven moment overgenomen.,En dat wordt op een gegeven moment overgenomen.,And that is taken over at some point.,realization,mild
"00:18:54,000","00:18:56,000",Alsof je in een gevangenis zit...,Alsof je in een gevangenis zit...,As if you are in a prison ...,sadness,intense
"00:18:56,000","00:18:58,000","waarvan je zelf de sleutel hebt, maar het gat niet meer kan vinden.","waarvan je zelf de sleutel hebt, maar het gat niet meer kan vinden.","Of which you have the key yourself, but can no longer find the gap.",confusion,moderate
"00:18:58,000","00:19:00,000",En eigenlijk ben je zelf ook een slaaf...,En eigenlijk ben je zelf ook een slaaf...,And actually you are a slave yourself ...,sadness,intense
"00:19:00,000","00:19:02,000",van je eetstoornis.,van je eetstoornis.,of your eating disorder.,sadness,intense
"00:19:02,000","00:19:04,000",En word je dus een slaaf van de coach.,En word je dus een slaaf van de coach.,And so you become a slave to the coach.,sadness,intense
"00:19:04,000","00:19:06,000",Een aantal van die meiden...,Een aantal van die meiden...,Some of those girls ...,sadness,moderate
"00:19:06,000","00:19:08,000",hebben ook daadwerkelijk seks gehad met hun coach.,hebben ook daadwerkelijk seks gehad met hun coach.,Have actually had sex with their coach.,disgust,intense
"00:19:08,000","00:19:10,000",Omdat ze voorgehouden is...,Omdat ze voorgehouden is...,Because she is presented ...,neutral,neutral
"00:19:10,000","00:19:12,000",dat je van seks afvalt.,dat je van seks afvalt.,That you lose sex.,confusion,mild
"00:19:12,000","00:19:14,000",En dat het goed voor je is.,En dat het goed voor je is.,And that it's good for you.,neutral,neutral
"00:19:14,000","00:19:16,000",Dat gaat wel heel ver.,Dat gaat wel heel ver.,That goes very far.,neutral,neutral
"00:19:16,000","00:19:18,000","Ja, maar dat is wat een eetstoornis doet.","Ja, maar dat is wat een eetstoornis doet.","Yes, but that is what an eating disorder does.",realization,moderate
"00:19:18,000","00:19:20,000",Die gaat heel ver.,Die gaat heel ver.,It goes very far.,neutral,neutral
"00:19:20,000","00:19:22,000",En die gaat op alle vlakken ver.,En die gaat op alle vlakken ver.,And it goes far in all areas.,neutral,neutral
"00:19:22,000","00:19:24,000",Het maakt eigenlijk op een gegeven moment niet meer uit...,Het maakt eigenlijk op een gegeven moment niet meer uit...,At some point it doesn't matter anymore ...,sadness,mild
"00:19:24,000","00:19:26,000",wat je ervoor moet doen om af te vallen.,wat je ervoor moet doen om af te vallen.,What you have to do to lose weight.,neutral,neutral
"00:19:26,000","00:19:28,000",Of om minder te eten.,Of om minder te eten.,Or to eat less.,neutral,neutral
"00:19:28,000","00:19:30,000",Je doet er alles voor.,Je doet er alles voor.,You do everything for it.,optimism,moderate
"00:19:30,000","00:19:32,000",Echt alles.,Echt alles.,Really everything.,optimism,moderate
"00:19:32,000","00:19:34,000",Dit is de plek waar ze hebben afgesproken.,Dit is de plek waar ze hebben afgesproken.,This is the place where they have agreed.,neutral,neutral
"00:19:34,000","00:19:36,000","Bij het bankje daar, aan de overkant.","Bij het bankje daar, aan de overkant.","At the bench there, across the street.",neutral,neutral
"00:19:36,000","00:19:38,000",Mijn collega staat daar al.,Mijn collega staat daar al.,My colleague is already there.,neutral,neutral
"00:19:38,000","00:19:40,000",Met zicht op het bankje.,Met zicht op het bankje.,With a view of the bench.,neutral,neutral
"00:19:40,000","00:19:42,000",En op de plek waar die man straks gaat komen.,En op de plek waar die man straks gaat komen.,And at the place where that man will come later.,neutral,neutral
"00:19:42,000","00:19:44,000",Als dat goed is.,Als dat goed is.,If that's good.,neutral,neutral
"00:19:44,000","00:19:46,000",En wij gaan een stukje verderop staan.,En wij gaan een stukje verderop staan.,And we are going to stand a little further.,neutral,neutral
"00:19:46,000","00:19:48,000",Daar gaat straks mijn collega zitten.,Daar gaat straks mijn collega zitten.,My colleague will sit there soon.,neutral,neutral
"00:19:48,000","00:19:50,000",Hier staat mijn andere collega.,Hier staat mijn andere collega.,Here is my other colleague.,neutral,neutral
"00:19:50,000","00:19:52,000",Die de boel kan filmen.,Die de boel kan filmen.,Who can film things.,neutral,neutral
"00:19:52,000","00:19:54,000",En wij gaan aan het eind van deze parkeerplaats staan.,En wij gaan aan het eind van deze parkeerplaats staan.,And we will be at the end of this parking lot.,neutral,neutral
"00:20:00,000","00:20:04,000",Ik denk dat dit een perfecte plek is om te staan.,Ik denk dat dit een perfecte plek is om te staan.,I think this is a perfect place to stand.,approval,mild
"00:20:10,000","00:20:12,000",Succes.,Succes.,Succes.,optimism,mild
"00:20:12,000","00:20:16,000",Het is bijna tijd en mijn collega die het 15-jarige meisje speelt...,Het is bijna tijd en mijn collega die het 15-jarige meisje speelt...,It's almost time and my colleague who plays the 15-year-old girl ...,,
"00:20:16,000","00:20:20,000",gaat richting het bankje waar ze de man straks zal ontmoeten.,gaat richting het bankje waar ze de man straks zal ontmoeten.,goes to the bench where she will meet the man later.,,
"00:20:20,000","00:20:25,000",Vanzelfsprekend verliezen we haar geen seconde uit het oog.,Vanzelfsprekend verliezen we haar geen seconde uit het oog.,"Naturally, we will not lose sight of her for a second.",optimism,moderate
"00:20:25,000","00:20:28,000",Dit heeft hij allemaal naar dat meisje gestuurd.,Dit heeft hij allemaal naar dat meisje gestuurd.,He all sent this to that girl.,disapproval,moderate
"00:20:28,000","00:20:31,000",Krankzinnige voorstellen om af te vallen.,Krankzinnige voorstellen om af te vallen.,Insane proposals to lose weight.,disgust,intense
"00:20:31,000","00:20:38,000",Hij zegt dan ook hierbij zal je ook met mij moeten afspreken in het echt.,Hij zegt dan ook hierbij zal je ook met mij moeten afspreken in het echt.,He also says here you will also have to meet with me in real life.,disapproval,intense
"00:20:38,000","00:20:41,000","Waarom wij zeggen, hoezo echt? En wat moeten we dan doen?","Waarom wij zeggen, hoezo echt? En wat moeten we dan doen?","Why do we say, why really? And what should we do then?",confusion,moderate
"00:20:42,000","00:20:45,000","Dan zegt hij, nou, oefeningen. Controleren van je voortgang.","Dan zegt hij, nou, oefeningen. Controleren van je voortgang.","Then he says, well, exercises. Checking your progress.",disapproval,moderate
"00:20:45,000","00:20:48,000",Straffen en jou als seksslavin te gebruiken.,Straffen en jou als seksslavin te gebruiken.,Punishing and using you as a sex slave.,disgust,intense
"00:20:48,000","00:20:53,000",En daarna heeft hij twaalf regels gestuurd...,En daarna heeft hij twaalf regels gestuurd...,And then he sent twelve lines ...,disapproval,moderate
"00:20:54,000","00:20:57,000",waar wij ons als meisje van 15 aan moeten houden.,waar wij ons als meisje van 15 aan moeten houden.,What we have to adhere to as a girl of 15.,disapproval,moderate
"00:20:57,000","00:21:03,000","Regel 1, en dat zegt genoeg, alles wat wij doen blijft geheim.","Regel 1, en dat zegt genoeg, alles wat wij doen blijft geheim.","Rule 1, and that says enough, everything we do remains secret.",disapproval,intense
"00:21:04,000","00:21:05,000",Je bespreekt het met niemand anders.,Je bespreekt het met niemand anders.,You discuss it with no one else.,disapproval,intense
"00:21:05,000","00:21:11,000","Regel 2, je mag geen contact hebben met andere mannen, coaches of pro-anna-buddies.","Regel 2, je mag geen contact hebben met andere mannen, coaches of pro-anna-buddies.","Rule 2, you are not allowed to have contact with other men, coaches or pro-anna-buddies.",disapproval,intense
"00:21:11,000","00:21:14,000",En zo gaat het maar door met bizarre regels.,En zo gaat het maar door met bizarre regels.,And so it goes on with bizarre rules.,disgust,intense
"00:21:14,000","00:21:19,000",Het komt erop neer dat Ben de Man alles bepaalt voor het meisje.,Het komt erop neer dat Ben de Man alles bepaalt voor het meisje.,The bottom line is that Ben the man determines everything for the girl.,disapproval,intense
"00:21:19,000","00:21:21,000","Regel 10, je hebt geen geheimen voor mij.","Regel 10, je hebt geen geheimen voor mij.","Rule 10, you have no secrets for me.",disapproval,intense
"00:21:22,000","00:21:27,000","Regel 11, wanneer we afspreken, bepaal ik wat je aantrekt en hoe jij je opmaakt.","Regel 11, wanneer we afspreken, bepaal ik wat je aantrekt en hoe jij je opmaakt.","Rule 11, when we agree, I determine what you attract and how you prepare.",disapproval,intense
"00:21:27,000","00:21:31,000","Regel 12, overgeven mag niet.","Regel 12, overgeven mag niet.",Rule 12 is not allowed.,disapproval,intense
"00:21:31,000","00:21:36,000",Dit stuurt een volwassen man naar een 15-jarig meisje van 55 kilo...,Dit stuurt een volwassen man naar een 15-jarig meisje van 55 kilo...,This sends an adult man to a 15-year-old girl of 55 kilos ...,disgust,intense
"00:21:36,000","00:21:40,000",dat ook nog eens zegt 15 kilo te willen afvallen.,dat ook nog eens zegt 15 kilo te willen afvallen.,That also says it wants to lose 15 kilos.,desire,moderate
"00:21:40,000","00:21:42,000",Onvoorstelbaar.,Onvoorstelbaar.,Unbelievable.,surprise,moderate
"00:21:42,000","00:21:48,000",En deze man heeft ook allemaal advertenties zelf op allerlei fora geplaatst...,En deze man heeft ook allemaal advertenties zelf op allerlei fora geplaatst...,And this man has also placed all advertisements on all kinds of forums ...,disapproval,intense
"00:21:49,000","00:21:52,000",waarin hij vraagt om meiden om zich bij hem te melden.,waarin hij vraagt om meiden om zich bij hem te melden.,In which he asks for girls to report to him.,disgust,intense
