Start Time,End Time,Sentence,Corrected Sentence,Translation,Emotion,Intensity
"00:35:36,000","00:35:37,000","Y si la va a cagar, que la cague.","Y si la va a cagar, que la cague.","And if he is going to shit it, let him shine.",disapproval,moderate
"00:35:37,000","00:35:38,000",Que se siente aquí y te la dé.,Que se siente aquí y te la dé.,That he feels here and gives it to you.,neutral,neutral
"00:35:39,000","00:35:41,000","Y que si la caga, que la cague con toda, tío.","Y que si la caga, que la cague con toda, tío.","And that if he shits her, that he screws her up, uncle.",anger,moderate
"00:35:41,000","00:35:43,000","Porque si sales con esto, lo perdonas.","Porque si sales con esto, lo perdonas.","Because if you go out with this, you forgive it.",neutral,neutral
"00:35:43,000","00:35:44,000",Exactamente.,Exactamente.,Exactly.,neutral,neutral
"00:35:44,000","00:35:45,000",Porque no hay nada grave.,Porque no hay nada grave.,Because there is nothing serious.,neutral,neutral
"00:35:45,000","00:35:46,000",Entonces esto se perdona.,Entonces esto se perdona.,So this is forgiven.,neutral,neutral
"00:35:46,000","00:35:48,000",Pero déjale a ver hasta dónde iba.,Pero déjale a ver hasta dónde iba.,But let him see how far he went.,disapproval,moderate
"00:35:48,000","00:35:50,000","Déjale que se equivoque, se va a arrepentir.","Déjale que se equivoque, se va a arrepentir.","Let him be wrong, he will regret it.",disapproval,moderate
"00:35:53,000","00:35:54,000",Ruth.,Ruth.,Ruth.,neutral,neutral
"00:35:56,000","00:35:58,000",No hay más imágenes para ti.,No hay más imágenes para ti.,There are no more images for you.,neutral,neutral
"00:36:02,000","00:36:04,000",Que Nico se plantea irse solo me parece ya,Que Nico se plantea irse solo me parece ya,That Nico considers to leave alone it already seems to me,disappointment,moderate
"00:36:04,000","00:36:06,000",lo último que me faltaba por oír.,lo último que me faltaba por oír.,The last thing I need to hear.,annoyance,moderate
"00:36:06,000","00:36:08,000","Me regaló los oídos de que yo era la mujer de su vida,","Me regaló los oídos de que yo era la mujer de su vida,","He gave me the ears that I was the wife of his life,",confusion,mild
"00:36:08,000","00:36:09,000",que ni la isla podía con nosotros,que ni la isla podía con nosotros,That not even the island with us,neutral,neutral
"00:36:09,000","00:36:11,000","y a la vista hasta que, mira,","y a la vista hasta que, mira,","And in sight until, look,",neutral,neutral
"00:36:11,000","00:36:13,000",ni la última hoguera ni la tercera hoguera ya,ni la última hoguera ni la tercera hoguera ya,Neither the last bonfire nor the third bonfire already,neutral,neutral
"00:36:13,000","00:36:15,000",me dice que se plantea irse solo.,me dice que se plantea irse solo.,He tells me that he considers leaving alone.,disappointment,moderate
"00:36:22,000","00:36:23,000",Marieta.,Marieta.,Marieta,neutral,neutral
"00:36:24,000","00:36:25,000",Es tu turno.,Es tu turno.,It is your turn.,neutral,neutral
"00:36:27,000","00:36:29,000",Estar separada de Alex,Estar separada de Alex,Be separated from Alex,sadness,mild
"00:36:29,000","00:36:31,000",está ayudándote a conocer una parte de ti,está ayudándote a conocer una parte de ti,is helping you to know a part of you,realization,moderate
"00:36:31,000","00:36:33,000",que hasta ahora no habías descubierto.,que hasta ahora no habías descubierto.,that until now you had not discovered.,curiosity,mild
"00:36:33,000","00:36:35,000",Te sientes más libre.,Te sientes más libre.,You feel freer.,relief,moderate
"00:36:35,000","00:36:37,000",Estás dejándote llevar con Sergio,Estás dejándote llevar con Sergio,You are letting you take with Sergio,curiosity,mild
"00:36:37,000","00:36:40,000",y viviéndola ahora sin pensar demasiado,y viviéndola ahora sin pensar demasiado,and living it now without thinking too much,neutral,neutral
"00:36:40,000","00:36:42,000",en lo que está ocurriendo en la otra villa.,en lo que está ocurriendo en la otra villa.,in what is happening in the other villa.,neutral,neutral
"00:36:42,000","00:36:45,000",Pero esta noche me has dicho,Pero esta noche me has dicho,But tonight you told me,neutral,neutral
"00:36:45,000","00:36:47,000",que estás pensando más que nunca en Alex.,que estás pensando más que nunca en Alex.,that you are thinking more than ever in Alex.,,
"00:36:47,000","00:36:49,000","Sí, Sandra, para mí venir aquí","Sí, Sandra, para mí venir aquí","Yes, Sandra, for me to come here",realization,moderate
"00:36:49,000","00:36:51,000",es un choque con la realidad.,es un choque con la realidad.,It is a clash with reality.,realization,intense
"00:36:52,000","00:36:54,000","Yo me acuerdo muchas veces de Alex,","Yo me acuerdo muchas veces de Alex,","I remember Alex many times,",,
"00:36:54,000","00:36:57,000","aunque parezca que no, lo llevo más para adentro.","aunque parezca que no, lo llevo más para adentro.","Although it seems not, I take it more to inside.",sadness,moderate
"00:36:58,000","00:37:03,000","Y la luz roja, yo espero, de verdad, Sandra,","Y la luz roja, yo espero, de verdad, Sandra,","And the red light, I really hope, Sandra,",nervousness,mild
"00:37:03,000","00:37:05,000","te lo digo de corazón,","te lo digo de corazón,","I tell you from the heart,",caring,moderate
"00:37:05,000","00:37:08,000",que la luz roja que sonó después de la segunda hoguera,que la luz roja que sonó después de la segunda hoguera,that the red light that sounded after the second bonfire,fear,moderate
"00:37:08,000","00:37:10,000",no sea de mi novio.,no sea de mi novio.,Don't be my boyfriend.,fear,moderate
"00:37:11,000","00:37:12,000",¿Por qué?,¿Por qué?,Because?,confusion,mild
"00:37:12,000","00:37:14,000",Porque sería por despecho.,Porque sería por despecho.,Because it would be for spite.,anger,moderate
"00:37:15,000","00:37:17,000",No quiero una persona despechada en mi vida.,No quiero una persona despechada en mi vida.,I don't want a disreated person in my life.,disapproval,intense
"00:37:17,000","00:37:19,000",Quiero una persona que haga las cosas de corazón,Quiero una persona que haga las cosas de corazón,I want a person who does the heart things,desire,moderate
"00:37:19,000","00:37:21,000",como las hago yo.,como las hago yo.,As I do.,neutral,neutral
"00:37:21,000","00:37:23,000",Que haga lo correcto de corazón.,Que haga lo correcto de corazón.,Do the right heart.,desire,mild
"00:37:23,000","00:37:24,000",Que pienses de corazón.,Que pienses de corazón.,THAT YOU THINK OF THE HEART.,desire,intense
"00:37:24,000","00:37:26,000",Que te acuestes con alguien de corazón.,Que te acuestes con alguien de corazón.,May you lie with someone at heart.,desire,moderate
"00:37:26,000","00:37:28,000","De despecho, no.","De despecho, no.","In spite, no.",disapproval,mild
"00:37:30,000","00:37:31,000",Marieta.,Marieta.,Marieta,neutral,neutral
"00:37:33,000","00:37:35,000",Hay imágenes de Alex para ti.,Hay imágenes de Alex para ti.,There are images of Alex for you.,neutral,neutral
"00:37:36,000","00:37:38,000",¿Quieres verlas sola o con tus compañeras?,¿Quieres verlas sola o con tus compañeras?,Do you want to see them alone or with your companions?,curiosity,mild
"00:37:38,000","00:37:39,000",Con ellas.,Con ellas.,With them.,neutral,neutral
"00:37:39,000","00:37:40,000",Adelante.,Adelante.,Forward.,neutral,neutral
"00:37:44,000","00:37:45,000",A las preparadas.,A las preparadas.,To the prepared.,neutral,neutral
"00:37:45,000","00:37:46,000","Fuerte, ¿vale?","Fuerte, ¿vale?","Strong, okay?",caring,mild
"00:37:46,000","00:37:48,000","Yo lo siento por cómo reacciones, de verdad.","Yo lo siento por cómo reacciones, de verdad.","I'm sorry for how reactions, really.",remorse,moderate
"00:37:48,000","00:37:50,000","No, que no pidas perdón todo el rato,","No, que no pidas perdón todo el rato,","No, you don't apologize all the time,",annoyance,mild
"00:37:50,000","00:37:52,000",que estás súper mal acostumbrada a pedir perdón,que estás súper mal acostumbrada a pedir perdón,that you are super badly used to apologize,disapproval,moderate
"00:37:52,000","00:37:53,000",por todo lo que haces.,por todo lo que haces.,for everything you do.,disapproval,mild
"00:37:53,000","00:37:54,000",Marieta.,Marieta.,Marieta,neutral,neutral
"00:37:54,000","00:37:55,000",Pues no.,Pues no.,Well no.,neutral,neutral
"00:37:56,000","00:37:57,000",No me da rabia.,No me da rabia.,It doesn't give me anger.,neutral,neutral
"00:38:06,000","00:38:07,000",Por favor.,Por favor.,Please.,neutral,neutral
"00:38:08,000","00:38:09,000","Ay, de verdad.","Ay, de verdad.","Oh, really.",neutral,neutral
"00:38:10,000","00:38:11,000","Ay, de verdad.","Ay, de verdad.","Oh, really.",neutral,neutral
"00:38:12,000","00:38:13,000",Ay.,Ay.,Ay.,neutral,neutral
"00:38:19,000","00:38:20,000","Qué asco, tía.","Qué asco, tía.","What a disgust, aunt.",disgust,moderate
"00:38:21,000","00:38:23,000","Tía, está besando a mi novio, tío.","Tía, está besando a mi novio, tío.","Aunt, is kissing my boyfriend, uncle.",anger,intense
"00:38:26,000","00:38:28,000","Esa chica está besando a mi novio, tía.","Esa chica está besando a mi novio, tía.","That girl is kissing my boyfriend, Aunt.",anger,intense
"00:38:31,000","00:38:32,000","Madre mía, tía.","Madre mía, tía.","My mother, aunt.",surprise,moderate
"00:38:32,000","00:38:33,000","Ese es mi novio, tía.","Ese es mi novio, tía.","That is my boyfriend, aunt.",anger,intense
"00:38:33,000","00:38:35,000","Bueno, ¿por qué no fue ella?","Bueno, ¿por qué no fue ella?","Well, why wasn't it?",confusion,mild
"00:38:37,000","00:38:38,000","Ay, tía.","Ay, tía.","Ay, tía.",neutral,neutral
"00:38:39,000","00:38:41,000","Tía, ese es mi novio, tío.","Tía, ese es mi novio, tío.","Aunt, that's my boyfriend, uncle.",anger,intense
"00:38:50,000","00:38:51,000",Ese es mi novio.,Ese es mi novio.,That is my boyfriend.,anger,intense
"00:38:52,000","00:38:53,000",Qué vergüenza.,Qué vergüenza.,What a shame.,embarrassment,moderate
"00:38:53,000","00:38:55,000","Al final, ¿qué quieres?","Al final, ¿qué quieres?","In the end, what do you want?",confusion,mild
"00:38:55,000","00:38:57,000",¿Qué quieres? Es mi hija mía.,¿Qué quieres? Es mi hija mía.,What do you want? She is my daughter of mine.,confusion,moderate
"00:38:57,000","00:38:58,000",Es lo que hay.,Es lo que hay.,It is what there is.,neutral,neutral
"00:38:59,000","00:39:00,000",Es lo que hay.,Es lo que hay.,It is what there is.,neutral,neutral
"00:39:01,000","00:39:02,000","Me siento aquí y lo parto, sí.","Me siento aquí y lo parto, sí.","I feel here and I give it, yes.",neutral,neutral
"00:39:09,000","00:39:11,000","Ah, ya. Estaba claro, tío.","Ah, ya. Estaba claro, tío.","Ah, now. It was clear, uncle.",realization,mild
"00:39:13,000","00:39:14,000",Es de Río.,Es de Río.,It is river.,neutral,neutral
"00:39:20,000","00:39:21,000",Es que da asco verlo.,Es que da asco verlo.,It is that it disgusts to see it.,disgust,moderate
"00:39:26,000","00:39:27,000","¿Qué ocurre, Marieta?","¿Qué ocurre, Marieta?","What happens, Marieta?",curiosity,mild
"00:39:27,000","00:39:30,000","Sandra, qué puto asco, tío. Qué vergüenza.","Sandra, qué puto asco, tío. Qué vergüenza.","Sandra, what a fucking disgust, uncle. What a shame.",disgust,intense
"00:39:31,000","00:39:33,000",Es que es el primer chico que presento en mi casa.,Es que es el primer chico que presento en mi casa.,It is the first boy I present at my house.,pride,mild
"00:39:33,000","00:39:36,000","Es el primero con el que paso un San Valentín, una noche vieja.","Es el primero con el que paso un San Valentín, una noche vieja.","It is the first one with which a Valentine's Day, an old night.",neutral,neutral
"00:39:36,000","00:39:39,000",Es que es ese chico al que le está comiendo las tetas a una.,Es que es ese chico al que le está comiendo las tetas a una.,It is that boy who is eating the tits to one.,disgust,intense
"00:39:40,000","00:39:42,000",Es que le está dando lo que yo no le doy y guarreo.,Es que le está dando lo que yo no le doy y guarreo.,Is that he is giving him what I do not give him and guarro.,,
"00:39:43,000","00:39:44,000",Es que es eso.,Es que es eso.,It is that.,neutral,neutral
"00:39:45,000","00:39:46,000",Es que a mí no se me ve así.,Es que a mí no se me ve así.,It is that I do not look like this.,confusion,mild
"00:39:46,000","00:39:47,000",No. No.,No. No.,No no.,neutral,neutral
"00:39:47,000","00:39:49,000","Que tenemos momentos puntuales porque somos personas,","Que tenemos momentos puntuales porque somos personas,","That we have specific moments because we are people,",neutral,neutral
"00:39:49,000","00:39:51,000",pero es que... es que no.,pero es que... es que no.,But it is that no.,neutral,neutral
"00:39:51,000","00:39:54,000",Es que en todos los vídeos de todas lo veo haciendo guarreo.,Es que en todos los vídeos de todas lo veo haciendo guarreo.,It is that in all the videos of all I see it making a guine.,confusion,mild
"00:39:55,000","00:39:56,000",No lo he visto.,No lo he visto.,I have not seen it.,neutral,neutral
"00:39:56,000","00:39:58,000",Todavía sentado en el sofá teniendo una conversación.,Todavía sentado en el sofá teniendo una conversación.,Still sitting on the couch having a conversation.,neutral,neutral
"00:39:58,000","00:39:59,000",No lo he visto.,No lo he visto.,I have not seen it.,neutral,neutral
"00:40:00,000","00:40:02,000","Pero, Marieta, tú también te has dejado llevar.","Pero, Marieta, tú también te has dejado llevar.","But, Marieta, you have also let yourself go.",disapproval,mild
"00:40:02,000","00:40:04,000","Ya, Sandra, pero es que yo tengo una conexión.","Ya, Sandra, pero es que yo tengo una conexión.","Already, Sandra, but I have a connection.",neutral,neutral
"00:40:05,000","00:40:07,000","Es que yo me entiendo con la mirada,","Es que yo me entiendo con la mirada,","Is that I understand myself with my eyes,",pride,mild
"00:40:07,000","00:40:09,000","es que es una persona que me cuida,","es que es una persona que me cuida,","is that it is a person who takes care of me,",caring,moderate
"00:40:09,000","00:40:11,000","es que no estamos todo el día guarreando,","es que no estamos todo el día guarreando,","is that we are not all day by saying,",neutral,neutral
"00:40:11,000","00:40:13,000","es que nosotros nos relacionamos con los compañeros,","es que nosotros nos relacionamos con los compañeros,","is that we interact with colleagues,",neutral,neutral
"00:40:14,000","00:40:17,000","es que Sergio me escucha, es que me cuida, Sandra.","es que Sergio me escucha, es que me cuida, Sandra.","It is that Sergio listens to me, is that he takes care of me, Sandra.",caring,moderate
"00:40:17,000","00:40:19,000",¿Crees que Gabriela no está cuidando de Álex?,¿Crees que Gabriela no está cuidando de Álex?,Do you think Gabriela is not taking care of Alex?,curiosity,mild
"00:40:20,000","00:40:22,000",No. Gabriela está esperando lo que él está esperando.,No. Gabriela está esperando lo que él está esperando.,No. Gabriela is waiting for what he is waiting for.,neutral,neutral
"00:40:22,000","00:40:24,000",¿Crees que nos entienden con la mirada?,¿Crees que nos entienden con la mirada?,Do you think they understand us with their eyes?,curiosity,mild
"00:40:24,000","00:40:26,000",No. No he visto ninguna mirada.,No. No he visto ninguna mirada.,No. I have not seen any look.,neutral,neutral
"00:40:27,000","00:40:29,000",Solo he visto las lenguas entrelazadas.,Solo he visto las lenguas entrelazadas.,I have only seen the intertwined languages.,disapproval,mild
"00:40:30,000","00:40:31,000",Marieta...,Marieta...,Marieta ...,neutral,neutral
"00:40:33,000","00:40:35,000",hay más imágenes para ti.,hay más imágenes para ti.,There are more images for you.,neutral,neutral
"00:40:37,000","00:40:40,000","Es que me da vergüenza, es que no me sale ni llorar.","Es que me da vergüenza, es que no me sale ni llorar.","It is ashamed, it is not even crying.",disappointment,moderate
"00:40:40,000","00:40:43,000",Me da vergüenza haberle presentado a este señor a mi padre.,Me da vergüenza haberle presentado a este señor a mi padre.,I am ashamed to have introduced this man to my father.,embarrassment,intense
"00:40:43,000","00:40:45,000",Si se le puede llamar señor.,Si se le puede llamar señor.,If you can be called sir.,disapproval,mild
"00:40:45,000","00:40:47,000",Y que se haya sentado en el sofá de mi padre.,Y que se haya sentado en el sofá de mi padre.,And that he has sat on my father's couch.,disapproval,mild
"00:40:47,000","00:40:49,000","Me da vergüenza, tío. Me da vergüenza.","Me da vergüenza, tío. Me da vergüenza.","I am ashamed, uncle. I'm ashamed.",embarrassment,intense
"00:40:50,000","00:40:54,000","Es que no me quiero poner nerviosa, pero ya me va a salir nerviosa.","Es que no me quiero poner nerviosa, pero ya me va a salir nerviosa.","I don't want to get nervous, but it's going to get nervous.",nervousness,moderate
"00:41:00,000","00:41:02,000",Creo que están...,Creo que están...,I think they are ...,confusion,mild
"00:41:03,000","00:41:04,000",¿Están cuidando ahí?,¿Están cuidando ahí?,Are they taking care of there?,curiosity,mild
"00:41:04,000","00:41:06,000",Están ahí. No me voy a acercar ni a verlo.,Están ahí. No me voy a acercar ni a verlo.,They are there. I will not approach or see it.,fear,moderate
"00:41:10,000","00:41:11,000","¡Ay, por favor!","¡Ay, por favor!","Oh, please!",annoyance,mild
"00:41:11,000","00:41:12,000","¡Ay, por favor!","¡Ay, por favor!","Oh, please!",annoyance,mild
"00:41:12,000","00:41:13,000",Ya lo tenemos.,Ya lo tenemos.,We already have it.,neutral,neutral
"00:41:13,000","00:41:14,000","¡Ay, por favor!","¡Ay, por favor!","Oh, please!",annoyance,mild
"00:41:17,000","00:41:18,000",Ya está.,Ya está.,That's it.,neutral,neutral
"00:41:19,000","00:41:20,000",¿Me vienes conmigo?,¿Me vienes conmigo?,Can you come with me?,neutral,neutral
"00:41:39,000","00:41:40,000",Ya está.,Ya está.,That's it.,neutral,neutral
"00:41:41,000","00:41:44,000","Ay, ay, ay, ay, ay, ay...","Ay, ay, ay, ay, ay, ay...","Ay, is, is, is, is, is ...",nervousness,moderate
"00:41:44,000","00:41:46,000","Ay, ay, ay, ay, ay, ay...","Ay, ay, ay, ay, ay, ay...","Ay, is, is, is, is, is ...",nervousness,moderate
"00:41:46,000","00:41:48,000","Ay, ay, me cago en tu puta madre, me cago.","Ay, ay, me cago en tu puta madre, me cago.","Oh, oh, I shit in your motherfucker, I shit.",anger,intense
"00:41:50,000","00:41:51,000",¡Madre mía!,¡Madre mía!,My mother!,surprise,moderate
"00:41:52,000","00:41:55,000","¡Madre mía, tío! ¡Qué vergüenza, chaval!","¡Madre mía, tío! ¡Qué vergüenza, chaval!","My mother, uncle! What a shame, kid!",embarrassment,intense
"00:41:55,000","00:41:58,000",¡Qué vergüenza! ¡Qué vergüenza!,¡Qué vergüenza! ¡Qué vergüenza!,What a shame! What a shame!,embarrassment,intense
"00:41:59,000","00:42:01,000","¡Qué vergüenza, Sandra, de verdad!","¡Qué vergüenza, Sandra, de verdad!","What a shame, Sandra, really!",embarrassment,intense
"00:42:01,000","00:42:04,000",No te puedo ni mirar a la cara. ¡Qué vergüenza!,No te puedo ni mirar a la cara. ¡Qué vergüenza!,I can't even look at you. What a shame!,embarrassment,intense
"00:42:05,000","00:42:08,000",¡Que esto lo va a ver la gente! ¡Qué vergüenza!,¡Que esto lo va a ver la gente! ¡Qué vergüenza!,That this is going to see people! What a shame!,embarrassment,intense
"00:42:09,000","00:42:12,000","Es que no ha ido ni despacito. A la primera, ahí, todo.","Es que no ha ido ni despacito. A la primera, ahí, todo.","It has not gone or slowly. To the first, there, everything.",disappointment,moderate
"00:42:12,000","00:42:13,000",Te lo voy a dar todo.,Te lo voy a dar todo.,I'm going to give you everything.,anger,moderate
"00:42:17,000","00:42:20,000","¿Qué va, tío? ¿Qué va? ¿Esto qué es, una broma o qué?","¿Qué va, tío? ¿Qué va? ¿Esto qué es, una broma o qué?","What's going, uncle? What's going? What is this, a joke or what?",confusion,moderate
"00:42:20,000","00:42:22,000",¿A mí que me están vacilando o qué?,¿A mí que me están vacilando o qué?,To me who are hesitating me or what?,annoyance,moderate
"00:42:22,000","00:42:25,000","La puta Gabriela de los cojones. ¡Me cago en la hostia puta, tío!","La puta Gabriela de los cojones. ¡Me cago en la hostia puta, tío!","The whore Gabriela de los Cups. I shit in the host whore, uncle!",anger,intense
"00:42:27,000","00:42:31,000","Amor, es tu novio. No, o sea, ella no.","Amor, es tu novio. No, o sea, ella no.","Love is your boyfriend. No, that is, she doesn't.",confusion,moderate
"00:42:32,000","00:42:33,000",¡Vacilón!,¡Vacilón!,Cow!,anger,mild
"00:42:34,000","00:42:37,000","¡Es que es un vacilón, Sandra, tío! ¡Es que es un vacilón!","¡Es que es un vacilón, Sandra, tío! ¡Es que es un vacilón!","It is a vacylon, Sandra, uncle! It is a vacilón!",amusement,moderate
"00:42:38,000","00:42:40,000",¿Por qué crees que no?,¿Por qué crees que no?,Why do you think no?,curiosity,mild
"00:42:40,000","00:42:41,000",¿Por qué crees que no?,¿Por qué crees que no?,Why do you think no?,curiosity,mild
"00:42:41,000","00:42:43,000",¿Por qué crees que no?,¿Por qué crees que no?,Why do you think no?,curiosity,mild
"00:42:43,000","00:42:44,000",¡Es que es un vacilón!,¡Es que es un vacilón!,It is a vacilón!,amusement,moderate
"00:42:45,000","00:42:49,000",¿Por qué crees que Alex se ha dejado llevar con Gabriela?,¿Por qué crees que Alex se ha dejado llevar con Gabriela?,Why do you think Alex has been carried away with Gabriela?,curiosity,moderate
"00:42:50,000","00:42:51,000",Porque ha visto mi beso.,Porque ha visto mi beso.,Because he has seen my kiss.,realization,moderate
"00:42:51,000","00:42:54,000","Además, es que eso, ¿no? Además, llegar de la hoguera.","Además, es que eso, ¿no? Además, llegar de la hoguera.","Besides, is that, right? In addition, arrive from the bonfire.",confusion,mild
"00:42:54,000","00:42:55,000","Acción, reacción.","Acción, reacción.","Action, reaction.",neutral,neutral
"00:42:55,000","00:42:58,000","Llegó y le dijo, mi novia se ha dado un beso, vente para acá.","Llegó y le dijo, mi novia se ha dado un beso, vente para acá.","He arrived and said, my girlfriend has given a kiss, come here.",surprise,moderate
"00:42:59,000","00:43:01,000","Es que me quedo loca, de verdad, me quedo loca.","Es que me quedo loca, de verdad, me quedo loca.","I am crazy, really, I am crazy.",nervousness,intense
"00:43:01,000","00:43:02,000",Y yo parándome.,Y yo parándome.,And I stop.,neutral,neutral
"00:43:05,000","00:43:07,000",¿Crees que él ha cruzado más límites que tú?,¿Crees que él ha cruzado más límites que tú?,Do you think he has crossed more limits than you?,curiosity,moderate
"00:43:07,000","00:43:08,000",Sí.,Sí.,Yeah.,neutral,neutral
"00:43:08,000","00:43:11,000",Es que yo no me he puesto a guarrear delante de todos,Es que yo no me he puesto a guarrear delante de todos,Is that I have not put myself to keep in front of everyone,embarrassment,mild
"00:43:11,000","00:43:15,000","ni me he puesto a guarrear en las hamacas, ni nada.","ni me he puesto a guarrear en las hamacas, ni nada.","I haven't even put myself in the hammocks, or anything.",embarrassment,mild
"00:43:15,000","00:43:18,000","Yo si he tenido que guarrear, lo he hecho en mi cama.","Yo si he tenido que guarrear, lo he hecho en mi cama.","I have had to keep it, I have done it in my bed.",embarrassment,mild
"00:43:18,000","00:43:20,000","Y encima, he hecho poco.","Y encima, he hecho poco.","And above, I have done little.",disappointment,mild
"00:43:21,000","00:43:23,000",¿Cómo vas a actuar a partir de ahora?,¿Cómo vas a actuar a partir de ahora?,How are you going to act from now?,curiosity,mild
"00:43:24,000","00:43:25,000",Como estoy haciéndolo.,Como estoy haciéndolo.,As I am doing it.,neutral,neutral
"00:43:25,000","00:43:27,000","A mí, Sergio, me gusta.","A mí, Sergio, me gusta.","Me, Sergio, I like it.",desire,moderate
"00:43:28,000","00:43:30,000","Sergio saca lo mejor de mí, Sandra.","Sergio saca lo mejor de mí, Sandra.","Sergio draws the best of me, Sandra.",admiration,moderate
"00:43:31,000","00:43:33,000",Y... y voy a dejarme llevar.,Y... y voy a dejarme llevar.,And ... and I'm going to let myself carry.,optimism,moderate
"00:43:35,000","00:43:39,000","Ruth, ver las imágenes de Marieta te han hecho recapacitar.","Ruth, ver las imágenes de Marieta te han hecho recapacitar.","Ruth, seeing Marieta's images made you reconsider.",realization,moderate
"00:43:40,000","00:43:42,000",Le tendré que pedir disculpas en su video,Le tendré que pedir disculpas en su video,I will have to apologize in your video,remorse,moderate
"00:43:42,000","00:43:45,000",cuando hable con él por pensar que fue él.,cuando hable con él por pensar que fue él.,When I talk to him for thinking he was.,remorse,mild
"00:43:46,000","00:43:50,000","Y... como ya me ha quedado tocada, no quiero indagar más.","Y... como ya me ha quedado tocada, no quiero indagar más.","And ... as I have already been touched, I don't want to investigate anymore.",disappointment,moderate
"00:43:52,000","00:43:53,000",Marieta...,Marieta...,Marieta ...,neutral,neutral
"00:43:56,000","00:43:57,000",no hay más imágenes para ti.,no hay más imágenes para ti.,There are no more images for you.,neutral,neutral
"00:43:58,000","00:43:59,000",No se podían haber más.,No se podían haber más.,There could be no more.,neutral,neutral
