Start Time,End Time,Sentence,Corrected Sentence,Translation,Emotion,Intensity
"00:14:25,000","00:14:26,000","Thank you very much, man.","Thank you very much, man.","Thank you very much, man.",gratitude,mild
"00:14:26,000","00:14:29,000",All right.,All right.,All right.,neutral,neutral
"00:14:29,000","00:14:32,000",Kobe and the Lakers went on to win the finals in five games,Kobe and the Lakers went on to win the finals in five games,Kobe and the Lakers went on to win the finals in five games,pride,moderate
"00:14:32,000","00:14:34,000",after that Mexican high five.,after that Mexican high five.,after that Mexican high five.,amusement,mild
"00:14:34,000","00:14:36,000","Very well done, Guillermo.","Very well done, Guillermo.","Very well done, Guillermo.",approval,moderate
"00:14:36,000","00:14:38,000","Tonight, we're remembering Kobe Bryant, who","Tonight, we're remembering Kobe Bryant, who","Tonight, we're remembering Kobe Bryant, who",sadness,moderate
"00:14:38,000","00:14:40,000",always made time for us here.,always made time for us here.,always made time for us here.,admiration,moderate
"00:14:40,000","00:14:42,000",Two of those times were right after the Lakers,Two of those times were right after the Lakers,Two of those times were right after the Lakers,neutral,neutral
"00:14:42,000","00:14:44,000",won the NBA title.,won the NBA title.,won the NBA title.,pride,moderate
"00:14:44,000","00:14:46,000",This one was in 2009.,This one was in 2009.,This one was in 2009.,neutral,neutral
"00:14:46,000","00:14:48,000","And I love this interview, because even though he","And I love this interview, because even though he","And I love this interview, because even though he",admiration,moderate
"00:14:48,000","00:14:50,000","was very serious on the court, you","was very serious on the court, you","was very serious on the court, you",admiration,mild
"00:14:50,000","00:14:53,000",can see how much fun Kobe and his teammates,can see how much fun Kobe and his teammates,can see how much fun Kobe and his teammates,joy,moderate
"00:14:53,000","00:14:54,000","had off of it, too.","had off of it, too.","had off of it, too.",joy,moderate
"00:15:17,000","00:15:18,000","Oh, there you go.","Oh, there you go.","Oh, there you go.",neutral,neutral
"00:15:18,000","00:15:20,000",Look at that.,Look at that.,Look at that.,neutral,neutral
"00:15:20,000","00:15:24,000",That's a beautiful shot there.,That's a beautiful shot there.,That's a beautiful shot there.,admiration,mild
"00:15:24,000","00:15:25,000",There you go.,There you go.,There you go.,neutral,neutral
"00:15:29,000","00:15:31,000","Well, obviously, they weren't very excited.","Well, obviously, they weren't very excited.","Well, obviously, they weren't very excited.",amusement,mild
"00:15:38,000","00:15:39,000",There you go.,There you go.,There you go.,neutral,neutral
"00:15:39,000","00:15:41,000",I feel like we're back at Staples Center right now.,I feel like we're back at Staples Center right now.,I feel like we're back at Staples Center right now.,neutral,neutral
"00:15:41,000","00:15:44,000",What does it feel like to be the first African-American,What does it feel like to be the first African-American,What does it feel like to be the first African-American,curiosity,mild
"00:15:44,000","00:15:47,000",MVP of the NBA title?,MVP of the NBA title?,MVP of the NBA title?,curiosity,mild
"00:15:47,000","00:15:49,000","Well, it's a tremendous honor.","Well, it's a tremendous honor.","Well, it's a tremendous honor.",pride,moderate
"00:15:49,000","00:15:51,000","Well, congratulations, guys, to all of you.","Well, congratulations, guys, to all of you.","Well, congratulations, guys, to all of you.",approval,moderate
"00:15:51,000","00:15:52,000",That is a beautiful trophy.,That is a beautiful trophy.,That is a beautiful trophy.,admiration,mild
"00:15:52,000","00:15:53,000",Congratulations.,Congratulations.,Congratulations.,approval,moderate
"00:15:56,000","00:15:59,000",And I would like to see one of you weld that,And I would like to see one of you weld that,And I would like to see one of you weld that,amusement,mild
"00:15:59,000","00:16:01,000","onto the front of your car, you know?","onto the front of your car, you know?","onto the front of your car, you know?",amusement,mild
"00:16:01,000","00:16:03,000",Just as a foot ornament would be beautiful.,Just as a foot ornament would be beautiful.,Just as a foot ornament would be beautiful.,amusement,mild
"00:16:03,000","00:16:04,000","That's a good idea, actually.","That's a good idea, actually.","That's a good idea, actually.",approval,mild
"00:16:04,000","00:16:05,000",Driving around LA with that thing?,Driving around LA with that thing?,Driving around LA with that thing?,curiosity,mild
"00:16:05,000","00:16:06,000","Yeah, that's a good idea.","Yeah, that's a good idea.","Yeah, that's a good idea.",approval,mild
"00:16:06,000","00:16:09,000","You get to bring that around, like the Stanley Cup?","You get to bring that around, like the Stanley Cup?","You get to bring that around, like the Stanley Cup?",curiosity,mild
"00:16:09,000","00:16:11,000",Or does it go back to headquarters?,Or does it go back to headquarters?,Or does it go back to headquarters?,curiosity,mild
"00:16:11,000","00:16:13,000","No, it goes back to headquarters, unfortunately.","No, it goes back to headquarters, unfortunately.","No, it goes back to headquarters, unfortunately.",disappointment,mild
"00:16:13,000","00:16:14,000","It does, huh?","It does, huh?","It does, huh?",curiosity,mild
"00:16:14,000","00:16:16,000",Seems like you should get at least one of those,Seems like you should get at least one of those,Seems like you should get at least one of those,desire,mild
"00:16:16,000","00:16:17,000","to keep for yourself, no?","to keep for yourself, no?","to keep for yourself, no?",desire,mild
"00:16:17,000","00:16:18,000",We should.,We should.,We should.,neutral,neutral
"00:16:18,000","00:16:20,000","Well, you know, they do, like, mini versions of them, right?","Well, you know, they do, like, mini versions of them, right?","Well, you know, they do, like, mini versions of them, right?",curiosity,mild
"00:16:20,000","00:16:21,000","Yeah, the small joints.","Yeah, the small joints.","Yeah, the small joints.",neutral,neutral
"00:16:21,000","00:16:22,000","Yeah, we get, like, small ones.","Yeah, we get, like, small ones.","Yeah, we get, like, small ones.",neutral,neutral
"00:16:22,000","00:16:23,000","They don't offer them, though.","They don't offer them, though.","They don't offer them, though.",disappointment,mild
"00:16:23,000","00:16:24,000",They don't offer them.,They don't offer them.,They don't offer them.,disappointment,mild
"00:16:24,000","00:16:25,000",We have to purchase them.,We have to purchase them.,We have to purchase them.,annoyance,mild
"00:16:25,000","00:16:26,000",You do?,You do?,You do?,surprise,mild
"00:16:26,000","00:16:27,000",Really?,Really?,Really?,surprise,mild
"00:16:27,000","00:16:28,000",Really?,Really?,Really?,surprise,mild
"00:16:28,000","00:16:29,000",Yeah.,Yeah.,Yeah.,neutral,neutral
"00:16:29,000","00:16:30,000","Well, maybe you wouldn't.","Well, maybe you wouldn't.","Well, maybe you wouldn't.",neutral,neutral
"00:16:30,000","00:16:33,000",You got one when you left the arena.,You got one when you left the arena.,You got one when you left the arena.,neutral,neutral
"00:16:33,000","00:16:35,000","Yeah, well, we'll take up a collection.","Yeah, well, we'll take up a collection.","Yeah, well, we'll take up a collection.",optimism,mild
"00:16:35,000","00:16:38,000","I'm sure you guys deserve it, certainly.","I'm sure you guys deserve it, certainly.","I'm sure you guys deserve it, certainly.",approval,mild
"00:16:38,000","00:16:40,000","What a great, you know, well, it was a great,","What a great, you know, well, it was a great,","What a great, you know, well, it was a great,",admiration,mild
"00:16:40,000","00:16:41,000","well, the finals weren't so great.","well, the finals weren't so great.","well, the finals weren't so great.",disappointment,mild
"00:16:41,000","00:16:42,000",It was great for you guys.,It was great for you guys.,It was great for you guys.,admiration,mild
"00:16:42,000","00:16:44,000",It wasn't so great for the Orlando Magic.,It wasn't so great for the Orlando Magic.,It wasn't so great for the Orlando Magic.,disappointment,mild
"00:16:44,000","00:16:46,000","And, well, President Obama predicted","And, well, President Obama predicted","And, well, President Obama predicted",neutral,neutral
"00:16:46,000","00:16:48,000",you'd win in six games.,you'd win in six games.,you'd win in six games.,neutral,neutral
"00:16:48,000","00:16:49,000",Right.,Right.,Right.,neutral,neutral
"00:16:49,000","00:16:50,000",You won in five games.,You won in five games.,You won in five games.,neutral,neutral
"00:16:50,000","00:16:51,000",Right.,Right.,Right.,neutral,neutral
"00:16:51,000","00:16:55,000",Do you feel like you disappointed him?,Do you feel like you disappointed him?,Do you feel like you disappointed him?,curiosity,mild
"00:16:55,000","00:16:56,000",No.,No.,No.,neutral,neutral
"00:16:56,000","00:16:57,000","No, you don't?","No, you don't?","No, you don't?",curiosity,mild
"00:16:57,000","00:16:58,000",No.,No.,No.,neutral,neutral
"00:16:58,000","00:17:00,000","As long as the outcome remained consistent, it's all good.","As long as the outcome remained consistent, it's all good.","As long as the outcome remained consistent, it's all good.",relief,mild
"00:17:00,000","00:17:01,000",It's a funny thing.,It's a funny thing.,It's a funny thing.,amusement,mild
"00:17:01,000","00:17:03,000","You know, when Obama makes a prediction,","You know, when Obama makes a prediction,","You know, when Obama makes a prediction,",neutral,neutral
"00:17:03,000","00:17:05,000","the other team's coach always gets mad and goes,","the other team's coach always gets mad and goes,","the other team's coach always gets mad and goes,",amusement,mild
"00:17:05,000","00:17:07,000",he should have better things to be concentrating on,he should have better things to be concentrating on,he should have better things to be concentrating on,disapproval,mild
"00:17:07,000","00:17:09,000",than who's going to win the game.,than who's going to win the game.,than who's going to win the game.,neutral,neutral
"00:17:09,000","00:17:10,000",Were you guys excited?,Were you guys excited?,Were you guys excited?,curiosity,mild
"00:17:10,000","00:17:12,000","Because Obama's, like, almost always right about the,","Because Obama's, like, almost always right about the,","Because Obama's, like, almost always right about the,",admiration,mild
"00:17:12,000","00:17:14,000",he picked the Steelers in the Super Bowl.,he picked the Steelers in the Super Bowl.,he picked the Steelers in the Super Bowl.,neutral,neutral
"00:17:14,000","00:17:16,000","He's really, I mean, he could be a handicapper","He's really, I mean, he could be a handicapper","He's really, I mean, he could be a handicapper",admiration,mild
"00:17:16,000","00:17:17,000",if he wasn't the President.,if he wasn't the President.,if he wasn't the President.,amusement,mild
"00:17:17,000","00:17:18,000",What?,What?,What?,confusion,mild
"00:17:18,000","00:17:21,000","I mean, he's the President of the United States.","I mean, he's the President of the United States.","I mean, he's the President of the United States.",neutral,neutral
"00:17:21,000","00:17:22,000",What do you expect?,What do you expect?,What do you expect?,curiosity,mild
"00:17:22,000","00:17:23,000",I guess so.,I guess so.,I guess so.,neutral,neutral
"00:17:23,000","00:17:25,000","Now, Derek, you, off the record,","Now, Derek, you, off the record,","Now, Derek, you, off the record,",curiosity,mild
"00:17:25,000","00:17:27,000",said you should have been named MVP.,said you should have been named MVP.,said you should have been named MVP.,pride,moderate
"00:17:27,000","00:17:28,000","Oh, yeah.","Oh, yeah.","Oh, yeah.",neutral,neutral
"00:17:28,000","00:17:29,000","Oh, yeah.","Oh, yeah.","Oh, yeah.",neutral,neutral
"00:17:29,000","00:17:30,000","Oh, yeah.","Oh, yeah.","Oh, yeah.",neutral,neutral
"00:17:30,000","00:17:31,000","Oh, yeah.","Oh, yeah.","Oh, yeah.",neutral,neutral
"00:17:31,000","00:17:32,000","Oh, yeah.","Oh, yeah.","Oh, yeah.",neutral,neutral
"00:17:32,000","00:17:38,000",You said you'd been carrying Kobe too long.,You said you'd been carrying Kobe too long.,You said you'd been carrying Kobe too long.,annoyance,moderate
"00:17:39,000","00:17:43,000","But let's look at those three point shots in, I think,","But let's look at those three point shots in, I think,","But let's look at those three point shots in, I think,",curiosity,mild
"00:17:43,000","00:17:44,000",Game Four here.,Game Four here.,Game Four here.,neutral,neutral
"00:17:44,000","00:17:45,000",Yes!,Yes!,Yes!,excitement,intense
"00:17:45,000","00:17:46,000",Yes!,Yes!,Yes!,excitement,intense
"00:17:46,000","00:17:47,000",Yes!,Yes!,Yes!,excitement,intense
"00:17:47,000","00:17:48,000",Yes!,Yes!,Yes!,excitement,intense
"00:17:48,000","00:17:49,000",Yes!,Yes!,Yes!,excitement,intense
"00:17:49,000","00:17:50,000",Yes!,Yes!,Yes!,excitement,intense
"00:17:50,000","00:17:51,000",Yes!,Yes!,Yes!,excitement,intense
"00:17:51,000","00:17:52,000",Yes!,Yes!,Yes!,excitement,intense
"00:17:52,000","00:17:53,000",Yes!,Yes!,Yes!,excitement,intense
"00:17:53,000","00:17:54,000",Whoo!,Whoo!,Whoo!,excitement,intense
"00:17:54,000","00:17:55,000",Whoo!,Whoo!,Whoo!,excitement,intense
"00:17:55,000","00:17:56,000",See that elbow?,See that elbow?,See that elbow?,curiosity,mild
"00:17:56,000","00:17:57,000","Oh, yeah.","Oh, yeah.","Oh, yeah.",neutral,neutral
"00:17:57,000","00:17:58,000","Oh, yeah.","Oh, yeah.","Oh, yeah.",neutral,neutral
"00:17:58,000","00:17:59,000","Oh, yeah.","Oh, yeah.","Oh, yeah.",neutral,neutral
"00:17:59,000","00:18:00,000","Oh, my God.","Oh, my God.","Oh, my God.",surprise,moderate
"00:18:00,000","00:18:03,000","Hey, man, this boy, this guy right here,","Hey, man, this boy, this guy right here,","Hey, man, this boy, this guy right here,",admiration,moderate
"00:18:03,000","00:18:07,000","has a pair of the biggest cojones when it comes to shooting big shots, man.","has a pair of the biggest cojones when it comes to shooting big shots, man.","has a pair of the biggest cojones when it comes to shooting big shots, man.",admiration,intense
"00:18:07,000","00:18:09,000","I mean, it's ridiculous, man.","I mean, it's ridiculous, man.","I mean, it's ridiculous, man.",amusement,moderate
"00:18:09,000","00:18:11,000","I would think so, because you missed five three-point.","I would think so, because you missed five three-point.","I would think so, because you missed five three-point.",disappointment,moderate
"00:18:11,000","00:18:13,000",You were 0 for 5 so far.,You were 0 for 5 so far.,You were 0 for 5 so far.,disappointment,moderate
"00:18:13,000","00:18:15,000",But do you hesitate at all after missing?,But do you hesitate at all after missing?,But do you hesitate at all after missing?,curiosity,mild
"00:18:15,000","00:18:18,000","No, thanks for bringing up the bad part, Jimmy.","No, thanks for bringing up the bad part, Jimmy.","No, thanks for bringing up the bad part, Jimmy.",annoyance,mild
"00:18:18,000","00:18:21,000","But in a way, it's a good part, because if I went 0 for 5,","But in a way, it's a good part, because if I went 0 for 5,","But in a way, it's a good part, because if I went 0 for 5,",optimism,mild
"00:18:21,000","00:18:23,000","well, I would go 0 for 8, to be honest.","well, I would go 0 for 8, to be honest.","well, I would go 0 for 8, to be honest.",optimism,moderate
"00:18:23,000","00:18:25,000","But if I missed five in a row, I don't know,","But if I missed five in a row, I don't know,","But if I missed five in a row, I don't know,",neutral,neutral
"00:18:25,000","00:18:28,000","I think I'd just say, hey, somebody else, you get a chance.","I think I'd just say, hey, somebody else, you get a chance.","I think I'd just say, hey, somebody else, you get a chance.",neutral,neutral
"00:18:28,000","00:18:29,000","Yeah, no, no, no.","Yeah, no, no, no.","Yeah, no, no, no.",neutral,neutral
"00:18:29,000","00:18:32,000","These guys right here, man, and the guys that'll be out later,","These guys right here, man, and the guys that'll be out later,","These guys right here, man, and the guys that'll be out later,",caring,moderate
"00:18:32,000","00:18:35,000","they always with me, you know, so I'm always confident,","they always with me, you know, so I'm always confident,","they always with me, you know, so I'm always confident,",,
"00:18:35,000","00:18:38,000","no matter what's going on, I know I'm going to come through for my guys.","no matter what's going on, I know I'm going to come through for my guys.","no matter what's going on, I know I'm going to come through for my guys.",optimism,intense
"00:18:38,000","00:18:41,000","They've come through for me so many times, so.","They've come through for me so many times, so.","They've come through for me so many times, so.",gratitude,moderate
"00:18:41,000","00:18:46,000","Pal, you are from Spain, for those who don't know.","Pal, you are from Spain, for those who don't know.","Pal, you are from Spain, for those who don't know.",neutral,neutral
"00:18:46,000","00:18:47,000","Actually, you know what?","Actually, you know what?","Actually, you know what?",curiosity,mild
"00:18:47,000","00:18:48,000","There's something that's bothering me,","There's something that's bothering me,","There's something that's bothering me,",annoyance,mild
"00:18:48,000","00:18:52,000","because your name is like a Batman sound effect, Pal, you know?","because your name is like a Batman sound effect, Pal, you know?","because your name is like a Batman sound effect, Pal, you know?",amusement,mild
"00:18:52,000","00:18:54,000","I heard, yeah.","I heard, yeah.","I heard, yeah.",neutral,neutral
"00:18:54,000","00:18:55,000",I have something for you.,I have something for you.,I have something for you.,curiosity,mild
"00:18:55,000","00:18:56,000",I got you a letter L.,I got you a letter L.,I got you a letter L.,neutral,neutral
"00:18:56,000","00:19:00,000","You put it at the end of your name, and it could be like L for Lakers,","You put it at the end of your name, and it could be like L for Lakers,","You put it at the end of your name, and it could be like L for Lakers,",neutral,neutral
"00:19:00,000","00:19:01,000",and you would be Paul from now on.,and you would be Paul from now on.,and you would be Paul from now on.,neutral,neutral
"00:19:01,000","00:19:02,000",Right.,Right.,Right.,neutral,neutral
"00:19:02,000","00:19:04,000",And I think it'll make it easier for us as Americans.,And I think it'll make it easier for us as Americans.,And I think it'll make it easier for us as Americans.,neutral,neutral
"00:19:04,000","00:19:05,000","Yeah, but it keeps it unique, you know?","Yeah, but it keeps it unique, you know?","Yeah, but it keeps it unique, you know?",approval,mild
"00:19:05,000","00:19:06,000",I like that uniqueness.,I like that uniqueness.,I like that uniqueness.,approval,mild
"00:19:06,000","00:19:07,000",You like that uniqueness?,You like that uniqueness?,You like that uniqueness?,curiosity,mild
"00:19:07,000","00:19:08,000",I do.,I do.,I do.,approval,mild
"00:19:08,000","00:19:09,000","We got to clarify something, though.","We got to clarify something, though.","We got to clarify something, though.",neutral,neutral
"00:19:09,000","00:19:10,000",Yeah.,Yeah.,Yeah.,neutral,neutral
"00:19:10,000","00:19:12,000","We got to clarify something, because he won't say it, okay?","We got to clarify something, because he won't say it, okay?","We got to clarify something, because he won't say it, okay?",annoyance,mild
"00:19:12,000","00:19:14,000",His name is Pal.,His name is Pal.,His name is Pal.,neutral,neutral
"00:19:14,000","00:19:15,000",People keep calling him Paul.,People keep calling him Paul.,People keep calling him Paul.,annoyance,mild
"00:19:15,000","00:19:16,000",They call him all sorts of stuff.,They call him all sorts of stuff.,They call him all sorts of stuff.,annoyance,mild
"00:19:16,000","00:19:17,000",His name is not Paul.,His name is not Paul.,His name is not Paul.,annoyance,mild
"00:19:17,000","00:19:18,000",It's Pal.,It's Pal.,It's Pal.,neutral,neutral
"00:19:18,000","00:19:19,000",Thank you.,Thank you.,Thank you.,gratitude,mild
"00:19:19,000","00:19:20,000","Yes, it is.","Yes, it is.","Yes, it is.",neutral,neutral
"00:19:20,000","00:19:21,000",Everybody denounces me.,Everybody denounces me.,Everybody denounces me.,disappointment,moderate
"00:19:21,000","00:19:22,000",It's not saying Paul.,It's not saying Paul.,It's not saying Paul.,annoyance,mild
"00:19:22,000","00:19:25,000","Yeah, well, that's why I'm saying if you just take this L,","Yeah, well, that's why I'm saying if you just take this L,","Yeah, well, that's why I'm saying if you just take this L,",neutral,neutral
"00:19:25,000","00:19:26,000",it could be Paul.,it could be Paul.,it could be Paul.,neutral,neutral
"00:19:26,000","00:19:28,000","Yeah, you know, it makes it a lot easier, though.","Yeah, you know, it makes it a lot easier, though.","Yeah, you know, it makes it a lot easier, though.",neutral,neutral
"00:19:28,000","00:19:29,000",It does make it easier.,It does make it easier.,It does make it easier.,neutral,neutral
"00:19:29,000","00:19:31,000","It does, but, you know, I like it without the L.","It does, but, you know, I like it without the L.","It does, but, you know, I like it without the L.",approval,mild
"00:19:31,000","00:19:32,000",That's the way it is.,That's the way it is.,That's the way it is.,neutral,neutral
"00:19:32,000","00:19:33,000",That's the way it is.,That's the way it is.,That's the way it is.,neutral,neutral
"00:19:33,000","00:19:34,000",Paul Gasol?,Paul Gasol?,Paul Gasol?,curiosity,mild
"00:19:34,000","00:19:35,000",Paul Gasol.,Paul Gasol.,Paul Gasol.,neutral,neutral
"00:19:35,000","00:19:36,000",Paul Gasol.,Paul Gasol.,Paul Gasol.,neutral,neutral
"00:19:36,000","00:19:37,000",It would rhyme.,It would rhyme.,It would rhyme.,neutral,neutral
"00:19:37,000","00:19:38,000",What happens when you get back to Spain?,What happens when you get back to Spain?,What happens when you get back to Spain?,curiosity,mild
"00:19:38,000","00:19:39,000",Will there be a parade for you?,Will there be a parade for you?,Will there be a parade for you?,curiosity,mild
"00:19:39,000","00:19:40,000",Did they watch?,Did they watch?,Did they watch?,curiosity,mild
"00:19:40,000","00:19:41,000",Everybody watch the series?,Everybody watch the series?,Everybody watch the series?,curiosity,mild
"00:19:41,000","00:19:42,000",They did watch.,They did watch.,They did watch.,neutral,neutral
"00:19:42,000","00:19:44,000","I'm so proud of everybody in Spain,","I'm so proud of everybody in Spain,","I'm so proud of everybody in Spain,",pride,moderate
"00:19:44,000","00:19:46,000",because it's so hard with the time change and everything.,because it's so hard with the time change and everything.,because it's so hard with the time change and everything.,neutral,neutral
"00:19:46,000","00:19:49,000","At 3, 4 in the morning, wake up and actually watch the game","At 3, 4 in the morning, wake up and actually watch the game","At 3, 4 in the morning, wake up and actually watch the game",admiration,moderate
"00:19:49,000","00:19:50,000",and watch us play.,and watch us play.,and watch us play.,neutral,neutral
"00:19:50,000","00:19:53,000",They were so excited and so thrilled that we were able to,They were so excited and so thrilled that we were able to,They were so excited and so thrilled that we were able to,excitement,intense
"00:19:53,000","00:19:55,000","get this amazing trophy, so.","get this amazing trophy, so.","get this amazing trophy, so.",joy,intense
"00:19:55,000","00:19:58,000",Will women there be enthusiastic about making love to you,Will women there be enthusiastic about making love to you,Will women there be enthusiastic about making love to you,curiosity,mild
"00:19:58,000","00:20:00,000","when you get back, Paul?","when you get back, Paul?","when you get back, Paul?",curiosity,mild
"00:20:00,000","00:20:16,000","I'm not quite sure about that, but there's a way to find out, I don't even have to question.","I'm not quite sure about that, but there's a way to find out, I don't even have to question.","I'm not quite sure about that, but there's a way to find out, I don't even have to question.",amusement,mild
"00:20:16,000","00:20:23,000","And Trevor, you played for the Orlando Magic, does it make it more fun to beat them since","And Trevor, you played for the Orlando Magic, does it make it more fun to beat them since","And Trevor, you played for the Orlando Magic, does it make it more fun to beat them since",curiosity,mild
"00:20:23,000","00:20:26,000","these are the guys you played with, or is it less fun?","these are the guys you played with, or is it less fun?","these are the guys you played with, or is it less fun?",curiosity,mild
"00:20:26,000","00:20:28,000",Come on Trevor!,Come on Trevor!,Come on Trevor!,neutral,neutral
"00:20:29,000","00:20:34,000","Man, to beat them, especially on their home floor, was an indescribable feeling.","Man, to beat them, especially on their home floor, was an indescribable feeling.","Man, to beat them, especially on their home floor, was an indescribable feeling.",excitement,intense
"00:20:34,000","00:20:35,000",Really?,Really?,Really?,curiosity,mild
"00:20:35,000","00:20:36,000",Yeah.,Yeah.,Yeah.,neutral,neutral
