Start Time,End Time,sentence,sub-emotion,Intensity,emotion
"00:40:34,000","00:40:36,000",Congratulations. Super tank.,approval,mild,unknown
"00:40:36,000","00:40:40,000","Tony, thank you. And please stick to the statement.",gratitude,mild,unknown
"00:40:41,000","00:40:44,000","Well, Master Visser. It's over again.",relief,mild,unknown
"00:40:44,000","00:40:48,000","It is of course very nice, such a judicial statement, but you never even think ...",approval,mild,unknown
"00:40:48,000","00:40:51,000","In fact, they just need a kick under the butt.",annoyance,moderate,unknown
"00:40:51,000","00:40:56,000","Yes, I think so, but that is for rights cross -border behavior.",neutral,neutral,neutral
"00:40:56,000","00:40:58,000",So you can only think and not do that.,neutral,neutral,neutral
"00:40:58,000","00:41:00,000",Are you watching at home and you also think your neighbors ...,curiosity,mild,unknown
"00:41:00,000","00:41:03,000",Just need a huge kick under the butt?,annoyance,moderate,unknown
"00:41:03,000","00:41:05,000",Then don't wait any longer. Mail or call us.,,,unknown
"00:41:05,000","00:41:07,000",Then we come to you with great pleasure.,optimism,mild,unknown
"00:41:07,000","00:41:09,000","Yes, well. We solve it.",neutral,neutral,neutral
"00:41:09,000","00:41:14,000",That's how it is. Thank you for watching again. A very nice evening. See you next week.,gratitude,mild,unknown
"00:41:14,000","00:41:15,000",And.,neutral,neutral,neutral
"00:41:15,000","00:41:17,000","Where are we parked, by the way?",curiosity,mild,unknown
"00:41:17,000","00:41:21,000","Well, it was just as little space. I have set a parking ban, but ...",neutral,neutral,neutral
"00:41:21,000","00:41:24,000","No. No, that doesn't matter, because then you will not be maintained.",neutral,neutral,neutral
"00:41:24,000","00:41:25,000",Above. No.,neutral,neutral,neutral
"00:41:25,000","00:41:28,000",No. Guard. Sir. Sir.,neutral,neutral,neutral
"00:41:28,000","00:41:29,000",We are just fifteen minutes.,neutral,neutral,neutral
