Start Time,End Time,sentence,sub-emotion,Intensity,emotion
"00:13:42,000","00:13:45,000",in which the parking problem was discussed.,neutral,neutral,neutral
"00:13:45,000","00:13:49,000",Because there is just too little parking space for all houses.,neutral,neutral,neutral
"00:13:49,000","00:13:53,000",And the other residents have no problems with it ...,neutral,neutral,neutral
"00:13:53,000","00:13:55,000",That the cars are parked double.,neutral,neutral,neutral
"00:13:55,000","00:13:58,000",But have you received permission? Yes. Written.,neutral,neutral,neutral
"00:13:58,000","00:14:01,000",So you can stand from the association of owners?,curiosity,mild,unknown
"00:14:01,000","00:14:03,000","Yes, that's right.",neutral,neutral,neutral
"00:14:03,000","00:14:05,000",But then there is also a camper. Yes.,neutral,neutral,neutral
"00:14:05,000","00:14:08,000","And that is sometimes here, I understood. That's right.",neutral,neutral,neutral
"00:14:08,000","00:14:11,000",The internal rules are included ...,neutral,neutral,neutral
"00:14:11,000","00:14:15,000","That caravans, campers otherwise ...",neutral,neutral,neutral
"00:14:15,000","00:14:19,000",may be parked in front of the door for 10 days.,neutral,neutral,neutral
"00:14:19,000","00:14:22,000","Okay, well, the neighbor is not aware of that ...",confusion,mild,unknown
"00:14:22,000","00:14:24,000",Or she does not agree.,disapproval,mild,unknown
"00:14:24,000","00:14:27,000",It is clear that she does not agree with it.,disapproval,moderate,unknown
"00:14:29,000","00:14:32,000","According to the neighbor, she received permission from the VVE ...",neutral,neutral,neutral
"00:14:32,000","00:14:35,000",To park the cars double outside the profession.,neutral,neutral,neutral
"00:14:35,000","00:14:39,000","And according to her, the camper can be there for 10 days in a row.",neutral,neutral,neutral
"00:14:39,000","00:14:41,000",She came to live here.,neutral,neutral,neutral
"00:14:41,000","00:14:44,000",She went directly to the VVE board ...,neutral,neutral,neutral
"00:14:44,000","00:14:47,000",And she has been making her own regulations.,disapproval,moderate,unknown
"00:14:47,000","00:14:51,000",And that should not be drawn up.,disapproval,moderate,unknown
"00:14:51,000","00:14:56,000",And that hand clapping under the table through my chef's head.,confusion,moderate,unknown
"00:14:56,000","00:14:59,000","She did a handy clap? Yes, I have that suspicion.",,,unknown
"00:14:59,000","00:15:02,000","When they herself on the board ... yes, she's still there.",neutral,neutral,neutral
"00:15:02,000","00:15:04,000","Oh, she is a board member. Yes. Nice and easy.",neutral,neutral,neutral
"00:15:04,000","00:15:06,000","Yes, that's easy.",neutral,neutral,neutral
"00:15:06,000","00:15:09,000",He is sitting exactly at you.,neutral,neutral,neutral
"00:15:09,000","00:15:11,000","And that is not possible, that is not allowed.",disapproval,moderate,unknown
"00:15:13,000","00:15:15,000",Then we have the following problem.,neutral,neutral,neutral
"00:15:15,000","00:15:17,000","You can put it down, you know.",neutral,neutral,neutral
"00:15:17,000","00:15:19,000","Really, wait, look. You would have scolded.",disapproval,mild,unknown
"00:15:19,000","00:15:21,000","And not just a bit too. Yes, that's right.",neutral,neutral,neutral
"00:15:21,000","00:15:24,000","Oh, you are very honest about that. Yes, that's right.",approval,mild,unknown
"00:15:24,000","00:15:26,000",What did you say to her?,curiosity,mild,unknown
"00:15:26,000","00:15:29,000",Something the dogs don't like. Yes.,neutral,neutral,neutral
"00:15:29,000","00:15:33,000",But she tried to drive me here twice in the parking lot.,anger,intense,unknown
"00:15:34,000","00:15:36,000",As in Expres? Yes.,surprise,moderate,neutral
"00:15:36,000","00:15:38,000",The weather was free.,neutral,neutral,neutral
"00:15:38,000","00:15:40,000","There are benches here, we were on that.",neutral,neutral,neutral
"00:15:40,000","00:15:43,000",My daughter and me. My husband was busy with garden maintenance.,neutral,neutral,neutral
"00:15:43,000","00:15:46,000",And he asked me if I would like to get a container.,neutral,neutral,neutral
"00:15:46,000","00:15:49,000",So I got up. I walk away from those benches.,neutral,neutral,neutral
"00:15:49,000","00:15:52,000",And she comes up with the parking lot full of gas.,anger,intense,unknown
"00:15:52,000","00:15:56,000",And then? She stopped on such a piece for me.,confusion,moderate,unknown
"00:15:57,000","00:15:59,000","Are you shocked? Yes, very bad.",fear,intense,negative
"00:15:59,000","00:16:03,000",And you think she did that on purpose?,curiosity,mild,unknown
"00:16:03,000","00:16:05,000","Oh, I know for sure.",realization,mild,unknown
"00:16:06,000","00:16:10,000",According to the neighbors you have tried a few times ...,curiosity,mild,unknown
"00:16:10,000","00:16:12,000","Yes, I just say it ...",neutral,neutral,neutral
"00:16:12,000","00:16:14,000",to drive the neighbor.,anger,moderate,unknown
"00:16:14,000","00:16:17,000",I never tried.,neutral,neutral,neutral
"00:16:17,000","00:16:20,000",But you already hated her.,anger,moderate,unknown
"00:16:20,000","00:16:23,000","Well, sympathy is different. Yes.",neutral,neutral,neutral
"00:16:23,000","00:16:26,000",So you just had ...,neutral,neutral,neutral
"00:16:26,000","00:16:28,000","I never did, no.",neutral,neutral,neutral
"00:16:28,000","00:16:31,000",But how does she get there? Because she has that feeling.,confusion,mild,unknown
"00:16:31,000","00:16:35,000","When she sees me coming, she doesn't go a step to the left.",annoyance,moderate,unknown
"00:16:35,000","00:16:38,000","No, she just comes to the right. And then I stop.",annoyance,moderate,unknown
"00:16:38,000","00:16:41,000","And why does she do that? Yes, just from I am hit.",confusion,moderate,unknown
"00:16:41,000","00:16:43,000",Because I also heard that rumor.,annoyance,moderate,unknown
"00:16:43,000","00:16:46,000",You think she wants to put you in a bad light.,,,unknown
"00:16:46,000","00:16:50,000","Yes, there is a pressure on that. And she is only angry with that.",anger,moderate,unknown
"00:16:51,000","00:16:56,000",The neighbor says that you are the one who comes to her.,neutral,neutral,neutral
"00:16:56,000","00:16:58,000",That is absolutely not true.,disapproval,intense,unknown
"00:16:58,000","00:17:01,000",She drives towards me and I freeze.,fear,intense,negative
"00:17:01,000","00:17:04,000",That's because I have Addison's disease.,neutral,neutral,neutral
"00:17:04,000","00:17:06,000",And what does Addison's disease entail?,curiosity,mild,unknown
"00:17:06,000","00:17:08,000",I don't make a stress hormone ...,neutral,neutral,neutral
"00:17:08,000","00:17:12,000",Which makes a stressful situation approaching me ...,fear,moderate,negative
"00:17:12,000","00:17:14,000","You feel no fear? No, I freeze.",fear,intense,negative
"00:17:14,000","00:17:16,000",Don't you think of a car? No.,confusion,mild,unknown
"00:17:16,000","00:17:18,000",You remain standing? I couldn't go anywhere.,,,unknown
"00:17:18,000","00:17:21,000",I could only ... what now?,confusion,moderate,unknown
"00:17:21,000","00:17:25,000",Such an almost collision ensures that I get very sick physically ...,fear,intense,negative
"00:17:25,000","00:17:28,000",And therefore lying in bed for days ...,sadness,moderate,unknown
"00:17:28,000","00:17:32,000",Because my body has to recover from the shock moment ...,disappointment,moderate,unknown
"00:17:32,000","00:17:34,000",To call it that.,neutral,neutral,neutral
"00:17:36,000","00:17:39,000","So she almost hit you, you say.",surprise,moderate,neutral
"00:17:39,000","00:17:41,000",Have more things happened?,curiosity,mild,unknown
"00:17:41,000","00:17:44,000",Actually everything. She photographs everything we do.,annoyance,moderate,unknown
"00:17:45,000","00:17:49,000",If we have the camper here and I put the car next to it ...,neutral,neutral,neutral
"00:17:49,000","00:17:53,000","To release my groceries, she is already taking pictures.",annoyance,moderate,unknown
"00:17:53,000","00:17:55,000",As soon as you don't adhere to the parking rules ...,disapproval,mild,unknown
"00:17:55,000","00:17:57,000","Yes, she is immediately ready with the camera.",annoyance,moderate,unknown
"00:17:57,000","00:17:59,000",Then she is ready? Yes.,neutral,neutral,neutral
"00:17:59,000","00:18:02,000","And do you find that annoying? Absolutely, yes.",annoyance,intense,unknown
"00:18:02,000","00:18:04,000",I'm completely done with it.,annoyance,intense,unknown
"00:18:04,000","00:18:07,000","I am not at all violent, absolutely not.",,,unknown
"00:18:07,000","00:18:10,000",But for her I will hoe with love for 60 hours.,love,mild,unknown
"00:18:10,000","00:18:13,000",That is a tough statement. Yes.,approval,mild,unknown
"00:18:13,000","00:18:15,000",The u do there. Yes.,neutral,neutral,neutral
"00:18:15,000","00:18:18,000",The neighbor just has to stop her whining.,annoyance,intense,unknown
"00:18:18,000","00:18:21,000","We really stand in the way of no one, we are nobody to a burden.",neutral,neutral,neutral
"00:18:21,000","00:18:26,000","And we just want to have peace, also outside in the parking lot.",desire,moderate,unknown
"00:18:26,000","00:18:28,000",She's just a nagging.,annoyance,intense,unknown
"00:18:30,000","00:18:32,000",Master Visser will come here soon.,neutral,neutral,neutral
"00:18:32,000","00:18:34,000",And he comes to investigate the case well.,optimism,mild,unknown
"00:18:34,000","00:18:37,000","Because that seems clear to me, something has to happen.",optimism,moderate,unknown
"00:18:37,000","00:18:39,000",What is your requirement for Meester Visser?,curiosity,mild,unknown
"00:18:39,000","00:18:42,000",A total contact and access ban.,optimism,intense,unknown
"00:18:42,000","00:18:47,000",And that she no longer drives the parking lot here as she is driving now.,disapproval,moderate,unknown
"00:18:47,000","00:18:50,000",And otherwise the CBR must go and see.,optimism,moderate,unknown
"00:18:50,000","00:18:51,000",I thank you.,gratitude,mild,unknown
"00:18:51,000","00:18:55,000",I'll come and get you again when the master has arrived with a hat.,neutral,neutral,neutral
"00:18:55,000","00:18:58,000","Just take it easy, then I'll come and get you again.",caring,mild,unknown
"00:18:58,000","00:19:00,000",Totally good. See you soon.,neutral,neutral,neutral
"00:19:03,000","00:19:05,000",I find it interesting today.,curiosity,mild,unknown
"00:19:05,000","00:19:08,000",Because we are dealing with a typical case.,curiosity,mild,unknown
"00:19:08,000","00:19:09,000",Oergol our parking.,neutral,neutral,neutral
"00:19:09,000","00:19:12,000",So I think many people are sitting on the edge of their seats at home.,excitement,moderate,positive
"00:19:12,000","00:19:16,000",Because parking is a hot issue in many neighborhoods in the Netherlands.,realization,mild,unknown
"00:19:16,000","00:19:18,000",And talking about hot ...,neutral,neutral,neutral
"00:19:18,000","00:19:22,000",It is spicy between the two ladies. They like each other raw.,disapproval,moderate,unknown
"00:19:22,000","00:19:26,000",Teunie is the type of rules are rules and you have to stick to that.,neutral,neutral,neutral
"00:19:26,000","00:19:28,000","While Olga says, don't be so difficult.",annoyance,mild,unknown
"00:19:28,000","00:19:31,000","And above all, don't nag about everything.",annoyance,mild,unknown
"00:19:31,000","00:19:33,000",That is why I am happy that Master Visser is on the way.,relief,moderate,unknown
"00:19:33,000","00:19:37,000",He has taken a surveyor to see how large that parking space is.,curiosity,mild,unknown
"00:19:37,000","00:19:40,000",And since the ladies have mainly communicated lately ...,neutral,neutral,neutral
"00:19:40,000","00:19:42,000",Via the chairman of the VVE ...,neutral,neutral,neutral
"00:19:42,000","00:19:46,000",It seems like a good idea to talk to each other again just face-to-face.,optimism,moderate,unknown
"00:19:46,000","00:19:48,000",And of course we will do that in the parking lot.,neutral,neutral,neutral
"00:19:49,000","00:19:51,000",Teunie is already ready.,neutral,neutral,neutral
"00:19:51,000","00:19:53,000","Yes, how do I think I am waiting for you?",curiosity,mild,unknown
"00:19:53,000","00:19:55,000","Olga, are you also added?",curiosity,mild,unknown
"00:19:55,000","00:19:56,000",I'm waiting for you.,neutral,neutral,neutral
"00:19:56,000","00:19:57,000",Very good.,approval,mild,unknown
"00:19:57,000","00:20:00,000","If you come there, we greet each other.",neutral,neutral,neutral
"00:20:00,000","00:20:06,000","yet? No, rather not. We don't greet each other for years, I am not going to start with it either, no.",annoyance,moderate,unknown
"00:20:06,000","00:20:13,000","Teunie, what disturbs you so incredibly at the parking behavior of the neighbors? Now it's all",curiosity,moderate,unknown
"00:20:13,000","00:20:19,000","So short together, but normally they are halfway and now that own car is also a lot",annoyance,mild,unknown
"00:20:19,000","00:20:27,000","Further back and that is not that normal. You say, I find it annoying that they are outside the parking space",annoyance,moderate,unknown
"00:20:27,000","00:20:34,000","parking. Precisely. What do you have regulations for here? Because, you say, it's not allowed. No, it's a board member,",disapproval,moderate,unknown
"00:20:34,000","00:20:42,000","That is an exemplary function. A, ik ben al heel lang geen bestuurslid meer. B, according to the regulations",neutral,neutral,neutral
"00:20:42,000","00:20:47,000",we had permission to place two cars in a row because nobody is bothered by it,neutral,neutral,neutral
"00:20:47,000","00:20:53,000","has. Yes, we immediately responded that that causes us. Would you perhaps one",annoyance,mild,unknown
"00:20:53,000","00:20:59,000","can take driving lessons? Do you have to see how much place we have here. Zij moet haar eigen aanpassen, niet ik.",annoyance,moderate,unknown
"00:20:59,000","00:21:07,000","Mrs. Low to complain, she nags for whining and she tries a whole family",annoyance,moderate,unknown
"00:21:07,000","00:21:15,000","to help the buttons. It is not for nothing that VVE is that same VVE ... Mrs. Duijzer, we are now against me.",annoyance,moderate,unknown
"00:21:15,000","00:21:23,000","That you ventilate everything through the VvE, that is your problem. Why are you doing that? Why do you keep directly? No, not me, because I'm already like that",annoyance,moderate,unknown
"00:21:23,000","00:21:29,000",Often scolded by Mrs. Olga. Why do you scold? Because Mrs. A tried to wear me twice,anger,moderate,unknown
"00:21:29,000","00:21:37,000","to ride. B, Mrs. has twice disturbing her middle finger to me. You have to listen, this is my parking space.",anger,intense,unknown
"00:21:37,000","00:21:44,000","It is your parking space, we will not be on that. And I don't want to be threatened by you on my own parking space when I empty my car",anger,intense,unknown
"00:21:44,000","00:21:48,000","to make. And you have done that often enough. The moment she raises the middle finger, then you are mine.",anger,intense,unknown
"00:21:49,000","00:21:56,000",And what happened then? Because then you parked the car here. Then she was just allowed to get out. And then? I let three laps walk back the car.,annoyance,moderate,unknown
"00:21:56,000","00:22:06,000","As scolding? Correct. And what did you call then? I don't know. Yes, I just had to die twice. You have to die, you.",anger,intense,unknown
"00:22:06,000","00:22:13,000","In any case, I said that if she lights her middle finger one more time, I both break the legs.",anger,intense,unknown
"00:22:14,000","00:22:20,000","It is crazy. I first have that in the upper room. You know that, still crazy?",annoyance,moderate,unknown
"00:22:22,000","00:22:26,000","Then we have the photos. Yes, we no longer want to end up with your camera.",annoyance,moderate,unknown
"00:22:26,000","00:22:32,000",This is a common ground of all eight owners. May I not take photos here?,curiosity,mild,unknown
"00:22:32,000","00:22:37,000",It is also my site where I live and where I live. We can't get out of this. No.,annoyance,moderate,unknown
"00:22:37,000","00:22:40,000",That is why I am very happy that Master Visser has arrived.,relief,moderate,unknown
"00:22:40,000","00:22:45,000","But if the cars are just parked in the compartments ... if you just take driving lessons, it will also be solved.",neutral,neutral,neutral
"00:22:45,000","00:22:50,000","Master Visser, very welcome. You are a outbreak. You are the owner of the car.",neutral,neutral,neutral
"00:22:50,000","00:22:54,000","Good day. Just quiet, quiet for a moment. Yes, you can. Silent.",neutral,neutral,neutral
"00:22:54,000","00:22:57,000",May I introduce you to Master Frank Visser? Good morning.,neutral,neutral,neutral
"00:22:57,000","00:23:00,000","Thank you for being there, Master Visser. Well, you're already busy I hear.",gratitude,mild,unknown
"00:23:00,000","00:23:03,000","Yes, opposite me too. Hello. You too? Yes.",neutral,neutral,neutral
"00:23:03,000","00:23:07,000","This is Mrs. Olga, lives above. This is Mrs. Teunie, who lives above.",neutral,neutral,neutral
"00:23:08,000","00:23:14,000","And it's about misery, about parked cars and about a lot of mutual battle in this parking lot.",annoyance,moderate,unknown
"00:23:14,000","00:23:16,000",Okay. Can I do something for you?,neutral,neutral,neutral
"00:23:16,000","00:23:21,000","Yes, we also want to take a look about the camper. That is also the only thing to participate.",curiosity,mild,unknown
"00:23:21,000","00:23:24,000","Is a mammoth. Yes, because we see if we get it in between.",curiosity,mild,unknown
"00:23:24,000","00:23:29,000","Yes, I am well insured. I'm going to get it. Yes, is good.",neutral,neutral,neutral
"00:23:29,000","00:23:31,000",Succes.,approval,mild,unknown
"00:23:31,000","00:23:37,000","What we are going to do now, I want to know exactly how far the own parking space is.",curiosity,mild,unknown
"00:23:37,000","00:23:40,000",But then those cars have to leave. Can those cars go for a while?,neutral,neutral,neutral
"00:23:40,000","00:23:42,000","Yes, the Kunnen away. Yes?",neutral,neutral,neutral
"00:23:42,000","00:23:43,000",Us.,neutral,neutral,neutral
"00:23:45,000","00:23:47,000",That says the mammoth.,neutral,neutral,neutral
"00:23:47,000","00:23:50,000","You have never really seen it, but big.",surprise,mild,neutral
"00:23:54,000","00:23:56,000",Instantly blood nerve.,nervousness,moderate,unknown
"00:23:56,000","00:24:01,000","But we're going to fix it. We're just going to do it. I can do that, this?",optimism,mild,unknown
"00:24:01,000","00:24:02,000",What do you think at home?,curiosity,mild,unknown
"00:24:02,000","00:24:06,000",We asked the surveyors to come.,neutral,neutral,neutral
"00:24:06,000","00:24:07,000","Well, it's one.",neutral,neutral,neutral
"00:24:07,000","00:24:08,000",Good day.,neutral,neutral,neutral
"00:24:08,000","00:24:09,000",Day.,neutral,neutral,neutral
"00:24:09,000","00:24:17,000","I asked you to come, because the own parking space is drawn in the splissing regulations.",neutral,neutral,neutral
"00:24:17,000","00:24:19,000",That's right. Then you can also measure it.,approval,mild,unknown
"00:24:19,000","00:24:21,000",That's right too. Zou je dat voor mij kunnen doen?,neutral,neutral,neutral
"00:24:21,000","00:24:22,000",We can certainly do that for you.,approval,mild,unknown
"00:24:22,000","00:24:24,000","Well, then I also walk along. Is that complicated?",curiosity,mild,unknown
"00:24:24,000","00:24:26,000",No.,neutral,neutral,neutral
"00:24:26,000","00:24:27,000",I'm ready.,neutral,neutral,neutral
"00:24:28,000","00:24:35,000",MUSIC,neutral,neutral,neutral
"00:24:35,000","00:24:36,000","Girl, keep your mouth shut.",annoyance,moderate,unknown
"00:24:36,000","00:24:42,000",Exciting music,excitement,mild,positive
"00:24:42,000","00:24:43,000",The air conditioning.,neutral,neutral,neutral
"00:24:43,000","00:24:49,000",Exciting music,excitement,mild,positive
"00:24:49,000","00:24:50,000",Mirrors.,neutral,neutral,neutral
"00:24:50,000","00:24:55,000",Exciting music,excitement,mild,positive
"00:24:55,000","00:24:56,000",The handbrake.,neutral,neutral,neutral
"00:24:57,000","00:24:58,000",Not unimportant.,neutral,neutral,neutral
"00:24:58,000","00:24:59,000",Lesson one.,neutral,neutral,neutral
"00:25:01,000","00:25:03,000",According to the drawing he starts at the wall.,neutral,neutral,neutral
"00:25:03,000","00:25:04,000",Great.,approval,mild,unknown
"00:25:04,000","00:25:06,000",Tile path is not owned.,neutral,neutral,neutral
"00:25:06,000","00:25:12,000",Exciting music,excitement,mild,positive
"00:25:12,000","00:25:13,000",Great.,approval,mild,unknown
"00:25:13,000","00:25:14,000",And he ends here.,neutral,neutral,neutral
"00:25:14,000","00:25:15,000",Exactly where those tiles stop.,neutral,neutral,neutral
"00:25:15,000","00:25:16,000",That's right.,approval,mild,unknown
"00:25:16,000","00:25:17,000",Take care.,caring,mild,unknown
"00:25:17,000","00:25:19,000",And how far do you hook now?,curiosity,mild,unknown
"00:25:19,000","00:25:22,000","Mr. Visser, there is a parking space on the Land Registry.",neutral,neutral,neutral
"00:25:22,000","00:25:23,000",And.,neutral,neutral,neutral
"00:25:23,000","00:25:24,000",And here the tiles.,neutral,neutral,neutral
"00:25:24,000","00:25:28,000","Yes, but there is also a drawing and it is registered in the Land Registry.",neutral,neutral,neutral
"00:25:28,000","00:25:37,000","And that drawing indicates what the piece of land is, what is exclusively ownership of this apartment.",neutral,neutral,neutral
"00:25:37,000","00:25:39,000","Yes, but tile path is not owned.",neutral,neutral,neutral
"00:25:39,000","00:25:40,000",Your parking space ...,neutral,neutral,neutral
"00:25:40,000","00:25:42,000","Madam, I'm going to decide today.",optimism,moderate,unknown
"00:25:42,000","00:25:43,000",I am for that.,approval,mild,unknown
"00:25:45,000","00:25:53,000","So this is actually, according to the cadastral drawing, this is it that belongs exclusively with this apartment.",neutral,neutral,neutral
"00:25:53,000","00:25:54,000",That's right.,approval,mild,unknown
"00:25:55,000","00:25:58,000","Well, then we'll see if the camper fits in.",curiosity,mild,unknown
"00:25:58,000","00:25:59,000",And.,neutral,neutral,neutral
"00:25:59,000","00:26:00,000",We are on the move.,neutral,neutral,neutral
"00:26:01,000","00:26:03,000",We are on the move.,neutral,neutral,neutral
"00:26:07,000","00:26:08,000","Jesus, that's one thing.",surprise,moderate,neutral
"00:26:10,000","00:26:11,000",Very big.,surprise,mild,neutral
"00:26:12,000","00:26:13,000",Victor!,surprise,moderate,neutral
"00:26:17,000","00:26:19,000","I put it with my nose in it, huh!",surprise,moderate,neutral
"00:26:19,000","00:26:20,000",Victor!,neutral,neutral,neutral
"00:26:20,000","00:26:22,000",I put it in with the nose.,neutral,neutral,neutral
"00:26:22,000","00:26:23,000","Yes, is good.",approval,mild,unknown
"00:26:23,000","00:26:24,000",With the ass is ...,neutral,neutral,neutral
"00:26:24,000","00:26:27,000",Can you cram there between that white compartment?,curiosity,mild,unknown
"00:26:27,000","00:26:28,000",Sure.,neutral,neutral,neutral
"00:26:28,000","00:26:29,000","But fast, because it dries up.",fear,moderate,negative
"00:26:29,000","00:26:30,000",And.,neutral,neutral,neutral
"00:26:30,000","00:26:31,000",I already have a whole bottle ...,neutral,neutral,neutral
"00:26:31,000","00:26:32,000","This is a mammoth, huh.",surprise,mild,neutral
"00:26:32,000","00:26:33,000",It is not that fast.,neutral,neutral,neutral
"00:26:33,000","00:26:36,000","No, but it is just like with that free kick, isn't it?",curiosity,mild,unknown
"00:26:36,000","00:26:38,000","If that takes too long, the referee must ...",neutral,neutral,neutral
"00:26:38,000","00:26:39,000","Oh, wait a minute.",realization,mild,unknown
"00:26:40,000","00:26:45,000","Yes, he must be the other way around than the door is on this side.",confusion,mild,unknown
"00:26:47,000","00:26:48,000",Come on.,neutral,neutral,neutral
"00:26:48,000","00:26:49,000",And.,neutral,neutral,neutral
"00:26:49,000","00:26:51,000",Do I still have room on the facade?,curiosity,mild,unknown
"00:26:51,000","00:26:52,000",I keep an eye on him.,caring,mild,unknown
"00:26:52,000","00:26:53,000","Come on, come on.",excitement,moderate,positive
"00:26:53,000","00:26:54,000","I have, I have, I.",neutral,neutral,neutral
"00:26:54,000","00:26:55,000",Continue.,neutral,neutral,neutral
"00:26:55,000","00:26:56,000",And then for the ...,neutral,neutral,neutral
"00:26:56,000","00:26:57,000","Hup, hup.",neutral,neutral,neutral
"00:26:57,000","00:26:58,000",From back in it.,neutral,neutral,neutral
"00:26:58,000","00:26:59,000","That's how it looks good, huh.",approval,mild,unknown
"00:26:59,000","00:27:00,000","How should I go backwards, Tony?",confusion,mild,unknown
"00:27:00,000","00:27:01,000","Yes, there is always the door on that side.",neutral,neutral,neutral
"00:27:01,000","00:27:02,000",It is always here.,neutral,neutral,neutral
"00:27:02,000","00:27:03,000","Yes, but that is not important for the test, is it?",curiosity,mild,unknown
"00:27:03,000","00:27:04,000",The surveyor.,neutral,neutral,neutral
"00:27:04,000","00:27:05,000",Error 500 (Server Error)!!1500.That’s an error.There was an error. Please try again later.That’s all we know.,annoyance,moderate,unknown
"00:27:05,000","00:27:06,000",Protrudes.,neutral,neutral,neutral
"00:27:06,000","00:27:07,000","Yes, we are going to do.",optimism,mild,unknown
"00:27:07,000","00:27:08,000","He walks to and here, so that's ...",neutral,neutral,neutral
"00:27:08,000","00:27:09,000","Yes, he walks to and here, so that's ...",neutral,neutral,neutral
"00:27:09,000","00:27:10,000","Yes, he walks to and here, so that's ...",neutral,neutral,neutral
